periodico,news_date,year,month,day,page,ed,evento,event_code,ubicacion,has_sequia,agrocultura,ganaderia,hidrologia,energia,latitud,longitud
extremadura,18/09/1923,1923,9,18,1,,Calor,S,Casas de Don Antonio,True,1,0,0,0,39.23584424716719,-6.291346324578782
extremadura,21/09/1923,1923,9,21,2,,,,,False,0,0,0,0,,
extremadura,06/10/1923,1923,10,6,3,,,,,False,0,0,0,0,,
extremadura,10/10/1923,1923,10,10,3,,Lluvia,F,Aldeanueva del Camino,True,0,0,0,0,40.25935163824006,-5.930394923796403
extremadura,07/06/1924,1924,6,7,4,,Sequía,S,Aldeanueva del Camino,True,1,0,0,0,40.25935163824006,-5.930394923796403
extremadura,10/06/1924,1924,6,10,3,,,,,False,0,0,0,0,,
extremadura,14/05/1925,1925,5,14,1,,Sequía,S,Coria,True,1,0,0,0,39.98807734718899,-6.536615926256122
extremadura,15/05/1925,1925,5,15,2,,,,,False,0,0,0,0,,
extremadura,26/09/1926,1926,9,26,1,,,,,False,0,0,0,0,,
extremadura,28/09/1926,1926,9,28,5,,Sequía,S,Extremadura,True,0,1,0,0,,
extremadura,11/10/1926,1926,10,11,1,,Sequía,S,Cáceres,True,0,0,0,0,39.47753910519658,-6.377428325189714
extremadura,30/10/1926,1926,10,30,4,,,,,False,0,0,0,0,,
extremadura,06/04/1929,1929,4,6,4,,,,,False,0,0,0,0,,
extremadura,10/04/1929,1929,4,10,2,,,,,False,0,0,0,0,,
extremadura,10/04/1929,1929,4,10,3,,,,,False,0,0,0,0,,
extremadura,10/04/1929,1929,4,10,4,,,S,Ceclavín,True,1,0,0,0,39.82256665830346,-6.772740417050985
extremadura,11/04/1929,1929,4,11,1,,,,,False,0,0,0,0,,
extremadura,11/04/1929,1929,4,11,4,,Lluvia,F,Aliseda,True,0,0,0,0,39.423077972418,-6.694034836374631
extremadura,12/04/1929,1929,4,12,1,,,,,False,0,0,0,0,,
extremadura,12/04/1929,1929,4,12,2,,,,,False,0,0,0,0,,
extremadura,12/04/1929,1929,4,12,4,,Nieve,F,Garrovillas de Alconétar,True,0,0,0,0,39.710601150536334,-6.550028984680883
extremadura,13/04/1929,1929,4,13,4,,Lluvia,S,Navas del Madroño,True,0,0,0,0,39.62227900373277,-6.653402851935974
extremadura,16/04/1929,1929,4,16,1,,Lluvia,S,Cáceres,True,0,0,0,0,39.47753910519658,-6.377428325189714
extremadura,18/04/1929,1929,4,18,4,,Sequía,S,Torrejoncillo,True,0,0,0,0,39.89735427146394,-6.467041427683078
extremadura,19/04/1929,1929,4,19,3,,,,,False,0,0,0,0,,
extremadura,19/04/1929,1929,4,19,4,,Sequía,S,Don Benito,True,0,0,0,0,38.95620783267387,-5.859801918815306
extremadura,22/04/1929,1929,4,22,1,,,,,False,0,0,0,0,,
extremadura,23/04/1929,1929,4,23,4,,,,,False,0,0,0,0,,
extremadura,24/04/1929,1929,4,24,3,,,,,False,0,0,0,0,,
extremadura,24/04/1929,1929,4,24,4,,,,,False,0,0,0,0,,
extremadura,25/04/1929,1929,4,25,4,,Lluvia,S,Garciaz,True,0,0,0,0,39.41281517332435,-5.628272506215836
extremadura,26/04/1929,1929,4,26,6,,Sequía,S,Navas del Madroño,True,1,0,0,0,39.62227900373277,-6.653402851935974
extremadura,30/04/1929,1929,4,30,4,,Lluvia,N,Navas del Madroño,True,0,0,0,0,39.62227900373277,-6.653402851935974
extremadura,30/04/1929,1929,4,30,8,,,S,Torrejoncillo,True,0,0,0,0,39.89735427146394,-6.467041427683078
extremadura,02/05/1929,1929,5,2,4,,,,,False,0,0,0,0,,
extremadura,04/05/1929,1929,5,4,4,,,S,Sierra de Fuentes,True,0,0,0,0,39.43842582975502,-6.272247239888582
extremadura,14/10/1929,1929,10,14,2,,Sequía,S,Badajoz,True,0,0,0,0,38.871034753836994,-6.975421049278072
extremadura,14/10/1929,1929,10,14,3,,,,,False,0,0,0,0,,
extremadura,01/11/1929,1929,11,1,3,,,,,False,0,0,0,0,,
extremadura,13/11/1929,1929,11,13,3,,Lluvia,F,Badajoz,True,0,1,0,0,38.871034753836994,-6.975421049278072
extremadura,27/03/1930,1930,3,27,3,,,,,False,0,0,0,0,,
extremadura,27/03/1930,1930,3,27,4,,Lluvia,F,Navas del Madroño,True,0,0,0,0,39.62227900373277,-6.653402851935974
extremadura,02/05/1930,1930,5,2,3,,,,,False,0,0,0,0,,
extremadura,02/05/1930,1930,5,2,4,,Sequía,S,Guijo de Coria,True,0,0,0,0,40.10079553515424,-6.463317632474197
extremadura,11/04/1933,1933,4,11,2,,Sequía,S,Cáceres,True,0,0,0,0,39.47753910519658,-6.377428325189714
hoy,16/04/1933,1933,4,16,7,BAD,Sequía,S,Castuera,True,0,0,0,0,38.72435378925819,-5.545060273541743
extremadura,21/04/1933,1933,4,21,4,,,,,False,0,0,0,0,,
hoy,21/04/1933,1933,4,21,8,BAD,,,,False,0,0,0,0,,
extremadura,02/05/1933,1933,5,2,8,,Sequía,S,Miajadas,True,1,0,0,0,39.15079487053819,-5.909483992989726
extremadura,03/05/1933,1933,5,3,6,,,,,False,0,0,0,0,,
hoy,03/05/1933,1933,5,3,6,BAD,Sequía,S,Campanario,True,1,0,0,0,38.8625254789591,-5.619221562693182
hoy,03/05/1933,1933,5,3,6,BAD,Sequía,S,Fregenal de la Sierra,True,0,0,0,0,38.1687749610116,-6.653923848007927
extremadura,04/05/1933,1933,5,4,7,,Lluvia,S,Aliseda,True,0,0,0,0,39.423077972418,-6.694034836374631
hoy,05/05/1933,1933,5,5,7,BAD,,,,False,0,0,0,0,,
hoy,06/05/1933,1933,5,6,5,BAD,,,,False,0,0,0,0,,
hoy,12/05/1933,1933,5,12,5,BAD,,,,False,0,0,0,0,,
hoy,12/05/1933,1933,5,12,6,BAD,Sequía,S,Campanario,True,1,0,0,0,38.8625254789591,-5.619221562693182
hoy,14/05/1933,1933,5,14,3,BAD,,S,Extremadura,True,0,0,0,0,,
hoy,14/05/1933,1933,5,14,6,BAD,Sequía,S,Castuera,True,1,0,0,0,38.72435378925819,-5.545060273541743
hoy,18/05/1933,1933,5,18,6,BAD,Sequía,S,Don Benito,True,0,0,0,0,38.95620783267387,-5.859801918815306
hoy,19/05/1933,1933,5,19,2,BAD,,,,False,0,0,0,0,,
hoy,19/05/1933,1933,5,19,6,BAD,,S,Santa Marta,True,0,0,0,0,38.61413697887768,-6.628145382540433
extremadura,20/05/1933,1933,5,20,4,,Sequía,S,Cáceres,True,0,0,0,0,39.47753910519658,-6.377428325189714
hoy,21/05/1933,1933,5,21,4,BAD,,,,False,0,0,0,0,,
hoy,21/05/1933,1933,5,21,6,BAD,Sequía,S,Granja de Torrehermosa,True,0,0,0,0,38.309434946037456,-5.596554823533248
extremadura,23/05/1933,1933,5,23,5,,,,,False,0,0,0,0,,
hoy,23/05/1933,1933,5,23,6,BAD,,,,False,0,0,0,0,,
hoy,25/05/1933,1933,5,25,6,BAD,Sequía,S,Campanario,True,1,0,0,0,38.8625254789591,-5.619221562693182
hoy,26/05/1933,1933,5,26,6,BAD,,,,False,0,0,0,0,,
extremadura,27/05/1933,1933,5,27,3,,,,,False,0,0,0,0,,
hoy,28/05/1933,1933,5,28,2,BAD,,,,False,0,0,0,0,,
hoy,28/05/1933,1933,5,28,10,BAD,,,,False,0,0,0,0,,
extremadura,12/08/1933,1933,8,12,3,,,,,False,0,0,0,0,,
extremadura,14/06/1933,1933,8,14,8,,Sequía,S,Extremadura,True,0,0,0,0,,
extremadura,19/08/1933,1933,8,19,3,,,,,False,0,0,0,0,,
extremadura,22/08/1933,1933,8,22,7,,,S,Extremadura,True,0,0,1,0,,
hoy,30/08/1933,1933,8,30,4,BAD,,,,False,0,0,0,0,,
hoy,31/08/1933,1933,8,31,6,BAD,,S,Campanario,True,0,0,1,0,38.8625254789591,-5.619221562693182
hoy,01/09/1933,1933,9,1,6,BAD,,S,Don Benito,True,0,0,1,0,38.95620783267387,-5.859801918815306
hoy,08/09/1933,1933,9,8,7,BAD,,,,False,0,0,0,0,,
hoy,10/09/1933,1933,9,10,12,BAD,,,,False,0,0,0,0,,
extremadura,12/09/1933,1933,9,12,6,,Sequía,S,Hervás,True,1,0,0,0,40.2729367154098,-5.858512295669394
hoy,13/09/1933,1933,9,13,6,BAD,,S,Don Benito,True,0,0,0,0,38.95620783267387,-5.859801918815306
hoy,14/09/1933,1933,9,14,4,BAD,,,,False,0,0,0,0,,
extremadura,14/09/1933,1933,9,14,8,,,,,False,0,0,0,0,,
hoy,26/09/1933,1933,9,26,3,BAD,,,,False,0,0,0,0,,
hoy,27/09/1933,1933,9,27,8,BAD,,S,Cabeza del Buey,True,0,0,0,0,38.72344255696252,-5.218974555781275
hoy,27/09/1933,1933,9,27,9,BAD,,S,Cabeza del Buey,True,0,0,0,0,38.72344255696252,-5.218974555781275
hoy,27/09/1933,1933,9,27,10,BAD,,S,Almendralejo,True,1,0,0,0,38.68340240841623,-6.407120160184139
hoy,29/09/1933,1933,9,29,7,BAD,,,,False,0,0,0,0,,
hoy,08/10/1933,1933,10,8,6,BAD,,S,"Puebla de Sancho Pérez, Medina de las Torres",True,1,0,0,0,38.36895406234557,-6.406310284057792
hoy,11/10/1933,1933,10,11,8,BAD,,,,False,0,0,0,0,,
hoy,18/02/1934,1934,2,18,8,BAD,,,,False,0,0,0,0,,
hoy,22/02/1934,1934,2,22,8,BAD,,S,Extremadura,True,0,0,0,0,,
hoy,01/03/1934,1934,3,1,2,BAD,,,,False,0,0,0,0,,
hoy,02/03/1934,1934,3,2,1,BAD,,,,False,0,0,0,0,,
hoy,03/03/1934,1934,3,3,6,BAD,,S,Montijo,True,0,0,0,0,38.907705486472,-6.616032456181741
hoy,07/03/1934,1934,3,7,2,BAD,Sequía,S,Cáceres,True,1,1,0,0,39.47753910519658,-6.377428325189714
hoy,07/03/1934,1934,3,7,4,BAD,Sequía,S,Badajoz,True,0,0,0,0,38.871034753836994,-6.975421049278072
hoy,07/03/1934,1934,3,7,6,BAD,,,,False,0,0,0,0,,
hoy,09/03/1934,1934,3,9,6,BAD,Sequía,S,Zahinos,True,1,1,0,0,38.33155821023243,-6.953137496204532
hoy,09/03/1934,1934,3,9,6,BAD,Sequía,S,Cáceres,True,0,0,0,0,39.47753910519658,-6.377428325189714
hoy,09/03/1934,1934,3,9,7,BAD,Sequía,S,Badajoz,True,0,0,0,0,38.871034753836994,-6.975421049278072
hoy,10/03/1934,1934,3,10,6,BAD,Sequía,S,Alconchel,True,0,0,0,0,38.51718718067185,-7.071719477495805
hoy,10/03/1934,1934,3,10,6,BAD,Sequía,S,Fregenal de la Sierra,True,0,0,0,0,38.1687749610116,-6.653923848007927
hoy,11/03/1934,1934,3,11,6,BAD,,,,False,0,0,0,0,,
hoy,15/03/1934,1934,3,15,6,BAD,Sequía,S,Alburquerque,True,0,0,0,0,39.22057581234303,-7.000473530868876
hoy,15/03/1934,1934,3,15,6,BAD,Sequía,N,Alburquerque,True,0,0,0,0,39.22057581234303,-7.000473530868876
hoy,17/03/1934,1934,3,17,5,BAD,,,,False,0,0,0,0,,
hoy,18/03/1934,1934,3,18,2,BAD,,,,False,0,0,0,0,,
hoy,23/03/1934,1934,3,23,5,BAD,,,,False,0,0,0,0,,
hoy,23/03/1934,1934,3,23,8,BAD,,,,False,0,0,0,0,,
hoy,25/03/1934,1934,3,25,3,BAD,,,,False,0,0,0,0,,
hoy,27/03/1934,1934,3,27,3,BAD,,,,False,0,0,0,0,,
extremadura,03/04/1934,1934,4,3,4,,,S,Torrejoncillo,True,0,0,0,0,39.89735427146394,-6.467041427683078
extremadura,04/04/1934,1934,4,4,4,,Lluvia,F,Navas del Madroño,True,0,0,0,0,39.62227900373277,-6.653402851935974
extremadura,11/04/1934,1934,4,11,6,,,,,False,0,0,0,0,,
extremadura,18/04/1934,1934,4,18,1,,,,,False,0,0,0,0,,
extremadura,12/09/1934,1934,9,12,4,,Sequía,S,Coria,True,1,0,0,0,39.98807734718899,-6.536615926256122
extremadura,28/09/1934,1934,9,28,5,,,,,False,0,0,0,0,,
hoy,04/11/1934,1934,11,4,1,BAD,,,,False,0,0,0,0,,
hoy,06/11/1934,1934,11,6,3,BAD,Sequía,S,Badajoz,True,0,0,0,0,38.871034753836994,-6.975421049278072
extremadura,17/11/1934,1934,11,17,4,,,,,False,0,0,0,0,,
extremadura,22/11/1934,1934,11,22,4,,Sequía,S,Torre de Don Miguel,True,1,0,0,0,40.22404580992888,-6.57697242327817
extremadura,15/12/1934,1934,12,15,1,,,,,False,0,0,0,0,,
extremadura,17/12/1934,1934,12,17,4,,Sequía,S,Valencia de Alcántara,True,0,0,0,0,39.41026172958824,-7.244173555257091
hoy,00/01/1935,1935,1,0,16,,,,,False,0,0,0,0,,
hoy,00/01/1935,1935,1,0,24,,,S,Extremadura,True,0,0,0,0,,
hoy,00/01/1935,1935,1,0,32,,,S,"Castilla la Nueva, Extremadura",True,1,0,0,0,,
hoy,00/01/1935,1935,1,0,108,,,,,False,0,0,0,0,,
hoy,26/02/1935,1935,2,0,193,,Sequía,S,Torremayor,True,0,0,0,0,38.90082756523822,-6.537183789516002
hoy,00/02/1935,1935,2,0,208,,,,,False,0,0,0,0,,
hoy,01/03/1935,1935,3,0,6,,Sequía,S,Villafranca de los Barros,True,0,0,0,0,38.55953602827336,-6.3328763558379855
hoy,00/03/1935,1935,3,0,56,,,,,False,0,0,0,0,,
hoy,00/03/1935,1935,3,0,75,,,,,False,0,0,0,0,,
hoy,12/03/1935,1935,3,0,80,,Sequía,S,Guareña,True,0,0,0,0,38.861609304666935,-6.102742017099397
hoy,00/03/1935,1935,3,0,126,,,,,False,0,0,0,0,,
hoy,27/03/1935,1935,3,0,193,,Sequía,S,Castuera,True,1,1,0,0,38.72435378925819,-5.545060273541743
hoy,00/04/1935,1935,4,0,12,,,,,False,0,0,0,0,,
hoy,00/04/1935,1935,4,0,17,,,S,Fregenal,True,1,1,0,0,38.1687749610116,-6.653923848007927
hoy,00/04/1935,1935,4,0,19,,,,,False,0,0,0,0,,
hoy,00/04/1935,1935,4,0,21,,,,,False,0,0,0,0,,
hoy,00/04/1935,1935,4,0,27,,,,,False,0,0,0,0,,
hoy,05/04/1935,1935,4,0,33,,Sequía,S,Fregenal de la Sierra,True,0,0,0,0,38.1687749610116,-6.653923848007927
hoy,06/04/1935,1935,4,0,41,,Sequía,S,Castuera,True,1,0,0,0,38.72435378925819,-5.545060273541743
hoy,00/04/1935,1935,4,0,46,,,,,False,0,0,0,0,,
hoy,00/04/1935,1935,4,0,47,,,,,False,0,0,0,0,,
hoy,00/04/1935,1935,4,0,49,,,,,False,0,0,0,0,,
hoy,00/04/1935,1935,4,0,50,,,,,False,0,0,0,0,,
hoy,00/04/1935,1935,4,0,65,,,,,False,0,0,0,0,,
hoy,11/04/1935,1935,4,0,73,,Sequía,S,Castuera,True,1,0,0,0,38.72435378925819,-5.545060273541743
hoy,00/04/1935,1935,4,0,74,,,S,Badajoz,True,1,0,0,0,38.871034753836994,-6.975421049278072
hoy,00/04/1935,1935,4,0,78,,,S,Almendralejo,True,0,0,0,0,38.68340240841623,-6.407120160184139
hoy,00/04/1935,1935,4,0,79,,,,,False,0,0,0,0,,
hoy,12/04/1935,1935,4,0,81,,Sequía,S,Guareña,True,1,0,0,0,38.861609304666935,-6.102742017099397
hoy,12/04/1935,1935,4,0,81,,Sequía,S,Don Benito,True,1,0,0,0,38.95620783267387,-5.859801918815306
hoy,16/04/1935,1935,4,0,108,,Sequía,S,Hornachos,True,0,0,0,0,38.55436861055067,-6.068637317399573
hoy,00/04/1935,1935,4,0,115,,,,,False,0,0,0,0,,
hoy,00/04/1935,1935,4,0,117,,,S,Campanario,True,0,0,0,0,38.8625254789591,-5.619221562693182
hoy,17/04/1935,1935,4,0,117,,Sequía,S,Monterrubio de la Serena,True,1,0,0,0,38.58810686082703,-5.44369146408694
hoy,00/04/1935,1935,4,0,119,,,S,"Extremadura, Andalucía",True,0,0,0,0,,
hoy,00/04/1935,1935,4,0,139,,,,,False,0,0,0,0,,
hoy,00/04/1935,1935,4,0,141,,,S,Badajoz,True,0,0,0,0,38.871034753836994,-6.975421049278072
hoy,21/04/1935,1935,4,0,146,,Sequía,S,Castuera,True,1,0,0,0,38.72435378925819,-5.545060273541743
hoy,00/04/1935,1935,4,0,147,,,,,False,0,0,0,0,,
hoy,23/04/1935,1935,4,0,149,,Sequía,S,,True,0,0,0,0,,
hoy,00/04/1935,1935,4,0,151,,,,,False,0,0,0,0,,
hoy,23/04/1935,1935,4,0,157,,Sequía,S,Fregenal de la Sierra,True,0,0,0,0,38.1687749610116,-6.653923848007927
hoy,00/04/1935,1935,4,0,165,,,S,Villanueva de la Serena,True,0,0,0,0,38.97505965210177,-5.798683762870277
hoy,00/04/1935,1935,4,0,184,,,,,False,0,0,0,0,,
hoy,00/04/1935,1935,4,0,188,,,,,False,0,0,0,0,,
hoy,27/04/1935,1935,4,0,189,,Sequía,S,Cabeza del Buey,True,1,0,0,0,38.72344255696252,-5.218974555781275
hoy,00/04/1935,1935,4,0,196,,,,,False,0,0,0,0,,
hoy,28/04/1935,1935,4,0,197,,Sequía,S,Castuera,True,1,1,0,0,38.72435378925819,-5.545060273541743
hoy,00/04/1935,1935,4,0,200,,,,,False,0,0,0,0,,
hoy,00/04/1935,1935,4,0,206,,,,,False,0,0,0,0,,
hoy,00/05/1935,1935,5,0,76,,,S,Badajoz,True,0,0,0,0,38.871034753836994,-6.975421049278072
hoy,14/05/1935,1935,5,0,107,,Sequía,S,Castuera,True,0,0,0,0,38.72435378925819,-5.545060273541743
hoy,00/05/1935,1935,5,0,173,,,,,False,0,0,0,0,,
hoy,24/05/1935,1935,5,0,185,,Sequía,S,Castuera,True,1,0,0,0,38.72435378925819,-5.545060273541743
hoy,00/05/1935,1935,5,0,229,,,,,False,0,0,0,0,,
hoy,00/05/1935,1935,5,0,231,,,,,False,0,0,0,0,,
hoy,00/10/1935,1935,10,0,13,,,,,False,0,0,0,0,,
hoy,00/10/1935,1935,10,0,18,,,,,False,0,0,0,0,,
hoy,00/10/1935,1935,10,0,40,,,S,Zafra,True,0,1,0,0,38.42187307146895,-6.416697978031944
hoy,00/10/1935,1935,10,0,40,,,S,Zafra,True,0,0,1,0,38.42187307146895,-6.416697978031944
hoy,00/10/1935,1935,10,0,62,,,,,False,0,0,0,0,,
hoy,00/10/1935,1935,10,0,130,,,,,False,0,0,0,0,,
hoy,00/10/1935,1935,10,0,162,,,S,Talarrubias,True,1,0,0,0,39.03696000610293,-5.235095525747936
hoy,00/10/1935,1935,10,0,188,,,S,Zahínos,True,0,0,1,0,38.33155821023243,-6.953137496204532
hoy,02/11/1935,1935,11,0,9,,Sequía,S,Badajoz,True,0,0,0,0,38.871034753836994,-6.975421049278072
hoy,00/11/1935,1935,11,0,55,,,,,False,0,0,0,0,,
hoy,20/11/1935,1935,11,0,149,,Sequía,S,Torremayor,True,0,0,0,0,38.90082756523822,-6.537183789516002
hoy,00/11/1935,1935,11,0,166,,,,,False,0,0,0,0,,
hoy,28/11/1935,1935,11,0,209,,Sequía,S,Zahinos,True,0,0,0,0,38.33155821023243,-6.953137496204532
hoy,00/11/1935,1935,11,0,220,,,,,False,0,0,0,0,,
hoy,00/01/1936,1936,1,0,14,,,S,"Extremadura, Andalucía",True,1,0,0,0,,
hoy,00/01/1936,1936,1,0,17,,,S,"Extremadura, Ciudad Real",True,1,0,0,0,38.98512948509242,-3.92575081113341
hoy,00/01/1936,1936,1,0,122,,,,,False,0,0,0,0,,
hoy,00/01/1936,1936,1,0,236,,,,,False,0,0,0,0,,
extremadura,25/03/1938,1938,3,25,2,,Sequía,S,Plasencia,True,0,0,0,0,40.03535535252543,-6.089134757182878
extremadura,26/03/1938,1938,3,26,4,,,,,False,0,0,0,0,,
extremadura,07/04/1938,1938,4,7,3,,,,,False,0,0,0,0,,
extremadura,20/04/1938,1938,4,20,3,,Sequía,S,Plasencia,True,0,0,0,0,40.03535535252543,-6.089134757182878
extremadura,09/08/1938,1938,8,9,3,,Sequía,S,Plasencia,True,0,0,1,0,40.03535535252543,-6.089134757182878
extremadura,26/08/1938,1938,8,26,4,,,,,False,0,0,0,0,,
hoy,00/09/1939,1939,9,0,17,,,,,False,0,0,0,0,,
hoy,00/09/1939,1939,9,0,68,,,S,Extremadura,True,1,0,0,0,,
extremadura,02/05/1940,1940,5,2,3,,,,,False,0,0,0,0,,
extremadura,10/05/1940,1940,5,10,2,,,S,Cáceres,True,0,0,0,0,39.47753910519658,-6.377428325189714
extremadura,21/09/1940,1940,9,21,1,,,,,False,0,0,0,0,,
extremadura,26/09/1940,1940,9,26,6,,,S,Serradilla (Cáceres),True,0,0,0,0,39.82891014852736,-6.139142666346821
extremadura,03/10/1940,1940,10,3,5,,,,,False,0,0,0,0,,
extremadura,14/10/1940,1940,10,14,2,,Lluvia,F,Hervás,True,0,0,1,0,40.2729367154098,-5.858512295669394
extremadura,02/12/1940,1940,12,2,3,,Sequía,S,Serradilla,True,0,0,0,0,39.82891014852736,-6.139142666346821
extremadura,16/12/1940,1940,12,16,5,,,,,False,0,0,0,0,,
extremadura,25/09/1941,1941,9,25,1,,Sequía,S,Cáceres,True,1,0,0,0,39.47753910519658,-6.377428325189714
extremadura,27/09/1941,1941,9,27,2,,,,,False,0,0,0,0,,
hoy,04/11/1941,1941,11,4,1,BAD,,,,False,0,0,0,0,,
extremadura,07/11/1941,1941,11,7,1,,Sequía,F,Cáceres,True,0,0,0,0,39.47753910519658,-6.377428325189714
extremadura,10/11/1941,1941,11,10,3,,,,,False,0,0,0,0,,
hoy,15/11/1941,1941,11,15,3,CAC,Sequía,S,Zahinos,True,0,0,0,0,38.33155821023243,-6.953137496204532
extremadura,25/11/1941,1941,11,25,3,,,,,False,0,0,0,0,,
extremadura,25/11/1941,1941,11,25,4,,,S,Cáceres,True,0,0,0,0,39.47753910519658,-6.377428325189714
hoy,10/04/1943,1943,4,10,1,BAD,,,,False,0,0,0,0,,
hoy,17/04/1943,1943,4,17,6,BAD,sequía,S,Badajoz,True,0,0,0,0,38.871034753836994,-6.975421049278072
extremadura,07/07/1943,1943,7,7,3,,Sequía,S,España,True,1,0,0,0,,
extremadura,18/07/1943,1943,7,18,3,,,,,False,0,0,0,0,,
hoy,01/02/1944,1944,2,1,5,BAD,,,,False,0,0,0,0,,
extremadura,02/02/1944,1944,2,2,2,,,,,False,0,0,0,0,,
hoy,03/02/1944,1944,2,3,1,BAD,,,,False,0,0,0,0,,
hoy,06/02/1944,1944,2,6,2,BAD,sequía,S,Badajoz,True,0,0,0,0,38.871034753836994,-6.975421049278072
extremadura,07/02/1944,1944,2,7,3,,,,,False,0,0,0,0,,
extremadura,08/02/1944,1944,2,8,1,,Sequía,S,España,True,0,0,0,1,,
extremadura,08/02/1944,1944,2,8,2,,,,,False,0,0,0,0,,
extremadura,09/02/1944,1944,2,9,2,,,S,Cáceres,True,1,1,1,0,39.47753910519658,-6.377428325189714
extremadura,09/02/1944,1944,2,9,4,,,S,"Andalucía, Extremadura",True,0,0,0,1,,
extremadura,10/02/1944,1944,2,10,2,,Sequía,S,España,True,0,0,0,0,,
extremadura,10/02/1944,1944,2,10,2,,,S,Cáceres,True,0,0,0,0,39.47753910519658,-6.377428325189714
extremadura,11/02/1944,1944,2,11,1,,,,,False,0,0,0,0,,
hoy,11/02/1944,1944,2,11,1,CAC,sequía,S,Cáceres,True,0,0,0,0,39.47753910519658,-6.377428325189714
extremadura,12/02/1944,1944,2,12,1,,,S,Cáceres,True,0,0,0,0,39.47753910519658,-6.377428325189714
extremadura,14/02/1944,1944,2,14,1,,,,,False,0,0,0,0,,
extremadura,14/02/1944,1944,2,14,2,,Lluvia,F,Cáceres,True,1,0,1,0,39.47753910519658,-6.377428325189714
extremadura,14/02/1944,1944,2,14,2,,Lluvia,F,Cáceres,True,0,0,0,0,39.47753910519658,-6.377428325189714
extremadura,14/02/1944,1944,2,14,3,,,,,False,0,0,0,0,,
extremadura,15/02/1944,1944,2,15,1,,,,,False,0,0,0,0,,
extremadura,15/02/1944,1944,2,15,2,,Lluvia,F,Cáceres,True,0,0,0,0,39.47753910519658,-6.377428325189714
extremadura,15/02/1944,1944,2,15,3,,,,,False,0,0,0,0,,
extremadura,15/02/1944,1944,2,15,4,,,,,False,0,0,0,0,,
extremadura,16/02/1944,1944,2,16,2,,Lluvia,F,Cáceres,True,0,0,0,0,39.47753910519658,-6.377428325189714
extremadura,17/02/1944,1944,2,17,1,,,,,False,0,0,0,0,,
extremadura,17/02/1944,1944,2,17,4,,,,,False,0,0,0,0,,
extremadura,18/02/1944,1944,2,18,2,,Lluvia,F,Cáceres,True,0,0,0,0,39.47753910519658,-6.377428325189714
extremadura,19/02/1944,1944,2,19,2,,Lluvia,F,Cáceres,True,0,0,0,0,39.47753910519658,-6.377428325189714
extremadura,19/02/1944,1944,2,19,4,,,,,False,0,0,0,0,,
extremadura,21/02/1944,1944,2,21,1,,,,,False,0,0,0,0,,
extremadura,21/02/1944,1944,2,21,2,,Lluvia,F,Cáceres,True,0,0,0,0,39.47753910519658,-6.377428325189714
extremadura,21/02/1944,1944,2,21,4,,,,,False,0,0,0,0,,
extremadura,22/02/1944,1944,2,22,2,,Lluvia,S,Cáceres,True,0,0,0,0,39.47753910519658,-6.377428325189714
extremadura,22/02/1944,1944,2,22,3,,Lluvia,S,Montánchez,True,0,0,0,0,39.225334934846686,-6.152295055697602
extremadura,22/02/1944,1944,2,22,4,,,S,Cáceres,True,0,0,0,0,39.47753910519658,-6.377428325189714
hoy,22/02/1944,1944,2,22,6,CAC,,,,False,0,0,0,0,,
extremadura,23/02/1944,1944,2,23,2,,,,,False,0,0,0,0,,
extremadura,23/02/1944,1944,2,23,4,,,,,False,0,0,0,0,,
extremadura,24/02/1944,1944,2,24,2,,,,,False,0,0,0,0,,
extremadura,25/02/1944,1944,2,25,2,,,,,False,0,0,0,0,,
extremadura,26/02/1944,1944,2,26,2,,Lluvia,F,Cáceres,True,0,0,0,0,39.47753910519658,-6.377428325189714
extremadura,28/02/1944,1944,2,28,1,,Frío,S,Cáceres,True,0,0,0,0,39.47753910519658,-6.377428325189714
extremadura,29/02/1944,1944,2,29,3,,Lluvia,F,Arroyo de la Luz,True,0,0,0,0,39.48424151476158,-6.583900547775354
extremadura,29/02/1944,1944,2,29,4,,,,,False,0,0,0,0,,
hoy,29/02/1944,1944,2,29,4,CAC,sequía,S,Cáceres,True,0,0,0,0,39.47753910519658,-6.377428325189714
extremadura,01/03/1944,1944,3,1,3,,Lluvia,F,Torrejoncillo,True,0,0,0,0,39.89735427146394,-6.467041427683078
extremadura,02/03/1944,1944,3,2,3,,Lluvia,F,Cañaveral,True,0,0,0,0,39.792312128187504,-6.392262755167833
extremadura,03/03/1944,1944,3,3,1,,,,,False,0,0,0,0,,
hoy,05/03/1944,1944,3,5,4,BAD,sequía,S,La Coronada,True,0,0,0,0,38.918784842043706,-5.672329455507499
hoy,05/03/1944,1944,3,5,4,BAD,,S,Zafra,True,0,0,0,0,38.42187307146895,-6.416697978031944
extremadura,08/03/1944,1944,3,8,2,,Lluvia,S,Extremadura,True,0,0,0,0,,
extremadura,08/03/1944,1944,3,8,3,,Lluvia,F,Zarza de Montánchez,True,0,0,0,0,39.25684481770909,-6.032310145273085
extremadura,08/03/1944,1944,3,8,3,,Lluvia,S,Moraleja,True,0,0,1,0,40.06612783062084,-6.658742890625814
extremadura,13/03/1944,1944,3,13,2,,,,,False,0,0,0,0,,
extremadura,15/03/1944,1944,3,15,3,,,,,False,0,0,0,0,,
extremadura,17/03/1944,1944,3,17,1,,,,,False,0,0,0,0,,
extremadura,17/03/1944,1944,3,17,4,,,,,False,0,0,0,0,,
extremadura,20/03/1944,1944,3,20,2,,,S,Cáceres,True,0,0,0,0,39.47753910519658,-6.377428325189714
hoy,21/03/1944,1944,3,21,6,CAC,,,,False,0,0,0,0,,
extremadura,27/03/1944,1944,3,27,2,,,,,False,0,0,0,0,,
extremadura,28/03/1944,1944,3,28,3,,Lluvia,S,Plasencia,True,0,0,0,0,40.03535535252543,-6.089134757182878
hoy,30/03/1944,1944,3,30,4,CAC,,,,False,0,0,0,0,,
extremadura,31/03/1944,1944,3,31,3,,,,,False,0,0,0,0,,
hoy,04/04/1944,1944,4,4,2,BAD,sequía,S,Badajoz,True,1,0,0,0,38.871034753836994,-6.975421049278072
hoy,11/04/1944,1944,4,11,2,BAD,,,,False,0,0,0,0,,
hoy,13/04/1944,1944,4,13,2,BAD,,S,Badajoz,True,0,0,0,0,38.871034753836994,-6.975421049278072
extremadura,13/04/1944,1944,4,13,4,,,,,False,0,0,0,0,,
hoy,21/04/1944,1944,4,21,4,BAD,,,,False,0,0,0,0,,
hoy,22/04/1944,1944,4,22,5,BAD,Sequía,S,Villanueva de la Serena,True,0,0,0,0,38.97505965210177,-5.798683762870277
extremadura,24/04/1944,1944,4,24,3,,,S,Cáceres,True,0,0,0,0,39.47753910519658,-6.377428325189714
hoy,25/04/1944,1944,4,25,1,CAC,,,,False,0,0,0,0,,
hoy,09/05/1944,1944,5,9,3,BAD,Sequía,S,Badajoz,True,0,0,0,0,38.871034753836994,-6.975421049278072
hoy,13/05/1944,1944,5,13,3,BAD,,,,False,0,0,0,0,,
hoy,23/07/1944,1944,7,23,3,BAD,sequía,S,Badajoz,True,0,0,1,0,38.871034753836994,-6.975421049278072
hoy,27/07/1944,1944,7,27,2,BAD,,,,False,0,0,0,0,,
extremadura,11/08/1944,1944,8,11,2,,,,,False,0,0,0,0,,
extremadura,21/08/1944,1944,8,21,2,,,S,"Cáceres, España",True,0,0,0,0,39.47753910519658,-6.377428325189714
extremadura,24/08/1944,1944,8,24,3,,,S,Hervás,True,0,0,0,0,40.2729367154098,-5.858512295669394
extremadura,25/08/1944,1944,8,25,3,,,,,False,0,0,0,0,,
hoy,11/01/1945,1945,1,11,1,CAC,,,,False,0,0,0,0,,
hoy,17/01/1945,1945,1,17,2,BAD,nieve,N,Ribera del Fresno,True,0,0,0,0,38.55272384050062,-6.239432169970041
hoy,17/01/1945,1945,1,17,2,BAD,nieve,S,Granja de Torrehermosa,True,0,0,0,0,38.309434946037456,-5.596554823533248
hoy,17/01/1945,1945,1,17,2,BAD,nieve,N,Zafra,True,0,0,0,0,38.42187307146895,-6.416697978031944
hoy,25/01/1945,1945,1,25,1,BAD,,,,False,0,0,0,0,,
hoy,30/01/1945,1945,1,30,1,BAD,,,,False,0,0,0,0,,
extremadura,14/02/1945,1945,2,14,1,,,,,False,0,0,0,0,,
extremadura,26/02/1945,1945,2,26,2,,,S,Cáceres,True,0,0,0,0,39.47753910519658,-6.377428325189714
extremadura,01/03/1945,1945,3,1,3,,,,,False,0,0,0,0,,
extremadura,03/03/1945,1945,3,3,1,,,,,False,0,0,0,0,,
hoy,04/03/1945,1945,3,4,2,BAD,,,,False,0,0,0,0,,
extremadura,07/03/1945,1945,3,7,4,,,,,False,0,0,0,0,,
extremadura,08/03/1945,1945,3,8,2,,,,,False,0,0,0,0,,
extremadura,10/03/1945,1945,3,10,1,,,,,False,0,0,0,0,,
extremadura,10/03/1945,1945,3,10,6,,,,,False,0,0,0,0,,
extremadura,12/03/1945,1945,3,12,3,,,,,False,0,0,0,0,,
extremadura,12/03/1945,1945,3,12,4,,,,,False,0,0,0,0,,
extremadura,15/03/1945,1945,3,15,1,,Lluvia,F,Coria,True,0,0,0,0,39.98807734718899,-6.536615926256122
extremadura,15/03/1945,1945,3,15,2,,,,,False,0,0,0,0,,
extremadura,16/03/1945,1945,3,16,5,,Lluvia,F,Plasencia,True,0,0,0,0,40.03535535252543,-6.089134757182878
extremadura,17/03/1945,1945,3,17,2,,Lluvia,F,Cáceres,True,0,0,0,0,39.47753910519658,-6.377428325189714
extremadura,17/03/1945,1945,3,17,6,,,,,False,0,0,0,0,,
extremadura,19/03/1945,1945,3,19,2,,Lluvia,F,Cáceres,True,0,0,0,0,39.47753910519658,-6.377428325189714
extremadura,20/03/1945,1945,3,20,2,,,S,Cáceres,True,0,0,0,0,39.47753910519658,-6.377428325189714
extremadura,21/03/1945,1945,3,21,1,,,,,False,0,0,0,0,,
extremadura,22/03/1945,1945,3,22,1,,Lluvia,F,Cáceres,True,1,1,1,0,39.47753910519658,-6.377428325189714
extremadura,22/03/1945,1945,3,22,1,,Sequía,S,Cáceres,True,0,0,0,0,39.47753910519658,-6.377428325189714
extremadura,23/03/1945,1945,3,23,1,,Lluvia,F,Cáceres,True,0,0,0,0,39.47753910519658,-6.377428325189714
extremadura,23/03/1945,1945,3,23,1,,Lluvia,S,Cáceres,True,1,0,0,0,39.47753910519658,-6.377428325189714
extremadura,24/03/1945,1945,3,24,2,,Lluvia,F,Cáceres,True,0,0,0,0,39.47753910519658,-6.377428325189714
extremadura,24/03/1945,1945,3,24,4,,Lluvia,S,Cáceres,True,0,0,0,0,39.47753910519658,-6.377428325189714
hoy,25/03/1945,1945,3,25,2,BAD,sequía,S,Badajoz,True,0,0,0,0,38.871034753836994,-6.975421049278072
extremadura,27/03/1945,1945,3,27,4,,,S,Cáceres,True,0,0,0,0,39.47753910519658,-6.377428325189714
extremadura,28/03/1945,1945,3,28,1,,,,,False,0,0,0,0,,
extremadura,10/04/1945,1945,4,10,3,,Lluvia,F,Serradilla,True,0,1,0,0,39.82891014852736,-6.139142666346821
extremadura,10/04/1945,1945,4,10,4,,,,,False,0,0,0,0,,
hoy,10/04/1945,1945,4,10,4,CAC,,,,False,0,0,0,0,,
hoy,24/04/1945,1945,4,24,4,BAD,sequía,S,Granja de Torrehermosa,True,0,0,0,0,38.309434946037456,-5.596554823533248
extremadura,05/05/1945,1945,5,5,1,,Sequía,S,Provincia de Cáceres,True,0,0,0,1,,
extremadura,07/05/1945,1945,5,7,3,,,,,False,0,0,0,0,,
extremadura,10/05/1945,1945,5,10,2,,,S,Cáceres,True,0,0,0,0,39.47753910519658,-6.377428325189714
hoy,10/05/1945,1945,5,10,4,BAD,sequía,S,Fuente de Cantos,True,0,0,0,0,38.2469353111271,-6.306434374005093
extremadura,12/05/1945,1945,5,12,4,,,,,False,0,0,0,0,,
hoy,12/05/1945,1945,5,12,8,CAC,,,,False,0,0,0,0,,
hoy,17/05/1945,1945,5,17,2,BAD,,,,False,0,0,0,0,,
hoy,18/05/1945,1945,5,18,1,BAD,sequía,S,Extremadura,True,1,0,0,0,,
extremadura,24/05/1945,1945,5,24,4,,,,,False,0,0,0,0,,
extremadura,26/05/1945,1945,5,26,10,,,S,Cáceres,True,0,0,0,0,39.47753910519658,-6.377428325189714
extremadura,01/06/1945,1945,6,1,3,,,S,Hervás,True,0,0,0,0,40.2729367154098,-5.858512295669394
hoy,02/06/1945,1945,6,2,2,BAD,Sequía,S,Badajoz,True,0,1,0,0,38.871034753836994,-6.975421049278072
extremadura,05/06/1945,1945,6,5,2,,,,,False,0,0,0,0,,
hoy,07/06/1945,1945,6,7,1,BAD,,,,False,0,0,0,0,,
hoy,07/06/1945,1945,6,7,2,BAD,,,,False,0,0,0,0,,
extremadura,08/06/1945,1945,6,8,1,,,S,Cáceres,True,0,0,1,0,39.47753910519658,-6.377428325189714
extremadura,08/06/1945,1945,6,8,3,,,S,Cáceres,True,0,0,1,0,39.47753910519658,-6.377428325189714
hoy,14/06/1945,1945,6,14,1,BAD,,,,False,0,0,0,0,,
extremadura,14/06/1945,1945,6,14,3,,Sequía,S,Plasencia,True,0,1,0,0,40.03535535252543,-6.089134757182878
extremadura,15/06/1945,1945,6,15,1,,Sequía,S,Cáceres,True,0,0,1,1,39.47753910519658,-6.377428325189714
extremadura,16/06/1945,1945,6,16,3,,,,,False,0,0,0,0,,
extremadura,19/06/1945,1945,6,19,3,,,,,False,0,0,0,0,,
extremadura,20/06/1945,1945,6,20,1,,,,,False,0,0,0,0,,
hoy,21/06/1945,1945,6,21,2,BAD,,S,Cáceres,True,0,0,0,0,39.47753910519658,-6.377428325189714
extremadura,25/06/1945,1945,6,25,1,,,,,False,0,0,0,0,,
hoy,27/06/1945,1945,6,27,4,BAD,Sequía,S,Villalba de los Barros,True,1,0,0,0,38.612762249753416,-6.509374938586623
hoy,03/07/1945,1945,7,3,1,CAC,,,,False,0,0,0,0,,
hoy,07/07/1945,1945,7,7,3,BAD,,S,Extremadura,True,0,0,0,0,,
hoy,11/07/1945,1945,7,11,4,BAD,,,,False,0,0,0,0,,
hoy,13/07/1945,1945,7,13,1,CAC,,,,False,0,0,0,0,,
hoy,13/07/1945,1945,7,13,3,BAD,,S,Llerena,True,0,0,1,0,38.237805569650085,-6.014891730861935
hoy,15/07/1945,1945,7,15,1,BAD,,,,False,0,0,0,0,,
hoy,18/07/1945,1945,7,18,7,BAD,sequía,S,Torremejía,True,1,0,0,0,38.79118731898431,-6.376515149542389
hoy,18/07/1945,1945,7,18,7,BAD,,S,Ribera del Fresno,True,1,0,0,0,38.55272384050062,-6.239432169970041
hoy,26/07/1945,1945,7,26,6,BAD,,,,False,0,0,0,0,,
hoy,05/07/1945,1945,7,31,1,CAC,sequía,S,Cáceres,True,0,0,1,1,39.47753910519658,-6.377428325189714
extremadura,04/08/1945,1945,8,4,2,,,,,False,0,0,0,0,,
hoy,08/08/1945,1945,8,8,1,CAC,,,,False,0,0,0,0,,
hoy,08/08/1945,1945,8,8,3,BAD,,,,False,0,0,0,0,,
hoy,12/08/1945,1945,8,12,4,BAD,sequía,S,Fuente de Cantos,True,1,0,0,0,38.2469353111271,-6.306434374005093
hoy,14/08/1945,1945,8,14,4,BAD,sequía,S,Azuaga,True,1,0,0,0,38.25927585060632,-5.676455607293899
extremadura,24/08/1945,1945,8,24,2,,,,,False,0,0,0,0,,
extremadura,27/08/1945,1945,8,27,4,,Sequía,S,Cáceres,True,0,0,0,0,39.47753910519658,-6.377428325189714
extremadura,27/08/1945,1945,8,27,4,,Sequía,S,Portaje,True,1,0,0,0,39.91753312734024,-6.561404519909911
hoy,09/09/1945,1945,9,9,3,BAD,sequía,S,Badajoz,True,0,0,1,0,38.871034753836994,-6.975421049278072
extremadura,11/09/1945,1945,9,11,2,,,,,False,0,0,0,0,,
hoy,18/09/1945,1945,9,18,3,BAD,,,,False,0,0,0,0,,
extremadura,24/09/1945,1945,9,24,2,,,S,Cáceres,True,0,0,0,0,39.47753910519658,-6.377428325189714
extremadura,01/10/1945,1945,10,1,2,,,S,"Cáceres, España",True,0,0,0,0,39.47753910519658,-6.377428325189714
extremadura,01/10/1945,1945,10,1,3,,,,,False,0,0,0,0,,
extremadura,01/10/1945,1945,10,1,5,,,,,False,0,0,0,0,,
extremadura,02/10/1945,1945,10,2,1,,,,,False,0,0,0,0,,
extremadura,03/10/1945,1945,10,3,1,,Sequía,N,Cáceres,True,0,0,0,0,39.47753910519658,-6.377428325189714
extremadura,04/10/1945,1945,10,4,3,,Sequía,S,Plasencia,True,0,0,0,0,40.03535535252543,-6.089134757182878
extremadura,05/10/1945,1945,10,5,1,,,,,False,0,0,0,0,,
extremadura,06/10/1945,1945,10,6,2,,,,,False,0,0,0,0,,
extremadura,08/10/1945,1945,10,8,1,,,S,Cáceres,True,0,0,0,0,39.47753910519658,-6.377428325189714
extremadura,10/10/1945,1945,10,10,2,,,,,False,0,0,0,0,,
extremadura,12/10/1945,1945,10,12,1,,Sequía,F,Cáceres,True,0,0,0,0,39.47753910519658,-6.377428325189714
extremadura,12/10/1945,1945,10,12,2,,Sequía,F,Cáceres,True,0,0,0,0,39.47753910519658,-6.377428325189714
extremadura,12/10/1945,1945,10,12,3,,Sequía,S,Plasencia,True,0,0,0,0,40.03535535252543,-6.089134757182878
extremadura,13/10/1945,1945,10,13,1,,Sequía,F,Cáceres,True,0,0,0,0,39.47753910519658,-6.377428325189714
extremadura,15/10/1945,1945,10,15,1,,Sequía,S,Cáceres,True,0,0,0,0,39.47753910519658,-6.377428325189714
extremadura,15/10/1945,1945,10,15,1,,Sequía,S,Cáceres,True,0,0,1,1,39.47753910519658,-6.377428325189714
extremadura,15/10/1945,1945,10,15,2,,,,,False,0,0,0,0,,
extremadura,16/10/1945,1945,10,16,2,,,S,Cáceres,True,0,0,0,1,39.47753910519658,-6.377428325189714
extremadura,16/10/1945,1945,10,16,4,,,,,False,0,0,0,0,,
extremadura,17/10/1945,1945,10,17,1,,,,,False,0,0,0,0,,
extremadura,18/10/1945,1945,10,18,2,,Sequía,F,Cáceres,True,0,0,0,0,39.47753910519658,-6.377428325189714
hoy,18/10/1945,1945,10,18,4,BAD,sequía,S,Santa Marta,True,0,0,0,0,38.61413697887768,-6.628145382540433
extremadura,19/10/1945,1945,10,19,2,,,,,False,0,0,0,0,,
extremadura,19/10/1945,1945,10,19,4,,,,,False,0,0,0,0,,
extremadura,22/10/1945,1945,10,22,2,,,,,False,0,0,0,0,,
extremadura,22/10/1945,1945,10,22,3,,,S,Hervás,True,0,0,0,0,40.2729367154098,-5.858512295669394
extremadura,22/10/1945,1945,10,22,3,,,S,Hervás,True,1,0,0,0,40.2729367154098,-5.858512295669394
extremadura,23/10/1945,1945,10,23,1,,,,,False,0,0,0,0,,
extremadura,25/10/1945,1945,10,25,3,,Sequía,S,Torrejón el Rubio,True,0,0,1,0,39.770824622311125,-6.012335249034648
extremadura,27/10/1945,1945,10,27,1,,,,,False,0,0,0,0,,
hoy,27/10/1945,1945,10,27,2,BAD,,,,False,0,0,0,0,,
extremadura,29/10/1945,1945,10,29,2,,,,,False,0,0,0,0,,
hoy,01/11/1945,1945,11,1,4,BAD,sequía,S,Cáceres,True,0,0,1,1,39.47753910519658,-6.377428325189714
extremadura,02/11/1945,1945,11,2,3,,Sequía,S,Extremadura,True,1,0,0,0,,
hoy,03/11/1945,1945,11,3,5,BAD,sequía,S,Badajoz,True,1,0,1,1,38.871034753836994,-6.975421049278072
hoy,04/11/1945,1945,11,4,1,BAD,,,,False,0,0,0,0,,
hoy,04/11/1945,1945,11,4,2,BAD,sequía,S,Badajoz,True,0,0,1,0,38.871034753836994,-6.975421049278072
hoy,07/11/1945,1945,11,7,5,BAD,,S,Badajoz,True,0,0,0,0,38.871034753836994,-6.975421049278072
hoy,11/11/1945,1945,11,11,6,BAD,,,,False,0,0,0,0,,
extremadura,20/11/1945,1945,11,20,2,,,,,False,0,0,0,0,,
hoy,22/11/1945,1945,11,22,2,BAD,,,,False,0,0,0,0,,
hoy,29/11/1945,1945,11,29,4,BAD,sequía,S,Castuera,True,0,0,0,0,38.72435378925819,-5.545060273541743
hoy,30/11/1945,1945,11,30,1,CAC,,,,False,0,0,0,0,,
hoy,30/11/1945,1945,11,30,3,BAD,,,,False,0,0,0,0,,
extremadura,12/12/1945,1945,12,12,1,,,,,False,0,0,0,0,,
extremadura,19/12/1945,1945,12,19,1,,,S,Badajoz,True,0,0,0,0,38.871034753836994,-6.975421049278072
extremadura,01/01/1946,1946,1,1,5,,,S,Cáceres,True,0,0,0,0,39.47753910519658,-6.377428325189714
extremadura,12/01/1946,1946,1,12,1,,,,,False,0,0,0,0,,
extremadura,15/01/1946,1946,1,15,3,,,S,Plasencia,True,1,0,0,0,40.03535535252543,-6.089134757182878
extremadura,16/01/1946,1946,1,16,1,,,,,False,0,0,0,0,,
extremadura,02/02/1946,1946,2,2,2,,,,,False,0,0,0,0,,
extremadura,04/02/1946,1946,2,4,1,,,S,Hervás,True,0,0,0,0,40.2729367154098,-5.858512295669394
hoy,09/02/1946,1946,2,9,4,BAD,,S,Santa Marta,True,0,0,0,0,38.61413697887768,-6.628145382540433
hoy,10/02/1946,1946,2,10,1,BAD,,,,False,0,0,0,0,,
hoy,10/03/1946,1946,3,10,5,BAD,,,,False,0,0,0,0,,
hoy,12/03/1946,1946,3,12,5,BAD,,,,False,0,0,0,0,,
extremadura,13/03/1946,1946,3,13,4,,,S,Cáceres,True,0,0,0,0,39.47753910519658,-6.377428325189714
extremadura,18/03/1946,1946,3,18,1,,,,,False,0,0,0,0,,
hoy,19/03/1946,1946,3,19,6,BAD,,S,Calamonte,True,0,0,0,0,38.88643486468611,-6.386721881165606
hoy,31/03/1946,1946,3,31,2,BAD,sequía,S,Badajoz,True,0,0,0,0,38.871034753836994,-6.975421049278072
extremadura,05/04/1946,1946,4,5,1,,,,,False,0,0,0,0,,
extremadura,12/04/1946,1946,4,12,2,,Sequía,S,Provincia de Cáceres,True,1,0,0,0,,
hoy,10/05/1946,1946,5,10,1,BAD,,,,False,0,0,0,0,,
hoy,21/05/1946,1946,5,21,4,BAD,,S,Alburquerque,True,0,0,0,0,39.22057581234303,-7.000473530868876
extremadura,01/08/1946,1946,8,1,2,,,,,False,0,0,0,0,,
extremadura,05/08/1946,1946,8,5,3,,,S,Cáceres,True,0,0,0,0,39.47753910519658,-6.377428325189714
extremadura,05/08/1946,1946,8,5,3,,,S,Extremadura,True,0,0,0,0,,
hoy,06/08/1946,1946,8,6,1,CAC,,,,False,0,0,0,0,,
extremadura,09/08/1946,1946,8,9,2,,,,,False,0,0,0,0,,
hoy,18/08/1946,1946,8,18,4,BAD,,S,Quintana de la Serena,True,0,1,0,0,38.74114862228369,-5.672203907270094
hoy,12/09/1946,1946,9,12,1,BAD,,,,False,0,0,0,0,,
hoy,20/09/1946,1946,9,20,4,BAD,,S,Fregenal de la Sierra,True,0,0,0,0,38.1687749610116,-6.653923848007927
hoy,05/10/1946,1946,10,5,9,CAC,,S,Zafra,True,1,0,0,0,38.42187307146895,-6.416697978031944
hoy,16/10/1946,1946,10,16,2,BAD,,,,False,0,0,0,0,,
extremadura,13/11/1946,1946,11,13,4,,Frío,F,Cáceres,True,0,0,1,0,39.47753910519658,-6.377428325189714
extremadura,30/11/1946,1946,11,30,4,,,,,False,0,0,0,0,,
hoy,01/05/1947,1947,5,1,3,BAD,,S,Mérida,True,0,1,0,0,38.91549201670453,-6.341926065709169
extremadura,05/05/1947,1947,5,5,3,,,S,Trujillo,True,0,0,0,0,39.45888638575288,-5.876389783097755
extremadura,15/05/1947,1947,5,15,3,,,,,False,0,0,0,0,,
hoy,17/05/1947,1947,5,17,1,BAD,,,,False,0,0,0,0,,
extremadura,04/08/1947,1947,8,4,1,,,,,False,0,0,0,0,,
extremadura,25/08/1947,1947,8,25,3,,,S,Cáceres,True,0,0,0,0,39.47753910519658,-6.377428325189714
extremadura,01/11/1947,1947,11,1,3,,,,,False,0,0,0,0,,
extremadura,25/11/1947,1947,11,25,2,,Frío,F,Cáceres,True,0,0,0,1,39.47753910519658,-6.377428325189714
extremadura,02/09/1948,1948,9,2,4,,,,,False,0,0,0,0,,
extremadura,30/09/1948,1948,9,30,1,,,S,Cáceres,True,0,0,0,0,39.47753910519658,-6.377428325189714
extremadura,01/10/1948,1948,10,1,3,,,,,False,0,0,0,0,,
extremadura,01/10/1948,1948,10,1,4,,Temperatura,F,Cáceres,True,1,0,0,1,39.47753910519658,-6.377428325189714
extremadura,06/10/1948,1948,10,6,2,,,,,False,0,0,0,0,,
extremadura,28/10/1948,1948,10,28,4,,Lluvia,S,Cáceres,True,1,0,0,1,39.47753910519658,-6.377428325189714
extremadura,01/11/1948,1948,11,1,1,,Lluvia,F,Cáceres,True,0,0,0,0,39.47753910519658,-6.377428325189714
extremadura,03/11/1948,1948,11,3,4,,,,,False,0,0,0,0,,
hoy,04/11/1948,1948,11,4,4,CAC,,S,Zalamea de la Serena,True,0,0,0,1,38.64988080204128,-5.65827426712498
hoy,05/11/1948,1948,11,5,3,BAD,,,,False,0,0,0,0,,
extremadura,06/11/1948,1948,11,6,1,,,,,False,0,0,0,0,,
extremadura,15/11/1948,1948,11,15,1,,,,,False,0,0,0,0,,
extremadura,22/11/1948,1948,11,22,2,,Lluvia,F,España,True,1,0,0,0,,
extremadura,23/11/1948,1948,11,23,2,,,,,False,0,0,0,0,,
extremadura,23/11/1948,1948,11,23,4,,Lluvia,S,Cáceres,True,1,0,0,1,39.47753910519658,-6.377428325189714
extremadura,25/11/1948,1948,11,25,4,,Lluvia,S,Cáceres,True,0,0,0,0,39.47753910519658,-6.377428325189714
hoy,01/12/1948,1948,12,1,3,BAD,sequía,S,Extremadura,True,0,1,0,0,,
extremadura,06/12/1948,1948,12,6,4,,,S,Cáceres,True,0,0,0,0,39.47753910519658,-6.377428325189714
extremadura,08/12/1948,1948,12,8,2,,,,,False,0,0,0,0,,
hoy,16/12/1948,1948,12,16,6,BAD,,,,False,0,0,0,0,,
hoy,17/12/1948,1948,12,17,2,BAD,,S,Santa Marta,True,0,0,0,1,38.61413697887768,-6.628145382540433
extremadura,18/12/1948,1948,12,18,3,,Lluvia,S,Plasencia,True,0,0,0,0,40.03535535252543,-6.089134757182878
extremadura,18/12/1948,1948,12,18,4,,Lluvia,S,España,True,0,0,0,0,,
extremadura,21/12/1948,1948,12,21,4,,,,,False,0,0,0,0,,
hoy,23/12/1948,1948,12,23,3,BAD,,,,False,0,0,0,0,,
extremadura,27/12/1948,1948,12,27,1,,,,,False,0,0,0,0,,
extremadura,27/12/1948,1948,12,27,2,,,,,False,0,0,0,0,,
extremadura,27/12/1948,1948,12,27,3,,,S,Malpartida de Cáceres,True,0,0,0,0,39.44606886667186,-6.505515540984494
hoy,16/01/1949,1949,1,16,2,BAD,,,,False,0,0,0,0,,
hoy,21/01/1949,1949,1,21,2,BAD,sequía,S,Extremadura,True,0,0,0,1,,
hoy,02/02/1949,1949,2,2,4,CAC,,,,False,0,0,0,0,,
hoy,08/02/1949,1949,2,8,1,BAD,sequía,S,Badajoz,True,1,1,0,0,38.871034753836994,-6.975421049278072
hoy,08/02/1949,1949,2,8,6,CAC,,,,False,0,0,0,0,,
hoy,12/02/1949,1949,2,13,4,BAD,sequía,S,Badajoz,True,0,0,0,0,38.871034753836994,-6.975421049278072
hoy,19/02/1949,1949,2,19,6,CAC,,,,False,0,0,0,0,,
hoy,26/02/1949,1949,2,26,4,BAD,sequía,S,Villafranca de los Barros,True,0,0,0,0,38.55953602827336,-6.3328763558379855
hoy,02/03/1949,1949,3,2,4,BAD,,,,False,0,0,0,0,,
hoy,06/03/1949,1949,3,6,2,BAD,,,,False,0,0,0,0,,
hoy,08/03/1949,1949,3,8,3,BAD,,,,False,0,0,0,0,,
hoy,10/03/1949,1949,3,10,4,CAC,sequía,S,Valverde de Leganés,True,0,0,0,0,38.66995027815207,-6.980483983729762
hoy,12/03/1949,1949,3,12,4,BAD,sequía,S,Salvatierra de los Barros,True,0,0,0,0,38.4909049414581,-6.684560845759512
hoy,24/03/1949,1949,3,24,1,BAD,,,,False,0,0,0,0,,
hoy,24/03/1949,1949,3,24,4,BAD,,S,Santa Marta,True,0,0,0,0,38.61413697887768,-6.628145382540433
hoy,25/03/1949,1949,3,25,4,BAD,sequía,S,Albuequerque,True,0,0,0,0,,
hoy,27/03/1949,1949,3,27,3,BAD,,,,False,0,0,0,0,,
hoy,06/03/1949,1949,3,30,2,BAD,sequía,S,Badajoz,True,0,0,0,1,38.871034753836994,-6.975421049278072
hoy,01/04/1949,1949,4,1,5,BAD,,,,False,0,0,0,0,,
hoy,06/04/1949,1949,4,8,4,BAD,sequía,S,Higuera de Vargas,True,0,0,0,0,38.44433667601138,-6.973584904071192
extremadura,02/08/1949,1949,5,2,3,,Lluvia,F,Moraleja,True,0,0,0,0,40.06612783062084,-6.658742890625814
extremadura,02/05/1949,1949,5,2,4,,,,,False,0,0,0,0,,
extremadura,04/05/1949,1949,5,4,4,,,,,False,0,0,0,0,,
extremadura,13/05/1949,1949,5,13,7,,Sequía,S,Cáceres,True,0,0,0,0,39.47753910519658,-6.377428325189714
hoy,14/05/1949,1949,5,14,2,BAD,,S,Badajoz,True,0,0,0,0,38.871034753836994,-6.975421049278072
hoy,14/05/1949,1949,5,14,11,CAC,,,,False,0,0,0,0,,
extremadura,18/05/1949,1949,5,18,3,,Lluvia,S,Trujillo,True,0,0,0,0,39.45888638575288,-5.876389783097755
extremadura,21/05/1949,1949,5,21,2,,,,,False,0,0,0,0,,
extremadura,27/05/1949,1949,5,27,8,,Sequía,S,Extremadura,True,1,0,0,0,,
extremadura,27/05/1949,1949,5,27,8,,Sequía,S,Extremadura,True,0,0,0,0,,
extremadura,28/05/1949,1949,5,28,3,,,,,False,0,0,0,0,,
extremadura,31/05/1949,1949,5,31,3,,,,,False,0,0,0,0,,
hoy,10/06/1949,1949,6,10,2,CAC,,,,False,0,0,0,0,,
hoy,15/06/1949,1949,6,15,6,BAD,,S,Barcarrota,True,0,0,0,0,38.51546498704721,-6.849414009339235
hoy,13/07/1949,1949,7,13,4,BAD,sequía,S,Provincia de Badajoz,True,0,0,0,1,,
hoy,16/07/1949,1949,7,16,6,CAC,,,,False,0,0,0,0,,
hoy,20/07/1949,1949,7,20,4,BAD,,,,False,0,0,0,0,,
hoy,30/07/1949,1949,7,30,6,BAD,,S,Badajoz,True,0,0,0,1,38.871034753836994,-6.975421049278072
extremadura,01/08/1949,1949,8,1,3,,,S,Plasencia,True,0,0,1,0,40.03535535252543,-6.089134757182878
extremadura,08/08/1949,1949,8,8,4,,,,,False,0,0,0,0,,
extremadura,12/08/1949,1949,8,12,2,,,,,False,0,0,0,0,,
extremadura,13/08/1949,1949,8,13,1,,,S,Cáceres,True,0,0,0,0,39.47753910519658,-6.377428325189714
extremadura,13/08/1949,1949,8,13,4,,,,,False,0,0,0,0,,
extremadura,17/08/1949,1949,8,17,4,,Calor,F,Cáceres,True,0,0,1,0,39.47753910519658,-6.377428325189714
hoy,20/08/1949,1949,8,20,4,BAD,,S,Losar de la Vera,True,0,0,0,0,40.12088363636735,-5.6047449113092735
extremadura,22/08/1949,1949,8,22,1,,,,,False,0,0,0,0,,
extremadura,26/08/1949,1949,8,26,3,,,S,Plasencia,True,0,1,0,0,40.03535535252543,-6.089134757182878
hoy,31/08/1949,1949,8,31,5,BAD,,,,False,0,0,0,0,,
hoy,02/09/1949,1949,9,2,2,CAC,,S,Cáceres,True,0,0,0,0,39.47753910519658,-6.377428325189714
extremadura,03/09/1949,1949,9,3,3,,,S,Hervás,True,1,0,0,0,40.2729367154098,-5.858512295669394
extremadura,03/09/1949,1949,9,3,3,,,S,Hervás,True,0,0,0,0,40.2729367154098,-5.858512295669394
hoy,04/09/1949,1949,9,4,6,BAD,,,,False,0,0,0,0,,
extremadura,05/09/1949,1949,9,5,4,,,,,False,0,0,0,0,,
extremadura,06/09/1949,1949,9,6,4,,Lluvia,F,Trujillo,True,0,1,0,0,39.45888638575288,-5.876389783097755
hoy,07/09/1949,1949,9,7,5,BAD,,S,Barcarrota,True,0,0,0,0,38.51546498704721,-6.849414009339235
hoy,07/09/1949,1949,9,7,6,BAD,,S,Los Santos de Maimona,True,1,0,0,0,38.45117916787635,-6.38212720726155
hoy,09/09/1949,1949,9,9,4,BAD,,,,False,0,0,0,0,,
extremadura,12/09/1949,1949,9,12,1,,,,,False,0,0,0,0,,
extremadura,13/09/1949,1949,9,13,4,,,,,False,0,0,0,0,,
extremadura,14/09/1949,1949,9,14,3,,,S,Hervás,True,0,0,0,0,40.2729367154098,-5.858512295669394
extremadura,15/09/1949,1949,9,15,1,,,,,False,0,0,0,0,,
hoy,15/09/1949,1949,9,15,2,BAD,,,,False,0,0,0,0,,
extremadura,17/09/1949,1949,9,17,1,,,,,False,0,0,0,0,,
extremadura,17/09/1949,1949,9,17,4,,,S,Trujillo,True,0,1,0,0,39.45888638575288,-5.876389783097755
extremadura,19/09/1949,1949,9,19,1,,Sequía,S,Cáceres,True,0,1,0,0,39.47753910519658,-6.377428325189714
extremadura,20/09/1949,1949,9,20,4,,,S,Trujillo,True,0,0,0,0,39.45888638575288,-5.876389783097755
hoy,23/09/1949,1949,9,23,2,BAD,,S,Badajoz,True,0,0,0,0,38.871034753836994,-6.975421049278072
extremadura,24/09/1949,1949,9,24,1,,,,,False,0,0,0,0,,
extremadura,30/09/1949,1949,9,30,1,,,,,False,0,0,0,0,,
hoy,30/09/1949,1949,9,30,5,BAD,,,,False,0,0,0,0,,
hoy,01/11/1949,1949,11,1,4,BAD,,,,False,0,0,0,0,,
extremadura,04/11/1949,1949,11,4,4,,,,,False,0,0,0,0,,
extremadura,08/11/1949,1949,11,8,2,,,S,Cáceres,True,0,0,0,0,39.47753910519658,-6.377428325189714
extremadura,08/11/1949,1949,11,8,4,,,,,False,0,0,0,0,,
hoy,15/11/1949,1949,11,15,3,BAD,,,,False,0,0,0,0,,
extremadura,18/11/1949,1949,11,18,1,,,S,Cáceres,True,0,0,0,0,39.47753910519658,-6.377428325189714
hoy,22/11/1949,1949,11,22,4,BAD,sequía,S,Barcarrota,True,0,0,0,0,38.51546498704721,-6.849414009339235
hoy,22/11/1949,1949,11,22,6,BAD,,,,False,0,0,0,0,,
hoy,23/11/1949,1949,11,23,4,BAD,sequía,S,Campanario,True,0,0,0,0,38.8625254789591,-5.619221562693182
extremadura,23/11/1949,1949,11,23,5,,,,,False,0,0,0,0,,
hoy,26/11/1949,1949,11,26,2,CAC,,S,"Extremadura, Andalucía",True,1,0,0,0,,
extremadura,29/11/1949,1949,11,29,3,,,S,Torrejón el Rubio,True,0,0,0,0,39.770824622311125,-6.012335249034648
extremadura,15/12/1949,1949,12,15,4,,,,,False,0,0,0,0,,
hoy,15/12/1949,1949,12,15,5,BAD,,S,Extremadura,True,0,0,0,0,,
hoy,30/12/1949,1949,12,30,1,CAC,,,,False,0,0,0,0,,
extremadura,31/12/1949,1949,12,31,3,,,S,La Vera,True,1,0,0,0,28.39538652504952,-16.555140535456733
hoy,10/02/1950,1950,2,10,4,BAD,,S,Mérida,True,0,0,0,0,38.91549201670453,-6.341926065709169
hoy,16/02/1950,1950,2,16,4,BAD,,,,False,0,0,0,0,,
extremadura,03/03/1950,1950,3,3,3,,,S,Cáceres,True,0,0,0,0,39.47753910519658,-6.377428325189714
extremadura,04/03/1950,1950,3,4,3,,,S,Arroyo de la Luz,True,0,0,0,0,39.48424151476158,-6.583900547775354
extremadura,09/03/1950,1950,3,9,1,,,,,False,0,0,0,0,,
extremadura,28/03/1950,1950,3,28,3,,,,,False,0,0,0,0,,
hoy,06/04/1950,1950,4,6,5,BAD,,,,False,0,0,0,0,,
hoy,11/04/1950,1950,4,11,6,BAD,,S,Badajoz,True,0,0,0,0,38.871034753836994,-6.975421049278072
hoy,02/05/1950,1950,5,2,2,CAC,,,,False,0,0,0,0,,
extremadura,06/05/1950,1950,5,6,1,,Sequía,S,Plasencia,True,0,0,0,0,40.03535535252543,-6.089134757182878
extremadura,10/05/1950,1950,5,10,4,,,,,False,0,0,0,0,,
extremadura,12/05/1950,1950,5,12,4,,,,,False,0,0,0,0,,
extremadura,13/05/1950,1950,5,13,6,,Sequía,S,Provincia de Cáceres,True,1,0,0,0,,
extremadura,15/05/1950,1950,5,15,3,,,S,Cáceres,True,0,1,0,0,39.47753910519658,-6.377428325189714
extremadura,17/05/1950,1950,5,17,3,,,,,False,0,0,0,0,,
extremadura,19/05/1950,1950,5,19,2,,,,,False,0,0,0,0,,
extremadura,19/05/1950,1950,5,19,3,,Lluvia,F,Aldea de Trujillo,True,0,0,0,0,39.56402162733083,-5.910268827952342
hoy,27/05/1950,1950,5,27,28,SUP,,S,Jerez de los Caballeros,True,1,0,0,0,38.32157904136018,-6.77125396533409
extremadura,01/06/1950,1950,6,1,16,,Sequía,S,Trujillo,True,0,0,1,0,39.45888638575288,-5.876389783097755
hoy,02/06/1950,1950,6,2,6,BAD,,,,False,0,0,0,0,,
hoy,08/06/1950,1950,6,8,5,BAD,,S,"Extremadura, Andalucía",True,0,0,0,0,,
extremadura,27/06/1950,1950,6,27,3,,,,,False,0,0,0,0,,
extremadura,08/08/1950,1950,8,8,4,,,,,False,0,0,0,0,,
extremadura,21/08/1950,1950,8,21,3,,Sequía,S,Cáceres,True,0,1,0,0,39.47753910519658,-6.377428325189714
extremadura,09/09/1950,1950,9,9,3,,,S,Arroyo de la Luz,True,0,0,1,0,39.48424151476158,-6.583900547775354
hoy,09/09/1950,1950,9,9,5,BAD,,,,False,0,0,0,0,,
hoy,13/09/1950,1950,9,13,7,CAC,,S,Zafra,True,0,0,0,0,38.42187307146895,-6.416697978031944
hoy,14/09/1950,1950,9,14,3,BAD,,,,False,0,0,0,0,,
hoy,21/09/1950,1950,9,21,5,BAD,sequía,S,Extremadura,True,1,0,0,0,,
extremadura,28/09/1950,1950,9,28,8,,,,,False,0,0,0,0,,
hoy,05/10/1950,1950,10,5,10,BAD,,S,Zafra,True,0,0,0,0,38.42187307146895,-6.416697978031944
hoy,07/10/1950,1950,10,7,6,CAC,,,,False,0,0,0,0,,
hoy,08/10/1950,1950,10,8,3,BAD,,,,False,0,0,0,0,,
hoy,11/10/1950,1950,10,11,6,CAC,,,,False,0,0,0,0,,
hoy,20/10/1950,1950,10,20,4,CAC,sequía,S,Zahinos,True,0,0,0,0,38.33155821023243,-6.953137496204532
hoy,21/10/1950,1950,10,21,4,BAD,sequía,S,Higuera de Vargas,True,0,0,0,0,38.44433667601138,-6.973584904071192
hoy,04/11/1950,1950,11,4,1,BAD,,,,False,0,0,0,0,,
hoy,07/11/1950,1950,11,7,3,BAD,,S,Badajoz,True,0,0,0,0,38.871034753836994,-6.975421049278072
extremadura,14/11/1950,1950,11,14,1,,,,,False,0,0,0,0,,
extremadura,18/11/1950,1950,11,18,3,,,S,Hervás,True,0,0,0,0,40.2729367154098,-5.858512295669394
extremadura,22/11/1950,1950,11,22,1,,,,,False,0,0,0,0,,
extremadura,24/11/1950,1950,11,24,2,,,S,Malpartida de Cáceres,True,0,1,0,0,39.44606886667186,-6.505515540984494
hoy,05/12/1950,1950,12,5,1,BAD,sequía,S,Badajoz,True,0,0,0,0,38.871034753836994,-6.975421049278072
hoy,06/12/1950,1950,12,6,5,BAD,,,,False,0,0,0,0,,
hoy,07/01/1951,1951,1,7,2,CAC,,,,False,0,0,0,0,,
hoy,17/01/1951,1951,1,17,4,CAC,,S,Barcarrota,True,1,0,0,0,38.51546498704721,-6.849414009339235
hoy,12/08/1951,1951,8,12,2,BAD,,,,False,0,0,0,0,,
hoy,31/08/1951,1951,8,31,1,BAD,sequía,S,Badajoz,True,0,0,0,0,38.871034753836994,-6.975421049278072
extremadura,08/04/1952,1952,4,8,1,,,,,False,0,0,0,0,,
extremadura,26/04/1952,1952,4,26,5,,,S,Plasencia,True,0,0,0,0,40.03535535252543,-6.089134757182878
extremadura,05/05/1952,1952,5,5,3,,,,,False,0,0,0,0,,
extremadura,27/05/1952,1952,5,27,4,,,S,Cáceres,True,0,0,0,0,39.47753910519658,-6.377428325189714
extremadura,10/06/1952,1952,6,10,3,,,S,Plasencia,True,0,0,0,0,40.03535535252543,-6.089134757182878
extremadura,23/06/1952,1952,6,23,1,,,,,False,0,0,0,0,,
hoy,06/11/1952,1952,11,6,4,CAC,,,,False,0,0,0,0,,
extremadura,12/11/1952,1952,11,12,4,,,S,Cáceres,True,0,0,0,0,39.47753910519658,-6.377428325189714
hoy,18/11/1952,1952,11,18,4,CAC,sequía,S,Cabeza la Vaca,True,1,0,0,0,38.08575918703869,-6.419344251114348
extremadura,27/11/1952,1952,11,27,2,,,,,False,0,0,0,0,,
hoy,10/03/1953,1953,3,10,1,CAC,sequía,S,Badajoz,True,0,0,0,0,38.871034753836994,-6.975421049278072
extremadura,11/03/1953,1953,3,11,3,,,,,False,0,0,0,0,,
extremadura,12/03/1953,1953,3,12,1,,,S,Coria,True,1,0,0,0,39.98807734718899,-6.536615926256122
hoy,13/03/1953,1953,3,13,4,BAD,,,,False,0,0,0,0,,
extremadura,18/03/1953,1953,3,18,3,,Lluvia,S,Cáceres,True,0,0,0,0,39.47753910519658,-6.377428325189714
hoy,22/03/1953,1953,3,22,1,CAC,sequía,S,Badajoz,True,0,0,0,0,38.871034753836994,-6.975421049278072
hoy,27/03/1953,1953,3,27,4,BAD,,,,False,0,0,0,0,,
extremadura,31/03/1953,1953,3,31,2,,,,,False,0,0,0,0,,
extremadura,01/04/1953,1953,4,1,1,,,,,False,0,0,0,0,,
extremadura,02/04/1953,1953,4,2,2,,Sequía,S,Brozas,True,0,0,0,0,39.61234132301401,-6.778565289568476
extremadura,04/04/1953,1953,4,4,4,,Sequía,S,Cáceres,True,0,1,0,0,39.47753910519658,-6.377428325189714
hoy,05/04/1953,1953,4,5,1,BAD,,,,False,0,0,0,0,,
extremadura,06/04/1953,1953,4,6,1,,,,,False,0,0,0,0,,
hoy,22/04/1953,1953,4,22,1,BAD,,S,Castilblanco,True,0,0,1,0,39.28522070150344,-5.089872970248981
extremadura,24/04/1953,1953,4,24,2,,,S,"Extremadura, España",True,0,0,0,0,,
extremadura,27/04/1953,1953,4,27,6,,,,,False,0,0,0,0,,
hoy,13/08/1953,1953,8,13,4,BAD,,,,False,0,0,0,0,,
hoy,30/08/1953,1953,8,30,4,CAC,sequía,S,Madrigalejo,True,1,0,0,0,39.13619959423238,-5.629582467826472
extremadura,01/09/1953,1953,9,1,3,,,S,Valencia de Alcántara,True,0,1,0,0,39.41026172958824,-7.244173555257091
extremadura,05/09/1953,1953,9,5,1,,,S,La Vera,True,0,1,0,0,28.39538652504952,-16.555140535456733
extremadura,08/09/1953,1953,9,8,1,,,,,False,0,0,0,0,,
extremadura,08/09/1953,1953,9,8,4,,,,,False,0,0,0,0,,
extremadura,15/09/1953,1953,9,15,3,,,S,Malpartida de Cáceres,True,0,0,0,0,39.44606886667186,-6.505515540984494
hoy,15/09/1953,1953,9,15,8,BAD,,,,False,0,0,0,0,,
hoy,18/09/1953,1953,9,18,5,BAD,,S,Ribera del Fresno,True,0,0,0,0,38.55272384050062,-6.239432169970041
extremadura,19/09/1953,1953,9,19,1,,,S,"Extremadura, España",True,1,0,0,0,,
hoy,19/09/1953,1953,9,20,6,BAD,sequía,,Cabeza del Buey,True,0,0,0,0,38.72344255696252,-5.218974555781275
hoy,23/09/1953,1953,9,23,4,BAD,,S,Ribera del Fresno,True,0,0,0,0,38.55272384050062,-6.239432169970041
hoy,23/09/1953,1953,9,23,6,BAD,,,,False,0,0,0,0,,
hoy,27/09/1953,1953,9,27,1,CAC,,,,False,0,0,0,0,,
extremadura,28/09/1953,1953,9,28,8,,,S,Cáceres,True,0,1,0,0,39.47753910519658,-6.377428325189714
extremadura,29/09/1953,1953,9,29,2,,,,,False,0,0,0,0,,
extremadura,29/09/1953,1953,9,29,3,,,,,False,0,0,0,0,,
extremadura,29/09/1953,1953,9,29,4,,,,,False,0,0,0,0,,
extremadura,06/10/1953,1953,10,6,3,,,S,Malpartida de Cáceres,True,0,0,0,0,39.44606886667186,-6.505515540984494
extremadura,26/10/1953,1953,10,26,3,,,,,False,0,0,0,0,,
hoy,02/03/1954,1954,3,2,5,BAD,,,,False,0,0,0,0,,
hoy,04/03/1954,1954,3,4,5,BAD,sequía,,Castuera,True,1,1,0,0,38.72435378925819,-5.545060273541743
extremadura,05/08/1954,1954,8,5,1,,Sequía,,Granja de Torrehermosa,True,0,0,1,0,38.309434946037456,-5.596554823533248
extremadura,28/08/1954,1954,8,28,2,,,,,False,0,0,0,0,,
extremadura,15/09/1954,1954,9,15,2,,Lluvia,,Cáceres,True,0,0,0,0,39.47753910519658,-6.377428325189714
extremadura,25/09/1954,1954,9,25,3,,,,,False,0,0,0,0,,
extremadura,02/10/1954,1954,10,2,1,,,,,False,0,0,0,0,,
extremadura,08/10/1954,1954,10,8,2,,Lluvia,,Cáceres,True,0,1,0,0,39.47753910519658,-6.377428325189714
extremadura,15/10/1954,1954,10,15,4,,,,,False,0,0,0,0,,
extremadura,19/10/1954,1954,10,19,5,,Sequía,,Malpartida de Cáceres,True,0,0,0,0,39.44606886667186,-6.505515540984494
extremadura,25/10/1954,1954,10,25,1,,,,,False,0,0,0,0,,
extremadura,25/10/1954,1954,10,25,2,,,,,False,0,0,0,0,,
extremadura,25/10/1954,1954,10,25,3,,Lluvia,,Aliseda,True,0,0,0,0,39.423077972418,-6.694034836374631
extremadura,27/10/1954,1954,10,27,1,,Sequía,,Cáceres,True,1,1,0,0,39.47753910519658,-6.377428325189714
extremadura,28/10/1954,1954,10,28,4,,,,,False,0,0,0,0,,
extremadura,29/10/1954,1954,10,29,2,,Lluvia,,Cáceres,True,0,0,0,0,39.47753910519658,-6.377428325189714
extremadura,08/11/1954,1954,11,8,3,,Sequía,,Provincia de Cáceres,True,1,1,0,1,,
hoy,10/11/1954,1954,11,10,4,CAC,sequía,,Cabeza la Vaca,True,1,0,0,0,38.08575918703869,-6.419344251114348
extremadura,25/11/1954,1954,11,25,4,,,,,False,0,0,0,0,,
hoy,26/11/1954,1954,11,26,2,BAD,,,,False,0,0,0,0,,
extremadura,02/12/1954,1954,12,2,3,,,,,False,0,0,0,0,,
extremadura,28/12/1954,1954,12,28,1,,Sequía,,España,True,0,0,1,0,,
extremadura,03/01/1955,1955,1,3,2,,,,,False,0,0,0,0,,
extremadura,24/01/1955,1955,1,24,3,,Frío,,Hervás,True,1,0,0,0,40.2729367154098,-5.858512295669394
extremadura,01/02/1955,1955,2,1,3,,Lluvia,,España,True,0,0,0,0,,
extremadura,16/02/1955,1955,2,16,2,,,,,False,0,0,0,0,,
extremadura,18/05/1955,1955,5,18,3,,,,,False,0,0,0,0,,
extremadura,24/05/1955,1955,5,24,3,,Graniz,,Cáceres,True,0,0,0,0,39.47753910519658,-6.377428325189714
hoy,26/05/1955,1955,5,26,4,BAD,tormenta,,Zahínos,True,0,0,0,0,38.33155821023243,-6.953137496204532
hoy,27/05/1955,1955,5,27,6,BAD,,,,False,0,0,0,0,,
hoy,06/09/1955,1955,9,6,8,CAC,,,,False,0,0,0,0,,
hoy,09/09/1955,1955,9,9,4,BAD,tormenta,,Castuera,True,0,0,0,0,38.72435378925819,-5.545060273541743
hoy,12/10/1955,1955,10,12,6,BAD,,,,False,0,0,0,0,,
hoy,25/10/1955,1955,10,25,2,BAD,sequía,,Badajoz,True,0,0,0,0,38.871034753836994,-6.975421049278072
extremadura,10/11/1955,1955,11,10,3,,Sequía,,Malpartida de Cáceres,True,0,0,0,0,39.44606886667186,-6.505515540984494
extremadura,25/11/1955,1955,11,25,6,,,,,False,0,0,0,0,,
hoy,03/12/1955,1955,12,3,5,CAC,sequía,,Los Santos de Maimona,True,1,0,0,0,38.45117916787635,-6.38212720726155
hoy,17/12/1955,1955,12,17,2,BAD,,,,False,0,0,0,0,,
extremadura,10/01/1957,1957,1,10,3,,,,,False,0,0,0,0,,
extremadura,17/01/1957,1957,1,17,3,,,,,False,0,0,0,0,,
extremadura,18/01/1957,1957,1,18,2,,Frío,,Cáceres,True,0,0,0,1,39.47753910519658,-6.377428325189714
extremadura,21/01/1957,1957,1,21,3,,Sequía,,Hervás,True,0,0,0,0,40.2729367154098,-5.858512295669394
extremadura,02/02/1957,1957,2,2,3,,,,,False,0,0,0,0,,
extremadura,09/02/1957,1957,2,9,2,,Sequía,,Cáceres,True,0,0,0,0,39.47753910519658,-6.377428325189714
hoy,23/04/1957,1957,4,25,6,BAD,Seqía,,Don Benito,True,1,0,0,0,38.95620783267387,-5.859801918815306
hoy,27/04/1957,1957,4,27,6,CAC,,,,False,0,0,0,0,,
extremadura,04/12/1957,1957,12,4,1,,,,,False,0,0,0,0,,
extremadura,10/12/1957,1957,12,10,4,,Helada,,Trujillo,True,0,1,0,0,39.45888638575288,-5.876389783097755
extremadura,11/12/1957,1957,12,11,2,,Frío,,Cáceres,True,0,0,0,1,39.47753910519658,-6.377428325189714
extremadura,14/12/1957,1957,12,14,4,,,,,False,0,0,0,0,,
extremadura,01/02/1958,1958,2,1,3,,,,,False,0,0,0,0,,
hoy,06/02/1958,1958,2,6,6,BAD,Sequía,,Don Benito,True,0,0,0,0,38.95620783267387,-5.859801918815306
hoy,09/02/1958,1958,2,9,3,BAD,,,,False,0,0,0,0,,
extremadura,14/02/1958,1958,2,14,3,,Helada,,Trujillo,True,0,1,0,0,39.45888638575288,-5.876389783097755
extremadura,15/02/1958,1958,2,15,2,,Sequía,,Cáceres,True,0,0,0,0,39.47753910519658,-6.377428325189714
extremadura,18/02/1958,1958,2,18,3,,,,,False,0,0,0,0,,
hoy,10/09/1958,1958,9,10,8,BAD,,,,False,0,0,0,0,,
extremadura,22/09/1958,1958,9,22,6,,,,,False,0,0,0,0,,
hoy,25/09/1958,1958,9,25,6,BAD,Sequía,,Llerena,True,1,1,0,0,38.237805569650085,-6.014891730861935
extremadura,30/09/1958,1958,9,30,7,,,,Cáceres,True,0,0,0,0,39.47753910519658,-6.377428325189714
extremadura,06/11/1958,1958,11,6,8,,,,,False,0,0,0,0,,
hoy,07/11/1958,1958,11,7,5,BAD,,,,False,0,0,0,0,,
extremadura,08/11/1958,1958,11,8,5,,Sequía,,Torrejón el Rubio,True,1,0,1,0,39.770824622311125,-6.012335249034648
extremadura,12/11/1958,1958,11,12,7,,Sequía,,Torrejón el Rubio,True,0,1,1,0,39.770824622311125,-6.012335249034648
hoy,13/11/1958,1958,11,13,6,BAD,Sequía,,Trujillo,True,1,1,0,0,39.45888638575288,-5.876389783097755
extremadura,14/11/1958,1958,11,14,5,,Sequía,,Malpartida de Cáceres,True,1,1,1,0,39.44606886667186,-6.505515540984494
hoy,16/11/1958,1958,11,16,3,BAD,,,,False,0,0,0,0,,
extremadura,17/11/1958,1958,11,17,5,,,,,False,0,0,0,0,,
extremadura,20/11/1958,1958,11,20,5,,,,,False,0,0,0,0,,
extremadura,21/11/1958,1958,11,21,5,,,,,False,0,0,0,0,,
extremadura,24/11/1958,1958,11,24,2,,,,,False,0,0,0,0,,
extremadura,24/11/1958,1958,11,24,7,,Sequía,,Trujillo,True,0,1,0,0,39.45888638575288,-5.876389783097755
hoy,27/11/1958,1958,11,27,6,BAD,Sequía,,Cabeza del Buey,True,1,1,0,0,38.72344255696252,-5.218974555781275
extremadura,29/11/1958,1958,11,29,2,,Lluvia,,Cáceres,True,0,0,0,0,39.47753910519658,-6.377428325189714
extremadura,10/12/1958,1958,12,10,9,,,,,False,0,0,0,0,,
extremadura,17/12/1958,1958,12,17,2,,Granizo,,Cáceres,True,0,0,0,0,39.47753910519658,-6.377428325189714
extremadura,20/12/1958,1958,12,20,8,,,,,False,0,0,0,0,,
extremadura,29/12/1958,1958,12,29,5,,Sequía,,Cáceres,True,1,1,1,0,39.47753910519658,-6.377428325189714
extremadura,02/03/1959,1959,3,2,4,,,,,False,0,0,0,0,,
extremadura,05/03/1959,1959,3,5,6,,Lluvia,,Extremadura,True,1,0,0,0,,
extremadura,10/03/1959,1959,3,10,10,,,,,False,0,0,0,0,,
extremadura,31/03/1959,1959,3,31,7,,Granizo,,Cáceres,True,0,0,0,0,39.47753910519658,-6.377428325189714
hoy,02/10/1959,1959,10,2,3,BAD,,,,False,0,0,0,0,,
hoy,13/11/1959,1959,10,13,6,BAD,Sequía,,Cabeza del Buey,True,1,1,0,0,38.72344255696252,-5.218974555781275
extremadura,12/05/1960,1960,5,12,4,,,,,False,0,0,0,0,,
extremadura,27/05/1960,1960,5,27,9,,Lluvia,,Cáceres,True,0,0,0,0,39.47753910519658,-6.377428325189714
hoy,17/09/1961,1961,9,17,8,CAC,,,,False,0,0,0,0,,
hoy,20/09/1961,1961,9,20,2,CAC,Sequía,,Trujillo,True,0,0,0,0,39.45888638575288,-5.876389783097755
hoy,17/03/1962,1962,3,17,9,BAD,sequía,,Zahínos,True,0,0,0,0,38.33155821023243,-6.953137496204532
hoy,20/03/1962,1962,3,20,1,CAC,,,,False,0,0,0,0,,
hoy,01/08/1962,1962,8,1,6,CAC,,,,False,0,0,0,0,,
hoy,23/08/1962,1962,8,23,9,BAD,sequía,,Granja de Torrehermosa,True,1,0,0,0,38.309434946037456,-5.596554823533248
extremadura,10/09/1962,1962,9,10,4,,Calor,,Cáceres,True,0,0,0,0,39.47753910519658,-6.377428325189714
hoy,11/09/1962,1962,9,11,3,BAD,,,,False,0,0,0,0,,
hoy,13/09/1962,1962,9,13,1,BAD,,,,False,0,0,0,0,,
hoy,14/09/1962,1962,9,14,5,BAD,sequía,,Extremadura,True,0,0,0,0,,
hoy,15/09/1962,1962,9,15,4,BAD,tormenta,,Granja de Torrehermosa,True,0,0,0,0,38.309434946037456,-5.596554823533248
hoy,19/09/1962,1962,9,19,5,BAD,,,,False,0,0,0,0,,
hoy,20/09/1962,1962,9,20,2,CAC,sequía,,Plasencia,True,1,0,1,0,40.03535535252543,-6.089134757182878
hoy,21/09/1962,1962,9,21,2,CAC,sequía,,Plaasencia,True,0,0,0,0,,
extremadura,21/09/1962,1962,9,21,4,,Calor,,Cáceres,True,0,0,0,0,39.47753910519658,-6.377428325189714
extremadura,22/09/1962,1962,9,22,1,,,,,False,0,0,0,0,,
hoy,22/09/1962,1962,9,22,6,CAC,,,,False,0,0,0,0,,
hoy,23/09/1962,1962,9,23,2,BAD,sequía,,Badajoz,True,0,0,0,0,38.871034753836994,-6.975421049278072
hoy,23/09/1962,1962,9,23,10,BAD,,,,False,0,0,0,0,,
hoy,27/09/1962,1962,9,27,1,BAD,,,,False,0,0,0,0,,
extremadura,27/09/1962,1962,9,27,4,,,,,False,0,0,0,0,,
hoy,29/09/1962,1962,9,29,6,BAD,sequía,,Malpartida de Cáceres,True,0,0,0,0,39.44606886667186,-6.505515540984494
extremadura,02/01/1963,1963,1,2,5,,Helada,,Malpartida de Cáceres,True,0,0,0,0,39.44606886667186,-6.505515540984494
extremadura,29/01/1963,1963,1,29,7,,,,,False,0,0,0,0,,
hoy,08/09/1963,1963,9,8,16,CAC,sequía,,Extremadura,True,0,0,0,0,,
hoy,12/09/1963,1963,9,12,3,CAC,,,,False,0,0,0,0,,
hoy,06/10/1963,1963,10,6,8,CAC,sequía,,Bienvenida,True,0,0,0,0,38.2998430954534,-6.208781814117151
extremadura,10/10/1963,1963,10,10,3,,Sequía,,Zafra,True,0,0,0,0,38.42187307146895,-6.416697978031944
hoy,15/10/1963,1963,10,15,9,BAD,,,,False,0,0,0,0,,
hoy,18/10/1963,1963,10,18,8,CAC,sequía,,Peraleda del Zaucejo,True,1,0,0,0,38.47402030582495,-5.566446586078161
extremadura,19/10/1963,1963,10,19,1,,,,,False,0,0,0,0,,
hoy,29/10/1963,1963,10,29,2,BAD,,,,False,0,0,0,0,,
hoy,05/11/1963,1963,11,5,4,CAC,sequía,,Valencia de Alcántara,True,0,0,0,0,39.41026172958824,-7.244173555257091
extremadura,09/11/1963,1963,11,9,3,,Lluvia,,Valverde del Fresno,True,1,1,0,0,40.22291667287971,-6.878290295453885
hoy,23/11/1963,1963,11,23,7,BAD,,,,False,0,0,0,0,,
extremadura,27/11/1963,1963,11,27,6,,,,,False,0,0,0,0,,
hoy,04/02/1964,1964,2,4,7,CAC,,,,False,0,0,0,0,,
hoy,15/02/1964,1964,2,15,4,CAC,Sequía,,Plasencia,True,0,0,0,0,40.03535535252543,-6.089134757182878
extremadura,06/01/1965,1965,1,5,11,,Sequia,,Trujillo,True,0,1,0,0,39.45888638575288,-5.876389783097755
extremadura,08/01/1965,1965,1,8,12,,,,,False,0,0,0,0,,
extremadura,03/02/1965,1965,2,3,9,,Lluvia,,Valencia de Alcántara,True,0,0,0,0,39.41026172958824,-7.244173555257091
extremadura,25/02/1965,1965,2,25,10,,,,,False,0,0,0,0,,
hoy,06/05/1965,1965,5,6,7,BAD,sequía,,Extremadura,True,1,0,0,0,,
extremadura,07/05/1965,1965,5,7,1,,,,,False,0,0,0,0,,
extremadura,08/05/1965,1965,5,8,2,,,,,False,0,0,0,0,,
extremadura,13/05/1965,1965,5,13,3,,Calor,,Cáceres,True,0,0,0,0,39.47753910519658,-6.377428325189714
extremadura,13/05/1965,1965,5,13,4,,,,,False,0,0,0,0,,
hoy,13/05/1965,1965,5,13,8,BAD,,,,False,0,0,0,0,,
extremadura,18/05/1965,1965,5,18,9,,Sequía,,Valencia de Alcántara,True,0,0,0,0,39.41026172958824,-7.244173555257091
hoy,22/05/1965,1965,5,22,4,CAC,sequía,,Jaraíz de la Vera,True,0,0,0,0,40.06145730872112,-5.752227484611712
hoy,25/05/1965,1965,5,25,15,BAD,,,,False,0,0,0,0,,
extremadura,27/05/1965,1965,5,27,6,,Sequía,,Extremadura,True,0,0,0,0,,
extremadura,28/05/1965,1965,5,28,22,,Sequía,,Cáceres,True,0,0,0,0,39.47753910519658,-6.377428325189714
extremadura,29/05/1965,1965,5,29,5,,,,,False,0,0,0,0,,
hoy,03/06/1965,1965,6,3,10,BAD,,,,False,0,0,0,0,,
hoy,05/06/1965,1965,6,5,3,CAC,nieve,,Valle del Jerte,True,1,0,1,0,,
hoy,23/06/1965,1965,6,23,4,CAC,sequía,,Jaraíz de la Vera,True,0,0,0,0,40.06145730872112,-5.752227484611712
hoy,27/06/1965,1965,6,27,6,CAC,,,,False,0,0,0,0,,
hoy,08/07/1965,1965,7,8,8,BAD,sequía,,Zahínos,True,1,0,0,0,38.33155821023243,-6.953137496204532
hoy,11/07/1965,1965,7,11,1,BAD,sequía,,Extremadura,True,1,0,0,0,,
hoy,11/07/1965,1965,7,11,4,CAC,sequía,,Plasencia,True,0,0,1,0,40.03535535252543,-6.089134757182878
hoy,15/07/1965,1965,7,15,5,BAD,,,,False,0,0,0,0,,
hoy,16/07/1965,1965,7,16,1,CAC,,,,False,0,0,0,0,,
hoy,17/07/1965,1965,7,17,2,BAD,,,,False,0,0,0,0,,
hoy,01/08/1965,1965,8,1,10,BAD,,,,False,0,0,0,0,,
hoy,04/08/1965,1965,8,4,3,CAC,,,,False,0,0,0,0,,
extremadura,05/08/1965,1965,8,5,4,,Sequía,,Plasencia y Valle del Jerte,True,0,0,1,0,40.03535535252543,-6.089134757182878
hoy,06/08/1965,1965,8,6,3,CAC,sequía,,Valle del Jerte,True,0,0,0,0,,
extremadura,10/08/1965,1965,8,10,8,,,,,False,0,0,0,0,,
hoy,11/08/1965,1965,8,11,5,BAD,,,,False,0,0,0,0,,
extremadura,13/08/1965,1965,8,13,10,,,,,False,0,0,0,0,,
hoy,14/08/1965,1965,8,14,3,CAC,sequía,,Plasencia,True,0,0,0,0,40.03535535252543,-6.089134757182878
extremadura,21/08/1965,1965,8,21,4,,,,,False,0,0,0,0,,
hoy,23/08/1965,1965,8,28,3,CAC,sequía,el el programa sale el 28,Valle del Jerte,True,0,0,1,0,,
extremadura,30/08/1965,1965,8,30,3,,Sequía,,Plasencia,True,0,0,1,0,40.03535535252543,-6.089134757182878
extremadura,31/08/1965,1965,8,31,10,,Sequía,,Las Hurdes,True,0,0,0,0,,
extremadura,02/09/1965,1965,9,2,6,,,,,False,0,0,0,0,,
extremadura,02/09/1965,1965,9,2,9,,Sequía,,Torrejón el Rubio,True,0,0,0,0,39.770824622311125,-6.012335249034648
extremadura,04/09/1965,1965,9,4,9,,Lluvia,,Valencia de Alcántara,True,0,0,1,0,39.41026172958824,-7.244173555257091
extremadura,08/09/1965,1965,9,8,2,,,,,False,0,0,0,0,,
extremadura,10/09/1965,1965,9,10,3,,,,,False,0,0,0,0,,
extremadura,11/09/1965,1965,9,11,3,,Sequía,,Cáceres,True,0,0,0,0,39.47753910519658,-6.377428325189714
hoy,16/09/1965,1965,9,16,8,BAD,,,,False,0,0,0,0,,
hoy,16/09/1965,1965,9,16,11,BAD,,,,False,0,0,0,0,,
extremadura,22/09/1965,1965,9,22,4,,,,,False,0,0,0,0,,
extremadura,24/09/1965,1965,9,24,3,,Lluvia,,Cáceres,True,0,0,0,0,39.47753910519658,-6.377428325189714
hoy,25/09/1965,1965,9,25,1,CAC,sequía,,Badajoz,True,0,0,0,0,38.871034753836994,-6.975421049278072
extremadura,25/09/1965,1965,9,25,8,,Lluvia,,Valencia de Alcántara,True,0,0,0,0,39.41026172958824,-7.244173555257091
hoy,26/09/1965,1965,9,26,3,CAC,sequía,,Plasencia,True,0,0,0,0,40.03535535252543,-6.089134757182878
extremadura,27/09/1965,1965,9,27,2,,,,,False,0,0,0,0,,
hoy,01/10/1965,1965,10,1,4,CAC,tormenta,,Valle del Jerte,True,0,0,0,0,,
hoy,03/10/1965,1965,10,3,11,SUP,,,,False,0,0,0,0,,
hoy,28/10/1965,1965,10,28,3,CAC,sequía,,Plasencia,True,0,1,0,0,40.03535535252543,-6.089134757182878
hoy,28/10/1965,1965,10,28,5,BAD,,,,False,0,0,0,0,,
hoy,07/11/1965,1965,11,7,4,CAC,sequía,,Valle del Jerte,True,1,0,1,0,,
hoy,19/11/1965,1965,11,19,10,CAC,,,,False,0,0,0,0,,
extremadura,28/12/1965,1965,12,28,3,,Lluvia,,Cáceres,True,0,0,0,0,39.47753910519658,-6.377428325189714
extremadura,29/12/1965,1965,12,29,3,,,,,False,0,0,0,0,,
hoy,10/02/1966,1966,2,10,6,BAD,,,,False,0,0,0,0,,
hoy,19/02/1966,1966,2,19,3,CAC,nieve,,Valle del Jerte,True,1,0,0,0,,
hoy,08/04/1966,1966,4,8,10,CAC,tormentas,,Granja de Torrehermosa,True,0,0,0,0,38.309434946037456,-5.596554823533248
hoy,22/04/1966,1966,4,22,12,BAD,,,,False,0,0,0,0,,
extremadura,03/02/1967,1967,2,3,2,,,,,False,0,0,0,0,,
extremadura,24/02/1967,1967,2,24,5,,Sequía,,Cáceres,True,1,0,0,0,39.47753910519658,-6.377428325189714
extremadura,09/08/1967,1967,8,9,11,,,,,False,0,0,0,0,,
extremadura,26/08/1967,1967,8,26,7,,,,,False,0,0,0,0,,
extremadura,28/08/1967,1967,8,28,2,,Lluvia,,Cáceres,True,0,0,1,0,39.47753910519658,-6.377428325189714
extremadura,29/08/1967,1967,8,29,3,,Lluvia,,Cáceres,True,0,0,1,0,39.47753910519658,-6.377428325189714
extremadura,08/09/1967,1967,9,8,12,,,,,False,0,0,0,0,,
extremadura,20/09/1967,1967,9,20,4,,,,,False,0,0,0,0,,
extremadura,20/09/1967,1967,9,21,3,,Sequía,,Cáceres,True,0,0,1,0,39.47753910519658,-6.377428325189714
extremadura,23/09/1967,1967,9,23,8,,Lluvia,,Valencia de Alcántara,True,0,0,0,0,39.41026172958824,-7.244173555257091
extremadura,03/10/1967,1967,10,3,1,,,,,False,0,0,0,0,,
extremadura,05/10/1967,1967,10,5,11,,Lluvia,,Valencia de Alcántara,True,0,0,0,0,39.41026172958824,-7.244173555257091
extremadura,13/10/1967,1967,10,13,3,,Lluvia,,Cáceres,True,0,0,0,0,39.47753910519658,-6.377428325189714
extremadura,25/10/1967,1967,10,25,3,,,,,False,0,0,0,0,,
extremadura,04/01/1968,1968,1,4,6,,Frío,,Valencia de Alcántara,True,0,0,0,0,39.41026172958824,-7.244173555257091
extremadura,05/01/1968,1968,1,5,9,,,,,False,0,0,0,0,,
extremadura,15/01/1968,1968,1,15,4,,Sequía,,Cáceres,True,0,0,0,0,39.47753910519658,-6.377428325189714
extremadura,16/01/1968,1968,1,16,3,,Lluvia,,Cáceres,True,0,0,1,0,39.47753910519658,-6.377428325189714
extremadura,16/01/1968,1968,1,16,3,,Sequía,,Cáceres,True,1,0,1,0,39.47753910519658,-6.377428325189714
extremadura,17/01/1968,1968,1,17,3,,Lluvia,,Cáceres,True,0,0,1,0,39.47753910519658,-6.377428325189714
extremadura,19/01/1968,1968,1,19,1,,,,,False,0,0,0,0,,
extremadura,26/01/1968,1968,1,26,4,,,,,False,0,0,0,0,,
extremadura,29/01/1968,1968,1,29,10,,,,,False,0,0,0,0,,
extremadura,30/01/1968,1968,1,30,1,,,,,False,0,0,0,0,,
extremadura,01/02/1968,1968,2,1,3,,Sequía,,Cáceres,True,0,0,1,0,39.47753910519658,-6.377428325189714
extremadura,01/02/1968,1968,2,1,4,,Lluvia,,Cáceres,True,0,0,1,0,39.47753910519658,-6.377428325189714
extremadura,08/02/1968,1968,2,8,11,,,,,False,0,0,0,0,,
extremadura,14/02/1968,1968,2,14,2,,,,,False,0,0,0,0,,
extremadura,16/07/1968,1968,7,16,11,,,,,False,0,0,0,0,,
extremadura,26/07/1968,1968,7,26,7,,Sequía,,Cáceres y Casar de Cáceres,True,0,0,1,0,39.51932375299885,-6.39737514119614
hoy,01/08/1968,1968,8,1,4,BAD,,,,False,0,0,0,0,,
extremadura,11/08/1968,1968,8,11,9,,,,,False,0,0,0,0,,
extremadura,27/08/1968,1968,8,27,3,,Sequía,,Cáceres,True,0,0,0,0,39.47753910519658,-6.377428325189714
hoy,31/08/1968,1968,8,31,9,BAD,Tormenta,,Valencia del Ventoso,True,0,0,0,0,38.26671461266538,-6.475385983672627
extremadura,12/09/1968,1968,9,12,10,,,,,False,0,0,0,0,,
extremadura,14/09/1968,1968,9,14,3,,Lluvia,,Cáceres,True,0,0,0,0,39.47753910519658,-6.377428325189714
extremadura,21/10/1968,1968,10,24,5,,Sequía,,Valverde del Fresno,True,1,0,0,0,40.22291667287971,-6.878290295453885
extremadura,31/10/1968,1968,10,31,4,,,,,False,0,0,0,0,,
extremadura,02/11/1968,1968,11,2,10,,Lluvia,,Valencia de Alcántara,True,0,0,0,0,39.41026172958824,-7.244173555257091
extremadura,05/11/1968,1968,11,5,6,,Lluvia,,Zarza la Mayor,True,0,0,0,0,39.87691644793317,-6.861602854438933
extremadura,14/11/1968,1968,11,14,8,,,,,False,0,0,0,0,,
extremadura,20/11/1968,1968,11,20,5,,,,,False,0,0,0,0,,
hoy,08/03/1970,1970,3,8,10,BAD,,,,False,0,0,0,0,,
hoy,25/03/1970,1970,3,25,13,BAD,sequía,,Cabeza del Buey,True,1,0,0,0,38.72344255696252,-5.218974555781275
extremadura,03/04/1970,1970,4,3,2,,,,,False,0,0,0,0,,
hoy,03/04/1970,1970,4,3,9,BAD,sequía,,Mérida,True,0,0,0,0,38.91549201670453,-6.341926065709169
extremadura,04/04/1970,1970,4,4,6,,,,,False,0,0,0,0,,
hoy,05/04/1970,1970,4,5,17,BAD,,,,False,0,0,0,0,,
extremadura,07/04/1970,1970,4,7,2,,,,,False,0,0,0,0,,
extremadura,17/04/1970,1970,4,17,1,,,,,False,0,0,0,0,,
hoy,18/04/1970,1970,4,18,11,CAC,,,,False,0,0,0,0,,
hoy,23/04/1970,1970,4,23,18,BAD,,,,False,0,0,0,0,,
extremadura,24/04/1970,1970,4,24,3,,Lluvia,,Extremadura,True,1,1,0,0,,
extremadura,25/04/1970,1970,4,25,3,,Sequía,,Cáceres,True,0,0,0,0,39.47753910519658,-6.377428325189714
hoy,25/04/1970,1970,4,25,11,CAC,sequía,,Serradilla,True,1,1,0,0,39.82891014852736,-6.139142666346821
extremadura,29/04/1970,1970,4,29,4,,Sequía,,Cáceres,True,0,0,1,0,39.47753910519658,-6.377428325189714
extremadura,29/04/1970,1970,4,29,6,,Lluvia,,Provincia de Cáceres,True,1,1,0,0,,
hoy,30/04/1970,1970,4,30,9,CAC,sequía,,Cáceres,True,0,0,1,0,39.47753910519658,-6.377428325189714
extremadura,01/05/1970,1970,5,1,5,,Sequía,,Provincia de Cáceres,True,1,1,0,0,,
hoy,05/05/1970,1970,5,5,9,BAD,sequía,,Badajoz,True,0,0,0,0,38.871034753836994,-6.975421049278072
hoy,06/05/1970,1970,5,6,11,CAC,desbordó,,Plasencia,True,0,0,0,0,40.03535535252543,-6.089134757182878
hoy,09/05/1970,1970,5,9,7,BAD,,,,False,0,0,0,0,,
hoy,10/05/1970,1970,5,10,13,CAC,sequía,,Navas del Madroño,True,1,1,1,0,39.62227900373277,-6.653402851935974
hoy,12/05/1970,1970,5,12,4,BAD,,,,False,0,0,0,0,,
hoy,13/05/1970,1970,5,13,10,CAC,nieve,,Cabezuela del Valle,True,0,0,0,0,40.19423940726183,-5.805892700156768
hoy,13/05/1970,1970,5,13,12,CAC,sequía,,Valencia de Alcántara,True,0,0,0,0,39.41026172958824,-7.244173555257091
hoy,13/05/1970,1970,5,13,15,BAD,,,,False,0,0,0,0,,
hoy,13/05/1970,1970,5,13,17,BAD,sequía,,Valdelacalzada,True,0,0,0,0,38.89085708615296,-6.700705445184523
hoy,14/05/1970,1970,5,14,8,BAD,,,,False,0,0,0,0,,
hoy,15/05/1970,1970,5,15,3,BAD,,,,False,0,0,0,0,,
hoy,15/05/1970,1970,5,15,11,CAC,sequía,,Salvatierra,True,0,0,0,0,42.85385224316684,-2.390527487336323
hoy,15/05/1970,1970,5,15,14,BAD,,,,False,0,0,0,0,,
hoy,20/05/1970,1970,5,20,12,CAC,nieve,,Valle del Jerte,True,1,1,0,0,,
extremadura,21/05/1970,1970,5,21,5,,,,,False,0,0,0,0,,
hoy,22/05/1970,1970,5,22,5,BAD,,,,False,0,0,0,0,,
hoy,23/05/1970,1970,5,23,18,MER,,,,False,0,0,0,0,,
hoy,14/07/1970,1970,7,14,9,CAC,,,,False,0,0,0,0,,
hoy,21/07/1970,1970,7,21,10,CAC,sequías,,Abadía,True,1,0,0,0,40.259088154801866,-5.977752706812148
hoy,06/09/1970,1970,9,6,21,BAD,,,,False,0,0,0,0,,
extremadura,14/09/1970,1970,9,14,12,,,,,False,0,0,0,0,,
hoy,24/09/1970,1970,9,24,12,BAD,sequía,,"Zarza de Alange, La Zarza",True,0,0,0,0,38.81787170807203,-6.2162198805710505
extremadura,30/09/1970,1970,9,30,4,,Sequía,,Cáceres,True,0,0,0,0,39.47753910519658,-6.377428325189714
extremadura,01/10/1970,1970,10,1,5,,,,,False,0,0,0,0,,
extremadura,02/10/1970,1970,10,2,5,,Sequía,,Cáceres,True,1,1,0,0,39.47753910519658,-6.377428325189714
extremadura,03/10/1970,1970,10,3,3,,Calor,,Cáceres,True,0,1,0,0,39.47753910519658,-6.377428325189714
extremadura,03/10/1970,1970,10,3,10,,Lluvia,,Plasencia,True,1,1,0,0,40.03535535252543,-6.089134757182878
hoy,03/10/1970,1970,10,3,12,CAC,sequía,,Almendralejo,True,1,0,0,0,38.68340240841623,-6.407120160184139
hoy,04/10/1970,1970,10,4,10,CAC,,,,False,0,0,0,0,,
extremadura,05/10/1970,1970,10,5,7,,Lluvia,,Extremadura,True,1,1,0,0,,
extremadura,06/10/1970,1970,10,6,1,,,,,False,0,0,0,0,,
extremadura,06/10/1970,1970,10,6,10,,Lluvia,,Cáceres,True,0,1,0,0,39.47753910519658,-6.377428325189714
extremadura,07/10/1970,1970,10,7,6,,,,,False,0,0,0,0,,
extremadura,07/10/1970,1970,10,7,16,,,,,False,0,0,0,0,,
hoy,08/10/1970,1970,10,8,12,BAD,sequía,,Aceuchal,True,1,0,0,0,38.64556520246269,-6.485694934204259
extremadura,10/10/1970,1970,10,10,10,,,,,False,0,0,0,0,,
hoy,14/10/1970,1970,10,14,5,BAD,,,,False,0,0,0,0,,
extremadura,14/10/1970,1970,10,14,7,,,,,False,0,0,0,0,,
extremadura,15/10/1970,1970,10,15,2,,,,,False,0,0,0,0,,
hoy,16/10/1970,1970,10,16,12,CAC,sequía,,Casillas de Coria,True,0,1,0,0,39.96619767065833,-6.636787130689871
hoy,17/10/1970,1970,10,17,9,MER,,,,False,0,0,0,0,,
hoy,18/10/1970,1970,10,18,6,BAD,,,,False,0,0,0,0,,
extremadura,19/10/1970,1970,10,19,7,,,,,False,0,0,0,0,,
hoy,20/10/1970,1970,10,20,12,MER,sequía,,Zalamea de la Serena,True,1,1,0,0,38.64988080204128,-5.65827426712498
extremadura,21/10/1970,1970,10,21,5,,,,,False,0,0,0,0,,
extremadura,26/10/1970,1970,10,26,7,,Lluvia,,Valencia de Alcántara,True,1,1,1,0,39.41026172958824,-7.244173555257091
extremadura,26/10/1970,1970,10,26,16,,,,,False,0,0,0,0,,
hoy,28/10/1970,1970,10,28,7,BAD,,,,False,0,0,0,0,,
hoy,28/10/1970,1970,10,28,11,CAC,sequía,,Plasencia,True,1,0,0,0,40.03535535252543,-6.089134757182878
hoy,29/10/1970,1970,10,29,9,BAD,sequía,,Badajoz,True,0,0,0,0,38.871034753836994,-6.975421049278072
extremadura,29/10/1970,1970,10,29,13,,Lluvia,,Garrovillas de Alconétar,True,0,0,1,0,39.710601150536334,-6.550028984680883
extremadura,30/10/1970,1970,10,30,12,,Sequía,,Zarza la Mayor,True,1,1,0,0,39.87691644793317,-6.861602854438933
extremadura,31/10/1970,1970,10,31,3,,Luvia,,Cáceres,True,0,0,0,0,39.47753910519658,-6.377428325189714
extremadura,31/10/1970,1970,10,31,9,,Lluvia,,Plasencia,True,1,1,0,0,40.03535535252543,-6.089134757182878
hoy,31/10/1970,1970,10,31,9,BAD,,,,False,0,0,0,0,,
extremadura,03/11/1970,1970,11,3,5,,Sequía,,España,True,0,1,0,0,,
extremadura,03/11/1970,1970,11,3,6,,Lluvia,,Valencia de Alcántara,True,1,1,0,0,39.41026172958824,-7.244173555257091
hoy,03/11/1970,1970,11,3,11,CAC,sequía,,Plasencia,True,1,1,1,0,40.03535535252543,-6.089134757182878
extremadura,04/11/1970,1970,11,4,8,,,,,False,0,0,0,0,,
extremadura,05/11/1970,1970,11,5,7,,Sequía,,España,True,1,1,0,0,,
extremadura,05/11/1970,1970,11,5,10,,,,,False,0,0,0,0,,
extremadura,05/11/1970,1970,11,5,11,,Sequía,,España,True,1,1,0,0,,
hoy,07/11/1970,1970,11,7,1,BAD,,,,False,0,0,0,0,,
extremadura,07/11/1970,1970,11,7,3,,Sequía,,Cáceres,True,0,0,0,0,39.47753910519658,-6.377428325189714
hoy,06/11/1970,1970,11,7,9,BAD,Sequía,,Badajoz,True,0,1,0,0,38.871034753836994,-6.975421049278072
hoy,08/11/1970,1970,11,8,11,CAC,sequía,,Plasencia,True,0,0,0,0,40.03535535252543,-6.089134757182878
extremadura,09/11/1970,1970,11,9,5,,Lluvia,,Cáceres,True,1,1,0,0,39.47753910519658,-6.377428325189714
extremadura,09/11/1970,1970,11,9,8,,Sequía,,Trujillo,True,1,1,0,0,39.45888638575288,-5.876389783097755
hoy,10/11/1970,1970,11,10,9,MER,,,,False,0,0,0,0,,
extremadura,11/11/1970,1970,11,11,11,,Sequía,,Cáceres,True,1,1,0,0,39.47753910519658,-6.377428325189714
extremadura,12/11/1970,1970,11,12,15,,Lluvia,,Cáceres,True,1,1,0,0,39.47753910519658,-6.377428325189714
extremadura,13/11/1970,1970,11,13,3,,Sequía,,Cáceres,True,0,0,0,0,39.47753910519658,-6.377428325189714
extremadura,13/11/1970,1970,11,13,12,,Sequía,,Valverde del Fresno,True,1,1,0,0,40.22291667287971,-6.878290295453885
hoy,14/11/1970,1970,11,14,4,BAD,,,,False,0,0,0,0,,
hoy,14/11/1970,1970,11,14,14,BAD,,,,False,0,0,0,0,,
hoy,15/11/1970,1970,11,15,9,MER,,,,False,0,0,0,0,,
hoy,15/11/1970,1970,11,15,28,MER,,,,False,0,0,0,0,,
extremadura,16/11/1970,1970,11,16,5,,Frío,,Cáceres,True,0,1,0,0,39.47753910519658,-6.377428325189714
extremadura,16/11/1970,1970,11,16,9,,,,,False,0,0,0,0,,
hoy,17/11/1970,1970,11,17,11,CAC,sequía,,Serradilla,True,1,1,0,0,39.82891014852736,-6.139142666346821
hoy,19/11/1970,1970,11,19,11,BAD,sequía,,Badajoz,True,0,0,0,0,38.871034753836994,-6.975421049278072
extremadura,19/11/1970,1970,11,19,12,,,,,False,0,0,0,0,,
hoy,20/11/1970,1970,11,20,1,CAC,,,,False,0,0,0,0,,
extremadura,21/11/1970,1970,11,21,5,,,,,False,0,0,0,0,,
extremadura,21/11/1970,1970,11,21,11,,Lluvia,,Valverde del Fresno,True,0,0,0,0,40.22291667287971,-6.878290295453885
hoy,21/11/1970,1970,11,21,12,MER,sequía,,Salvatierra de los Barros,True,0,1,0,0,38.4909049414581,-6.684560845759512
extremadura,21/11/1970,1970,11,21,14,,,,,False,0,0,0,0,,
hoy,22/11/1970,1970,11,22,8,BAD,Sequía,,Castuera,True,0,1,0,0,38.72435378925819,-5.545060273541743
hoy,22/11/1970,1970,11,22,11,CAC,sequía,,Plasencia,True,0,0,0,0,40.03535535252543,-6.089134757182878
hoy,22/11/1970,1970,11,22,27,BAD,,,,False,0,0,0,0,,
extremadura,23/11/1970,1970,11,23,12,,,,,False,0,0,0,0,,
extremadura,24/11/1970,1970,11,24,15,,,,,False,0,0,0,0,,
extremadura,25/11/1970,1970,11,25,5,,,,,False,0,0,0,0,,
extremadura,25/11/1970,1970,11,25,11,,,,,False,0,0,0,0,,
extremadura,28/11/1970,1970,11,28,8,,,,,False,0,0,0,0,,
extremadura,28/11/1970,1970,11,28,16,,,,,False,0,0,0,0,,
extremadura,30/11/1970,1970,11,30,12,,,,,False,0,0,0,0,,
extremadura,02/12/1970,1970,12,2,10,,Lluvia,,Valencia de Alcántara,True,1,1,0,0,39.41026172958824,-7.244173555257091
hoy,04/12/1970,1970,12,4,9,MER,sequía,,Badajoz,True,0,1,0,0,38.871034753836994,-6.975421049278072
hoy,06/12/1970,1970,12,6,5,BAD,,,,False,0,0,0,0,,
extremadura,08/12/1970,1970,12,8,12,,,,,False,0,0,0,0,,
hoy,24/12/1970,1970,12,24,9,CAC,sequía,,Cáceres,True,0,0,1,0,39.47753910519658,-6.377428325189714
hoy,24/12/1970,1970,12,24,11,MER,,,,False,0,0,0,0,,
extremadura,02/01/1971,1971,1,2,6,,Frío,,Valencia de Alcántara,True,1,1,0,0,39.41026172958824,-7.244173555257091
extremadura,07/01/1971,1971,1,7,12,,,,,False,0,0,0,0,,
extremadura,02/03/1971,1971,3,2,7,,Lluvia,,Valencia de Alcántara,True,1,1,0,0,39.41026172958824,-7.244173555257091
extremadura,02/03/1971,1971,3,2,8,,Lluvia,,Zarza la Mayor,True,1,1,0,0,39.87691644793317,-6.861602854438933
extremadura,05/03/1971,1971,3,5,8,,,,,False,0,0,0,0,,
hoy,06/03/1971,1971,3,6,11,CAC,Sequía,,Cuacos de Yuste,True,1,0,1,0,40.10488626028864,-5.724930542849765
extremadura,12/03/1971,1971,3,12,3,,,,,False,0,0,0,0,,
extremadura,18/03/1971,1971,3,18,3,,,,,False,0,0,0,0,,
extremadura,18/03/1971,1971,3,18,7,,,,,False,0,0,0,0,,
extremadura,25/03/1971,1971,3,25,4,,Sequía,,Cáceres,True,0,0,1,0,39.47753910519658,-6.377428325189714
extremadura,27/03/1971,1971,3,27,14,,Sequía,,Valencia de Alcántara,True,1,1,0,0,39.41026172958824,-7.244173555257091
hoy,28/03/1971,1971,3,28,22,CAC,,,,False,0,0,0,0,,
extremadura,30/03/1971,1971,3,30,7,,,,,False,0,0,0,0,,
extremadura,31/03/1971,1971,3,31,3,,Sequía,,Cáceres,True,0,0,1,0,39.47753910519658,-6.377428325189714
extremadura,02/04/1971,1971,4,2,3,,Lluvia,,Cáceres,True,0,0,0,0,39.47753910519658,-6.377428325189714
extremadura,20/04/1971,1971,4,20,5,,,,,False,0,0,0,0,,
extremadura,08/06/1971,1971,6,8,3,,Lluvia,,Cáceres,True,0,0,0,0,39.47753910519658,-6.377428325189714
extremadura,14/06/1971,1971,6,14,4,,,,,False,0,0,0,0,,
hoy,02/11/1971,1971,11,2,4,BAD,,,,False,0,0,0,0,,
extremadura,02/11/1971,1971,11,3,14,,Lluvia,,Valencia de Alcántara,True,0,0,0,0,39.41026172958824,-7.244173555257091
hoy,04/11/1971,1971,11,4,1,CAC,,,,False,0,0,0,0,,
hoy,06/11/1971,1971,11,6,12,MER,Sequia,,Feria,True,1,0,0,0,38.51161313869938,-6.563395428437351
hoy,07/11/1971,1971,11,7,13,BAD,Sequia,,Salvatierra de los Barros,True,1,1,0,0,38.4909049414581,-6.684560845759512
hoy,09/11/1971,1971,11,9,11,CAC,,,,False,0,0,0,0,,
hoy,13/11/1971,1971,11,13,12,BAD,Sequia,,Oliva de la Frontera,True,1,1,0,0,38.27669744408432,-6.917596372554035
hoy,17/11/1971,1971,11,17,2,BAD,,,,False,0,0,0,0,,
hoy,17/11/1971,1971,11,17,12,CAC,Sequia,,Cuacos de Yuste,True,1,1,0,0,40.10488626028864,-5.724930542849765
hoy,19/11/1971,1971,11,19,12,MER,,,,False,0,0,0,0,,
extremadura,20/11/1971,1971,11,20,12,,,,,False,0,0,0,0,,
hoy,21/11/1971,1971,11,21,10,CAC,Sequia,,Brozas,True,1,1,0,0,39.61234132301401,-6.778565289568476
hoy,23/11/1971,1971,11,21,11,BAD,Sequia,,Cabeza la Vaca,True,1,0,0,0,38.08575918703869,-6.419344251114348
extremadura,23/11/1971,1971,11,23,13,,Lluvia,,Zarza la Mayor,True,0,0,0,0,39.87691644793317,-6.861602854438933
hoy,26/11/1971,1971,11,26,10,CAC,Sequia,,Aldeanueva de la Vera,True,1,0,1,0,40.12982776803074,-5.698645993214258
hoy,28/11/1971,1971,11,28,6,BAD,,,,False,0,0,0,0,,
extremadura,29/11/1971,1971,11,29,10,,,,,False,0,0,0,0,,
hoy,30/11/1971,1971,11,30,9,BAD,,,,False,0,0,0,0,,
hoy,03/12/1971,1971,12,3,1,BAD,,,,False,0,0,0,0,,
extremadura,03/12/1971,1971,12,3,4,,Lluvia,,Provincia de Cáceres,True,1,1,1,0,,
extremadura,03/12/1971,1971,12,3,11,,Frío,,Valencia de Alcántara,True,0,0,0,0,39.41026172958824,-7.244173555257091
extremadura,03/12/1971,1971,12,3,15,,,,,False,0,0,0,0,,
extremadura,04/12/1971,1971,12,4,24,,Frío,,Valencia de Alcántara,True,0,0,0,0,39.41026172958824,-7.244173555257091
hoy,08/12/1971,1971,12,8,10,MER,,,,False,0,0,0,0,,
extremadura,09/12/1971,1971,12,9,2,,,,,False,0,0,0,0,,
extremadura,14/12/1971,1971,12,14,13,,,,,False,0,0,0,0,,
extremadura,16/12/1971,1971,12,16,11,,Sequía,,Valencia de Alcántara,True,0,0,1,0,39.41026172958824,-7.244173555257091
hoy,19/12/1971,1971,12,19,12,CAC,Sequia,,Aldeanueva de la Vera,True,0,0,0,0,40.12982776803074,-5.698645993214258
hoy,22/12/1971,1971,12,22,13,CAC,Sequia,,Aldeanueva de la Vera,True,0,0,0,0,40.12982776803074,-5.698645993214258
hoy,26/12/1971,1971,12,26,12,CAC,Sequia,,Abertura,True,1,1,1,0,39.24309502816551,-5.813961621160367
hoy,29/12/1971,1971,12,29,16,CAC,,,,False,0,0,0,0,,
extremadura,31/12/1971,1971,12,31,13,,,,,False,0,0,0,0,,
hoy,02/01/1972,1972,1,2,10,CAC,,,,False,0,0,0,0,,
hoy,11/01/1972,1972,1,11,12,MER,Sequía,,Olivenza (Badajoz),True,1,0,0,0,38.68563980601908,-7.09913516161242
hoy,15/01/1972,1972,1,15,12,BAD,Sequía,,Oliva de la Frontera (Badajoz),True,1,1,1,0,38.27669744408432,-6.917596372554035
hoy,15/01/1972,1972,1,15,12,CAC,Sequía,,Brozas (Cáceres),True,0,0,0,0,39.61234132301401,-6.778565289568476
hoy,27/01/1972,1972,1,27,7,BAD,,,,False,0,0,0,0,,
hoy,29/01/1972,1972,1,29,10,MER,,,,False,0,0,0,0,,
hoy,02/04/1972,1972,4,2,23,BAD,Sequía,,Badajoz,True,0,0,0,0,38.871034753836994,-6.975421049278072
hoy,06/04/1972,1972,4,6,12,MER,,,,False,0,0,0,0,,
extremadura,13/04/1972,1972,4,13,14,,,,,False,0,0,0,0,,
extremadura,18/04/1972,1972,4,18,3,,,,,False,0,0,0,0,,
hoy,22/04/1972,1972,4,22,9,CAC,,,,False,0,0,0,0,,
hoy,22/04/1972,1972,4,22,12,MER,Sequía,,Llerena (Badajoz),True,0,0,0,0,38.237805569650085,-6.014891730861935
hoy,23/04/1972,1972,4,23,23,CAC,,,,False,0,0,0,0,,
extremadura,25/04/1972,1972,4,25,12,,Lluvia,,Valencia de Alcántara,True,0,0,0,0,39.41026172958824,-7.244173555257091
hoy,25/04/1972,1972,4,25,12,CAC,Sequía,,Aldeanueva de la Vera (Cáceres),True,1,0,0,0,40.12982776803074,-5.698645993214258
hoy,26/04/1972,1972,4,26,13,BAD,,,,False,0,0,0,0,,
extremadura,27/04/1972,1972,4,27,2,,Lluvia,,Cáceres,True,0,0,0,0,39.47753910519658,-6.377428325189714
hoy,28/04/1972,1972,4,28,9,CAC,Sequía,,Coria (Cáceres),True,0,0,0,0,39.98807734718899,-6.536615926256122
hoy,28/04/1972,1972,4,28,11,MER,,,,False,0,0,0,0,,
hoy,29/04/1972,1972,4,29,13,MER,Sequía,,Feria (Badajoz),True,1,0,0,0,38.51161313869938,-6.563395428437351
extremadura,03/05/1972,1972,5,3,10,,Lluvia,,Valencia de Alcántara,True,0,0,0,0,39.41026172958824,-7.244173555257091
hoy,03/05/1972,1972,5,3,13,BAD,Sequía,,Granja de Torrehermosa (Badajoz),True,0,0,0,0,38.309434946037456,-5.596554823533248
hoy,03/05/1972,1972,5,3,13,CAC,Sequía,,Oliva de la Frontera (Badajoz),True,0,0,0,0,38.27669744408432,-6.917596372554035
hoy,04/05/1972,1972,5,4,16,BAD,,,,False,0,0,0,0,,
hoy,11/05/1972,1972,5,11,1,MER,,,,False,0,0,0,0,,
hoy,13/05/1972,1972,5,13,27,CAC,Sequía,,Badajoz,True,1,1,0,0,38.871034753836994,-6.975421049278072
hoy,17/05/1972,1972,5,17,11,BAD,,,,False,0,0,0,0,,
extremadura,17/05/1972,1972,5,17,15,,,,,False,0,0,0,0,,
hoy,-,1972,5,21,11,CAC,Sequía,,Plasencia,True,0,1,0,0,40.03535535252543,-6.089134757182878
hoy,23/05/1972,1972,5,23,2,BAD,,,,False,0,0,0,0,,
extremadura,26/05/1972,1972,5,26,14,,,,,False,0,0,0,0,,
extremadura,30/05/1972,1972,5,30,11,,Calor,,Valencia de Alcántara,True,1,1,0,0,39.41026172958824,-7.244173555257091
extremadura,01/06/1972,1972,6,1,12,,Lluvia,,Valencia de Alcántara,True,0,0,1,0,39.41026172958824,-7.244173555257091
hoy,07/06/1972,1972,6,7,11,MER,Sequía,,Magacela (Badajoz),True,0,0,1,0,38.893604312697605,-5.729152572041908
hoy,22/06/1972,1972,6,22,4,BAD,,,,False,0,0,0,0,,
extremadura,30/06/1972,1972,6,30,2,,,,,False,0,0,0,0,,
hoy,08/07/1972,1972,7,8,8,CAC,,,,False,0,0,0,0,,
hoy,12/07/1972,1972,7,12,11,BAD,Sequía,,Valencia del Ventoso (Badajoz),True,1,0,0,0,38.26671461266538,-6.475385983672627
hoy,25/07/1972,1972,7,25,24,MER,,,,False,0,0,0,0,,
hoy,29/07/1972,1972,7,29,12,BAD,Sequía,,Zahinos (Badajoz),True,1,1,0,0,38.33155821023243,-6.953137496204532
hoy,13/08/1972,1972,8,13,8,CAC,Sequía,,Cáceres,True,0,0,0,0,39.47753910519658,-6.377428325189714
hoy,29/08/1972,1972,8,29,11,MER,,,,False,0,0,0,0,,
hoy,12/09/1972,1972,9,12,6,BAD,,,,False,0,0,0,0,,
hoy,13/09/1972,1972,9,13,10,CAC,Sequía,,Cuacos de Yuste (Cáceres),True,0,0,0,0,40.10488626028864,-5.724930542849765
extremadura,02/12/1972,1972,12,2,7,,Sequía,,Cáceres,True,0,0,0,0,39.47753910519658,-6.377428325189714
extremadura,27/12/1972,1972,12,27,13,,,,,False,0,0,0,0,,
extremadura,13/01/1973,1973,1,13,22,,Sequía,,Jerte,True,0,0,1,0,40.22244636594387,-5.750273271883254
extremadura,24/01/1973,1973,1,24,14,,,,,False,0,0,0,0,,
extremadura,05/03/1973,1973,3,5,7,,,,,False,0,0,0,0,,
hoy,07/03/1973,1973,3,7,10,CAC,sequía,,Talayuela,True,1,0,0,0,39.98684994553757,-5.608117188120495
extremadura,07/03/1973,1973,3,7,12,,Lluvia,,Plasencia,True,0,0,1,0,40.03535535252543,-6.089134757182878
hoy,07/03/1973,1973,3,7,13,BAD,,,,False,0,0,0,0,,
hoy,10/03/1973,1973,3,10,13,BAD,sequía,,Garbayuela,True,0,0,0,0,39.04995741860821,-4.998296056492295
extremadura,12/03/1973,1973,3,12,12,,,,,False,0,0,0,0,,
hoy,13/03/1973,1973,3,13,12,BAD,sequía,,Zahínos,True,0,0,0,0,38.33155821023243,-6.953137496204532
extremadura,14/03/1973,1973,3,14,12,,Lluvia,,Plasencia,True,0,1,1,0,40.03535535252543,-6.089134757182878
extremadura,15/03/1973,1973,3,15,9,,,,,False,0,0,0,0,,
hoy,17/03/1973,1973,3,17,4,BAD,,,,False,0,0,0,0,,
hoy,27/03/1973,1973,3,27,11,MER,,,,False,0,0,0,0,,
extremadura,31/03/1973,1973,3,31,7,,Lluvia,,Cáceres,True,0,0,0,0,39.47753910519658,-6.377428325189714
hoy,01/04/1973,1973,4,1,6,BAD,,,,False,0,0,0,0,,
hoy,01/04/1973,1973,4,1,7,BAD,,,,False,0,0,0,0,,
hoy,01/04/1973,1973,4,1,12,CAC,,,,False,0,0,0,0,,
extremadura,04/04/1973,1973,4,4,5,,,,,False,0,0,0,0,,
hoy,05/04/1973,1973,4,5,9,CAC,,,,False,0,0,0,0,,
hoy,08/04/1973,1973,4,8,10,CAC,sequía,,Cuacos de Yuste,True,0,0,0,0,40.10488626028864,-5.724930542849765
extremadura,12/04/1973,1973,4,12,11,,Frío,,Plasencia,True,1,1,0,0,40.03535535252543,-6.089134757182878
hoy,14/04/1973,1973,4,14,12,BAD,,,,False,0,0,0,0,,
hoy,15/04/1973,1973,4,15,13,MER,sequía,,Villanueva del Fresno,True,0,0,0,0,38.37492908303046,-7.167059124569499
hoy,17/04/1973,1973,4,17,12,BAD,sequía,,Higuera de Vargas,True,1,0,0,0,38.44433667601138,-6.973584904071192
hoy,19/04/1973,1973,4,19,10,CAC,Sequía,,Pasaron de la Vera,True,0,1,0,0,40.05142286565047,-5.820316765475152
hoy,24/04/1973,1973,4,24,8,MER,Sequía,,Badajoz,True,0,0,0,0,38.871034753836994,-6.975421049278072
extremadura,24/04/1973,1973,4,24,14,,,,,False,0,0,0,0,,
extremadura,25/04/1973,1973,4,25,13,,Calor,,Plasencia,True,1,1,0,0,40.03535535252543,-6.089134757182878
hoy,26/04/1973,1973,4,26,3,BAD,,,,False,0,0,0,0,,
hoy,26/04/1973,1973,4,26,11,BAD,Sequía,,Llera,True,0,0,0,0,38.44655595440374,-6.056448534467692
hoy,27/04/1973,1973,4,27,6,BAD,,,,False,0,0,0,0,,
hoy,27/04/1973,1973,4,27,12,CAC,Sequía,,Plasencia,True,0,0,0,0,40.03535535252543,-6.089134757182878
hoy,28/04/1973,1973,4,28,10,CAC,sequía,,Aldeanueva de la Vera,True,0,0,1,0,40.12982776803074,-5.698645993214258
hoy,29/04/1973,1973,4,29,14,BAD,,,,False,0,0,0,0,,
hoy,04/05/1973,1973,5,4,11,CAC,,,,False,0,0,0,0,,
hoy,04/05/1973,1973,5,4,14,BAD,,,,False,0,0,0,0,,
hoy,06/05/1973,1973,5,6,12,CAC,sequía,,Navacconcejo,True,0,0,0,0,,
hoy,08/05/1973,1973,5,8,12,BAD,sequía,,Zahínos,True,0,0,0,0,38.33155821023243,-6.953137496204532
hoy,08/05/1973,1973,5,8,12,MER,sequía,,Siruela,True,0,0,0,0,38.976616337220136,-5.0501954103768085
hoy,13/05/1973,1973,5,13,12,MER,,,,False,0,0,0,0,,
hoy,15/05/1973,1973,5,15,23,BAD,sequía,,Badajoz,True,1,1,0,0,38.871034753836994,-6.975421049278072
hoy,22/05/1973,1973,5,22,15,BAD,,,,False,0,0,0,0,,
hoy,24/05/1973,1973,5,24,12,CAC,tormentas,,Pasarón de la Vera,True,0,0,0,0,40.05142286565047,-5.820316765475152
hoy,30/05/1973,1973,5,30,23,CAC,,,,False,0,0,0,0,,
extremadura,04/06/1973,1973,6,4,11,,Lluvia,,Valencia de Alcántara,True,0,0,0,0,39.41026172958824,-7.244173555257091
extremadura,20/06/1973,1973,6,20,4,,,,,False,0,0,0,0,,
extremadura,03/07/1973,1973,7,3,13,,Sequía,,Zarza la Mayor,True,0,0,1,0,39.87691644793317,-6.861602854438933
extremadura,24/07/1973,1973,7,24,5,,,,,False,0,0,0,0,,
hoy,02/09/1973,1973,9,2,8,CAC,,,,False,0,0,0,0,,
hoy,26/09/1973,1973,9,26,12,BAD,sequía,,Navalvillar de Pela,True,1,1,0,0,39.08754641483976,-5.469727251045398
hoy,27/09/1973,1973,9,27,7,BAD,,,,False,0,0,0,0,,
hoy,28/09/1973,1973,9,28,9,BAD,sequía,,Olivenza,True,0,0,1,0,38.68563980601908,-7.09913516161242
hoy,02/10/1973,1973,10,2,13,CAC,sequía,,Zarza la Mayor,True,1,0,0,0,39.87691644793317,-6.861602854438933
hoy,03/10/1973,1973,10,3,2,BAD,,,,False,0,0,0,0,,
extremadura,09/10/1973,1973,10,8,6,,Sequía,,Plasencia,True,0,0,0,0,40.03535535252543,-6.089134757182878
extremadura,10/10/1973,1973,10,10,2,,,,,False,0,0,0,0,,
extremadura,10/10/1973,1973,10,10,3,,,,,False,0,0,0,0,,
hoy,10/10/1973,1973,10,10,13,CAC,sequía,,Aldea del la Guarda,True,0,0,0,0,,
hoy,12/10/1973,1973,10,12,12,CAC,sequía,,Malpartida de Cáceres,True,0,0,1,0,39.44606886667186,-6.505515540984494
hoy,16/10/1973,1973,10,16,18,BAD,,,,False,0,0,0,0,,
extremadura,17/10/1973,1973,10,17,9,,Lluvia,,Plasencia,True,1,0,0,0,40.03535535252543,-6.089134757182878
hoy,19/10/1973,1973,10,19,9,BAD,,,,False,0,0,0,0,,
hoy,19/10/1973,1973,10,19,10,CAC,sequía,,Cabezuela del Valle,True,0,0,0,0,40.19423940726183,-5.805892700156768
hoy,19/10/1973,1973,10,19,12,BAD,sequía,,Feria,True,0,0,0,0,38.51161313869938,-6.563395428437351
hoy,20/10/1973,1973,10,20,3,BAD,,,,False,0,0,0,0,,
hoy,21/10/1973,1973,10,21,10,CAC,sequía,,Trujillo,True,0,0,0,0,39.45888638575288,-5.876389783097755
hoy,21/10/1973,1973,10,21,12,BAD,sequía,,Villanueva del Fresno,True,0,0,0,0,38.37492908303046,-7.167059124569499
hoy,21/10/1973,1973,10,21,22,BAD,,,,False,0,0,0,0,,
hoy,24/10/1973,1973,10,24,5,BAD,,,,False,0,0,0,0,,
hoy,25/10/1973,1973,10,25,1,BAD,,,,False,0,0,0,0,,
extremadura,03/11/1973,1973,11,3,13,,,,,False,0,0,0,0,,
hoy,07/11/1973,1973,11,6,19,BAD,sequía,,Cáceres,True,0,0,0,0,39.47753910519658,-6.377428325189714
hoy,07/11/1973,1973,11,6,29,CAC,sequía,,Puebla del Maestre,True,1,0,0,0,38.08515605286468,-6.078494294072589
hoy,14/11/1973,1973,11,14,32,CAC,,,,False,0,0,0,0,,
extremadura,16/11/1973,1973,11,16,12,,Lluvia,,Valencia de Alcántara,True,0,0,0,0,39.41026172958824,-7.244173555257091
hoy,21/11/1973,1973,11,21,12,BAD,,,,False,0,0,0,0,,
extremadura,01/12/1973,1973,12,1,15,,,,,False,0,0,0,0,,
hoy,16/12/1973,1973,12,2,7,BAD,sequía,,Cuacos de Yuste,True,0,0,0,0,40.10488626028864,-5.724930542849765
hoy,16/12/1973,1973,12,2,7,BAD,Sequía,,Cabezuela del Valle,True,0,0,0,0,40.19423940726183,-5.805892700156768
hoy,02/12/1973,1973,12,2,26,CAC,sequía,,Feria,True,1,1,0,0,38.51161313869938,-6.563395428437351
extremadura,06/12/1973,1973,12,6,12,,Lluvia,,Valencia de Alcántara,True,0,0,0,0,39.41026172958824,-7.244173555257091
hoy,06/12/1973,1973,12,6,25,BAD,,,,False,0,0,0,0,,
hoy,08/12/1973,1973,12,8,14,BAD,,,,False,0,0,0,0,,
hoy,09/12/1973,1973,12,9,22,BAD,,,,False,0,0,0,0,,
extremadura,10/12/1973,1973,12,10,11,,,,,False,0,0,0,0,,
hoy,11/12/1973,1973,12,11,1,BAD,,,,False,0,0,0,0,,
extremadura,11/12/1973,1973,12,11,7,,Lluvia,,Cáceres,True,1,1,0,0,39.47753910519658,-6.377428325189714
hoy,12/12/1973,1973,12,12,11,CAC,sequía,,Cáceres,True,1,1,1,0,39.47753910519658,-6.377428325189714
hoy,12/12/1973,1973,12,12,21,CAC,sequía,,Zahínos,True,1,1,0,0,38.33155821023243,-6.953137496204532
hoy,12/12/1973,1973,12,12,21,CAC,sequía,,Oliva de la Frontera,True,0,1,1,0,38.27669744408432,-6.917596372554035
extremadura,14/12/1973,1973,12,14,7,,,,,False,0,0,0,0,,
extremadura,14/12/1973,1973,12,14,12,,,,,False,0,0,0,0,,
hoy,14/12/1973,1973,12,14,27,BAD,,,,False,0,0,0,0,,
hoy,16/12/1973,1973,12,16,35,BAD,,,,False,0,0,0,0,,
extremadura,17/12/1973,1973,12,17,14,,,,,False,0,0,0,0,,
extremadura,18/12/1973,1973,12,18,12,,Lluvia,,Valencia de Alcántara,True,0,0,0,0,39.41026172958824,-7.244173555257091
extremadura,19/12/1973,1973,12,19,8,,Lluvia,,Cáceres,True,0,0,0,0,39.47753910519658,-6.377428325189714
extremadura,19/12/1973,1973,12,19,9,,Lluvia,,Plasencia,True,1,1,0,0,40.03535535252543,-6.089134757182878
extremadura,20/12/1973,1973,12,20,11,,Crecida,,Plasencia,True,0,0,0,0,40.03535535252543,-6.089134757182878
extremadura,24/12/1973,1973,12,24,8,,,,,False,0,0,0,0,,
hoy,02/01/1974,1974,1,2,16,BAD,,,,False,0,0,0,0,,
hoy,06/01/1974,1974,1,6,24,BAD,sequía,,Badajoz,True,0,0,0,0,38.871034753836994,-6.975421049278072
hoy,08/01/1974,1974,1,8,1,BAD,,,,False,0,0,0,0,,
hoy,08/01/1974,1974,1,8,28,BAD,sequía,,Zahínos,True,0,0,0,0,38.33155821023243,-6.953137496204532
hoy,24/01/1974,1974,1,24,22,CAC,sequía,,Yelves,True,0,0,0,0,,
hoy,31/01/1974,1974,1,31,17,BAD,,,,False,0,0,0,0,,
hoy,10/03/1974,1974,3,9,22,CAC,sequía,,Trasierra,True,1,1,0,0,38.18995335967929,-5.994825385084807
hoy,16/03/1974,1974,3,16,12,BAD,,,,False,0,0,0,0,,
hoy,22/03/1974,1974,3,22,23,BAD,sequía,,Zahínos,True,0,0,0,0,38.33155821023243,-6.953137496204532
hoy,27/03/1974,1974,3,27,6,BAD,,,,False,0,0,0,0,,
hoy,06/04/1974,1974,4,6,22,CAC,nieve,,Jarandilla,True,0,0,0,0,40.13073101893005,-5.657896254753887
hoy,14/04/1974,1974,4,14,36,CAC,,,,False,0,0,0,0,,
extremadura,19/04/1974,1974,4,19,10,,Lluvia,,Cáceres,True,0,0,0,0,39.47753910519658,-6.377428325189714
extremadura,22/04/1974,1974,4,22,15,,,,,False,0,0,0,0,,
hoy,10/05/1974,1974,5,10,23,BAD,,,,False,0,0,0,0,,
hoy,19/05/1974,1974,5,19,39,BAD,tormenta,,Zalamea de la Serena,True,0,0,1,0,38.64988080204128,-5.65827426712498
hoy,21/05/1974,1974,5,21,32,CAC,,,,False,0,0,0,0,,
hoy,23/05/1974,1974,5,23,23,BAD,sequía,,Herrehuela,True,0,0,1,0,,
hoy,31/05/1974,1974,5,31,11,CAC,sequía,,Valdesalor,True,0,0,1,0,39.37760012946292,-6.348047165142578
hoy,31/05/1974,1974,5,31,16,BAD,,,,False,0,0,0,0,,
hoy,02/06/1974,1974,6,2,12,CAC,sequía,,Casar  de Cáceres,True,0,0,1,0,39.56110840080112,-6.4173219572025655
hoy,16/06/1974,1974,6,13,13,CAC,sequía,,Malpartida de Cáceres,True,0,0,1,0,39.44606886667186,-6.505515540984494
hoy,14/06/1974,1974,6,14,17,CAC,,,,False,0,0,0,0,,
hoy,15/06/1974,1974,6,15,20,BAD,sequía,,"Zafra, Almendralejo",True,0,0,1,0,38.55263773994259,-6.411909069108042
hoy,16/06/1974,1974,6,16,14,BAD,,,,False,0,0,0,0,,
hoy,21/06/1974,1974,6,21,13,BAD,sequía,,Badajoz,True,0,0,0,0,38.871034753836994,-6.975421049278072
hoy,22/06/1974,1974,6,22,40,BAD,,,,False,0,0,0,0,,
hoy,25/06/1974,1974,6,25,9,CAC,,,,False,0,0,0,0,,
hoy,03/07/1974,1974,7,3,20,CAC,,,,False,0,0,0,0,,
hoy,16/07/1974,1974,7,16,20,BAD,sequía,,Zafra,True,0,0,0,0,38.42187307146895,-6.416697978031944
hoy,04/08/1974,1974,8,4,26,BAD,,,,False,0,0,0,0,,
hoy,06/08/1974,1974,8,6,32,BAD,,,,False,0,0,0,0,,
extremadura,15/08/1974,1974,8,15,3,,,,,False,0,0,0,0,,
extremadura,15/08/1974,1974,8,15,4,,,,,False,0,0,0,0,,
hoy,24/08/1974,1974,8,24,22,CAC,sequía,,Zarza la Mayor,True,0,1,0,0,39.87691644793317,-6.861602854438933
hoy,27/08/1974,1974,8,27,23,BAD,sequía,,Zahínos,True,0,1,1,0,38.33155821023243,-6.953137496204532
extremadura,29/08/1974,1974,8,29,7,,Lluvia,,Cáceres,True,0,0,1,0,39.47753910519658,-6.377428325189714
extremadura,30/08/1974,1974,8,30,9,,Sequía,,Cáceres,True,0,0,1,0,39.47753910519658,-6.377428325189714
hoy,03/09/1974,1974,9,3,16,BAD,Sequía,,Cáceres,True,0,0,0,0,39.47753910519658,-6.377428325189714
hoy,04/09/1974,1974,9,4,13,CAC,sequía,,Cáceres,True,0,1,0,0,39.47753910519658,-6.377428325189714
hoy,04/09/1974,1974,9,4,23,CAC,sequía,,Fuente del Maestre,True,0,0,1,0,38.52549076226078,-6.447472383955171
hoy,07/09/1974,1974,9,7,38,CAC,,,,False,0,0,0,0,,
hoy,11/09/1974,1974,9,11,13,BAD,,,,False,0,0,0,0,,
extremadura,17/09/1974,1974,9,17,14,,,,,False,0,0,0,0,,
hoy,19/09/1974,1974,9,19,21,BAD,,,,False,0,0,0,0,,
extremadura,25/09/1974,1974,9,25,12,,Lluvia,,Valencia de Alcántara,True,0,0,1,0,39.41026172958824,-7.244173555257091
extremadura,26/09/1974,1974,9,26,8,,,,,False,0,0,0,0,,
extremadura,30/09/1974,1974,9,30,7,,Lluvia,,Miajadas,True,0,0,1,0,39.15079487053819,-5.909483992989726
extremadura,01/10/1974,1974,10,1,8,,,,,False,0,0,0,0,,
extremadura,01/10/1974,1974,10,1,12,,,,,False,0,0,0,0,,
hoy,02/10/1974,1974,10,2,6,BAD,,,,False,0,0,0,0,,
extremadura,02/10/1974,1974,10,2,12,,Lluvia,,Valencia de Alcántara,True,0,0,0,0,39.41026172958824,-7.244173555257091
extremadura,02/10/1974,1974,10,2,16,,,,,False,0,0,0,0,,
hoy,02/10/1974,1974,10,2,20,CAC,,,,False,0,0,0,0,,
extremadura,04/10/1974,1974,10,4,3,,,,,False,0,0,0,0,,
hoy,01/10/1974,1974,10,4,7,BAD,sequía,,Zahínos,True,0,0,1,0,38.33155821023243,-6.953137496204532
extremadura,04/10/1974,1974,10,4,15,,,,,False,0,0,0,0,,
hoy,04/10/1974,1974,10,4,23,CAC,sequía,,Cabezuela del Valle,True,1,1,0,0,40.19423940726183,-5.805892700156768
extremadura,05/10/1974,1974,10,5,7,,,,,False,0,0,0,0,,
extremadura,08/10/1974,1974,10,8,15,,Lluvia,,Valencia de Alcántara,True,0,0,0,0,39.41026172958824,-7.244173555257091
hoy,08/10/1974,1974,10,8,27,BAD,,,,False,0,0,0,0,,
hoy,08/10/1974,1974,10,8,33,CAC,sequía,,Ahillones,True,0,1,0,0,38.25937195488645,-5.86511304551475
hoy,09/10/1974,1974,10,9,1,BAD,,,,False,0,0,0,0,,
hoy,11/10/1974,1974,10,11,15,BAD,sequía,,Oliva de Mérida,True,1,1,1,0,38.791280514360125,-6.122715911874886
hoy,13/10/1974,1974,10,13,3,BAD,,,,False,0,0,0,0,,
hoy,13/10/1974,1974,10,13,38,CAC,sequía,,Tejeda del Tiétar,True,1,1,0,0,,
extremadura,14/10/1974,1974,10,14,9,,Sequía,,Plasencia,True,0,0,0,0,40.03535535252543,-6.089134757182878
extremadura,16/10/1974,1974,10,16,10,,Sequía,,Cáceres,True,0,0,1,0,39.47753910519658,-6.377428325189714
extremadura,17/10/1974,1974,10,17,7,,Lluvia,,Cáceres,True,1,1,1,0,39.47753910519658,-6.377428325189714
hoy,17/10/1974,1974,10,17,21,CAC,,,,False,0,0,0,0,,
hoy,18/10/1974,1974,10,18,9,BAD,,,,False,0,0,0,0,,
extremadura,19/10/1974,1974,10,19,6,,,,,False,0,0,0,0,,
extremadura,22/10/1974,1974,10,22,9,,Lluvia,,Cáceres,True,1,1,0,0,39.47753910519658,-6.377428325189714
extremadura,22/10/1974,1974,10,22,12,,Sequía,,Zarza la Mayor,True,0,1,0,0,39.87691644793317,-6.861602854438933
hoy,22/10/1974,1974,10,22,32,CAC,sequía,,Cuacos de Yuste,True,0,0,1,0,40.10488626028864,-5.724930542849765
extremadura,23/10/1974,1974,10,23,9,,,,,False,0,0,0,0,,
extremadura,23/10/1974,1974,10,23,12,,Lluvia,,Valencia de Alcántara,True,1,1,0,0,39.41026172958824,-7.244173555257091
extremadura,24/10/1974,1974,10,24,4,,,,,False,0,0,0,0,,
hoy,25/10/1974,1974,10,25,12,BAD,,,,False,0,0,0,0,,
extremadura,26/10/1974,1974,10,26,2,,Sequía,,Cáceres,True,0,1,0,0,39.47753910519658,-6.377428325189714
hoy,26/10/1974,1974,10,26,23,BAD,sequía,,Casas de Reina,True,1,0,0,0,38.20238842795281,-5.970547599713604
hoy,27/10/1974,1974,10,27,39,CAC,nieves,,Aldeanueva de la Vera,True,0,0,0,0,40.12982776803074,-5.698645993214258
hoy,30/10/1974,1974,10,30,16,CAC,,,,False,0,0,0,0,,
hoy,31/10/1974,1974,10,31,22,CAC,sequía,,Zarza la Mayor,True,1,1,0,0,39.87691644793317,-6.861602854438933
hoy,01/11/1974,1974,11,1,20,CAC,sequía,,Perales del Puerto,True,1,0,0,0,40.156104892526685,-6.68133967372863
extremadura,02/11/1974,1974,11,2,16,,,,,False,0,0,0,0,,
hoy,02/11/1974,1974,11,2,26,BAD,,,,False,0,0,0,0,,
hoy,03/11/1974,1974,11,3,38,BAD,,,,False,0,0,0,0,,
extremadura,04/11/1974,1974,11,4,9,,Sequía,,Valcorchero (Plasencia),True,1,1,0,0,40.03535535252543,-6.089134757182878
extremadura,05/11/1974,1974,11,5,12,,Lluvia,,Valencia de Alcántara,True,0,1,0,0,39.41026172958824,-7.244173555257091
hoy,05/11/1974,1974,11,5,33,CAC,sequía,,Torrejón el rubio,True,0,0,1,0,39.770824622311125,-6.012335249034648
hoy,07/11/1974,1974,11,7,23,BAD,sequía,,Siruela,True,1,1,0,0,38.976616337220136,-5.0501954103768085
extremadura,08/11/1974,1974,11,8,4,,,,,False,0,0,0,0,,
extremadura,08/11/1974,1974,11,8,15,,,,,False,0,0,0,0,,
hoy,09/11/1974,1974,11,9,11,CAC,sequía,,Cáceres,True,0,1,0,0,39.47753910519658,-6.377428325189714
hoy,09/11/1974,1974,11,9,17,CAC,,,,False,0,0,0,0,,
hoy,10/11/1974,1974,11,10,27,CAC,sequía,,Talayauela,True,1,1,0,0,,
extremadura,12/11/1974,1974,11,12,3,,,,,False,0,0,0,0,,
hoy,12/11/1974,1974,11,12,23,BAD,,,,False,0,0,0,0,,
hoy,12/11/1974,1974,11,12,32,BAD,,,,False,0,0,0,0,,
extremadura,13/11/1974,1974,11,13,12,,Lluvia,,Valencia de Alcántara,True,1,1,0,0,39.41026172958824,-7.244173555257091
hoy,13/11/1974,1974,11,13,22,CAC,sequía,,Serradilla,True,0,0,0,0,39.82891014852736,-6.139142666346821
hoy,14/11/1974,1974,11,14,22,BAD,sequía,,Zarza la Mayor,True,1,1,0,0,39.87691644793317,-6.861602854438933
extremadura,15/11/1974,1974,11,15,1,,Sequía,,Provincia de Cáceres,True,0,0,1,0,,
extremadura,15/11/1974,1974,11,15,9,,Sequía,,Provincia de Cáceres,True,1,1,1,0,,
extremadura,15/11/1974,1974,11,15,10,,Sequía,,Cáceres,True,0,0,0,0,39.47753910519658,-6.377428325189714
extremadura,15/11/1974,1974,11,15,10,,Sequía,,Cáceres,True,0,0,0,0,39.47753910519658,-6.377428325189714
hoy,15/11/1974,1974,11,15,20,BAD,sequía,,Zafra,True,0,1,0,0,38.42187307146895,-6.416697978031944
hoy,15/11/1974,1974,11,15,22,BAD,,,,False,0,0,0,0,,
hoy,16/11/1974,1974,11,16,13,CAC,sequía,,Cáceres,True,0,0,0,0,39.47753910519658,-6.377428325189714
hoy,17/11/1974,1974,11,17,54,BAD,sequía,,Tejada de Tiétar,True,0,0,1,0,,
extremadura,19/11/1974,1974,11,19,2,,,,,False,0,0,0,0,,
extremadura,19/11/1974,1974,11,19,12,,Sequía,,Casar de Cáceres,True,0,0,1,0,39.56110840080112,-6.4173219572025655
extremadura,22/11/1974,1974,11,22,1,,,,,False,0,0,0,0,,
extremadura,25/11/1974,1974,11,25,3,,,,,False,0,0,0,0,,
extremadura,25/11/1974,1974,11,25,9,,,,,False,0,0,0,0,,
hoy,28/11/1974,1974,11,28,2,BAD,,,,False,0,0,0,0,,
hoy,28/11/1974,1974,11,28,6,BAD,,,,False,0,0,0,0,,
extremadura,28/11/1974,1974,11,28,12,,Nieve,,Valle del Jerte,True,0,0,0,0,,
hoy,28/11/1974,1974,11,28,29,BAD,,,,False,0,0,0,0,,
extremadura,29/11/1974,1974,11,29,12,,Lluvia,,Brozas,True,0,1,0,0,39.61234132301401,-6.778565289568476
extremadura,29/11/1974,1974,11,29,15,,,,,False,0,0,0,0,,
hoy,29/11/1974,1974,11,29,15,BAD,,,,False,0,0,0,0,,
extremadura,30/11/1974,1974,11,30,6,,,,,False,0,0,0,0,,
hoy,01/12/1974,1974,12,1,21,BAD,sequía,,Cáceres,True,0,1,0,0,39.47753910519658,-6.377428325189714
hoy,01/12/1974,1974,12,1,39,CAC,sequía,,Villalva de los Barros,True,0,1,0,0,,
hoy,04/12/1974,1974,12,4,11,CAC,,,,False,0,0,0,0,,
hoy,05/12/1974,1974,12,5,4,BAD,,,,False,0,0,0,0,,
extremadura,07/12/1974,1974,12,7,7,,,,,False,0,0,0,0,,
hoy,07/12/1974,1974,12,7,20,BAD,,,,False,0,0,0,0,,
hoy,10/12/1974,1974,12,10,33,BAD,sequía,,Siruela,True,1,1,0,0,38.976616337220136,-5.0501954103768085
hoy,11/12/1974,1974,12,11,11,BAD,,,,False,0,0,0,0,,
hoy,12/12/1974,1974,12,12,9,BAD,,,,False,0,0,0,0,,
hoy,14/12/1974,1974,12,14,29,BAD,,,,False,0,0,0,0,,
extremadura,17/12/1974,1974,12,17,3,,,,,False,0,0,0,0,,
hoy,18/12/1974,1974,12,18,8,BAD,,,,False,0,0,0,0,,
hoy,18/12/1974,1974,12,18,22,BAD,,,,False,0,0,0,0,,
hoy,18/12/1974,1974,12,18,23,CAC,sequía,,Navalmoral de la Mata,True,0,0,0,0,39.890258676725125,-5.537981032967856
hoy,19/12/1974,1974,12,19,22,CAC,sequía,,Zahínos,True,1,1,0,0,38.33155821023243,-6.953137496204532
extremadura,20/12/1974,1974,12,20,16,,Sequía,,Cáceres y Badajoz,True,0,0,0,0,39.17428692951678,-6.676424687233894
extremadura,21/12/1974,1974,12,21,6,,Sequía,,Cáceres,True,1,1,0,0,39.47753910519658,-6.377428325189714
hoy,21/12/1974,1974,12,21,22,BAD,sequía,,Aldeanueva de la Vera,True,0,0,0,0,40.12982776803074,-5.698645993214258
hoy,22/12/1974,1974,12,22,25,BAD,,,,False,0,0,0,0,,
extremadura,24/12/1974,1974,12,24,12,,Frío,,Valle del Jerte,True,0,0,0,0,,
hoy,24/12/1974,1974,12,24,33,BAD,sequía,,Oliva de Mérida,True,1,1,0,0,38.791280514360125,-6.122715911874886
extremadura,26/12/1974,1974,12,26,11,,Lluvia,,Valencia de Alcántara,True,0,0,0,0,39.41026172958824,-7.244173555257091
hoy,26/12/1974,1974,12,26,15,CAC,,,,False,0,0,0,0,,
hoy,26/12/1974,1974,12,26,22,CAC,sequía,,Jarandilla,True,0,1,0,0,40.13073101893005,-5.657896254753887
hoy,26/12/1974,1974,12,26,23,CAC,sequía,,Oliva de la Frontera,True,1,1,0,0,38.27669744408432,-6.917596372554035
extremadura,27/12/1974,1974,12,27,15,,,,,False,0,0,0,0,,
hoy,27/12/1974,1974,12,27,22,CAC,sequía,,Jarandilla,True,0,0,0,0,40.13073101893005,-5.657896254753887
hoy,28/12/1974,1974,12,28,22,BAD,sequía,,Zarza la Mayor,True,0,0,0,0,39.87691644793317,-6.861602854438933
extremadura,31/12/1974,1974,12,31,5,,,,,False,0,0,0,0,,
hoy,31/12/1974,1974,12,31,12,CAC,,,,False,0,0,0,0,,
hoy,31/12/1974,1974,12,31,13,CAC,sequía,,Cáceres,True,0,0,1,0,39.47753910519658,-6.377428325189714
hoy,31/12/1974,1974,12,31,29,BAD,,,,False,0,0,0,0,,
hoy,02/01/1975,1975,1,2,14,CAC,,,,False,0,0,0,0,,
extremadura,03/01/1975,1975,1,3,7,,Sequía,,Provincia de Cáceres,True,0,1,0,0,,
hoy,03/01/1975,1975,1,3,8,CAC,Sequía,,Badajoz,True,0,1,0,0,38.871034753836994,-6.975421049278072
hoy,05/01/1975,1975,1,5,19,CAC,Sequía,,Cáceres,True,0,0,1,0,39.47753910519658,-6.377428325189714
extremadura,07/01/1975,1975,1,7,8,,,,,False,0,0,0,0,,
extremadura,07/01/1975,1975,1,7,12,,Lluvia,,Valencia de Alcántara,True,1,1,0,0,39.41026172958824,-7.244173555257091
hoy,07/01/1975,1975,1,7,19,BAD,,,,False,0,0,0,0,,
hoy,07/01/1975,1975,1,7,28,MER,,,,False,0,0,0,0,,
hoy,09/01/1975,1975,1,9,11,CAC,,,,False,0,0,0,0,,
hoy,10/01/1975,1975,1,10,1,CAC,Sequía,,Extremadura,True,1,1,0,0,,
hoy,10/01/1975,1975,1,10,3,BAD,,,,False,0,0,0,0,,
hoy,10/01/1975,1975,1,10,5,BAD,Sequía,,Extremadura,True,1,0,0,0,,
extremadura,10/01/1975,1975,1,10,6,,Lluvia,,Cáceres,True,0,0,1,0,39.47753910519658,-6.377428325189714
hoy,10/01/1975,1975,1,10,6,BAD,,,,False,0,0,0,0,,
extremadura,10/01/1975,1975,1,10,13,,Lluvia,,Cuacos de Yuste,True,1,1,0,0,40.10488626028864,-5.724930542849765
hoy,10/01/1975,1975,1,10,17,MER,Sequía,,Don Benito y Villanueva (Badajoz),True,0,0,1,0,38.95620783267387,-5.859801918815306
extremadura,11/01/1975,1975,1,11,4,,,,,False,0,0,0,0,,
hoy,11/01/1975,1975,1,11,9,MER,Sequía,,Almendralejo (Badajoz),True,0,0,1,0,38.68340240841623,-6.407120160184139
hoy,11/01/1975,1975,1,11,11,BAD,Sequía,,Badajoz,True,0,0,1,0,38.871034753836994,-6.975421049278072
hoy,11/01/1975,1975,1,11,11,MER,Sequía,,Mérida (Badajoz),True,0,0,0,0,38.91549201670453,-6.341926065709169
hoy,11/01/1975,1975,1,11,14,CAC,Sequía,,Brozas (Cáceres),True,0,0,1,0,39.61234132301401,-6.778565289568476
extremadura,14/01/1975,1975,1,14,3,,,,,False,0,0,0,0,,
extremadura,14/01/1975,1975,1,14,4,,,,,False,0,0,0,0,,
extremadura,14/01/1975,1975,1,14,11,,Sequía,,Cáceres,True,1,1,0,0,39.47753910519658,-6.377428325189714
extremadura,16/01/1975,1975,1,16,12,,Sequía,,Extremadura,True,0,1,0,0,,
hoy,17/01/1975,1975,1,17,14,CAC,Sequía,,Plasencia,True,0,0,0,0,40.03535535252543,-6.089134757182878
hoy,17/01/1975,1975,1,17,17,CAC,Sequía,,Trujillo (Cáceres),True,0,0,0,0,39.45888638575288,-5.876389783097755
hoy,18/01/1975,1975,1,18,11,CAC,,,,False,0,0,0,0,,
hoy,18/01/1975,1975,1,18,13,BAD,,,,False,0,0,0,0,,
hoy,18/01/1975,1975,1,18,16,CAC,Sequía,,Talayuela (Cáceres),True,0,0,0,0,39.98684994553757,-5.608117188120495
extremadura,20/01/1975,1975,1,20,1,,,,,False,0,0,0,0,,
extremadura,20/01/1975,1975,1,20,15,,,,,False,0,0,0,0,,
extremadura,21/01/1975,1975,1,21,12,,Lluvia,,Arroyo de la Luz,True,0,0,1,0,39.48424151476158,-6.583900547775354
hoy,22/01/1975,1975,1,22,4,BAD,,,,False,0,0,0,0,,
hoy,22/01/1975,1975,1,22,16,BAD,,,,False,0,0,0,0,,
extremadura,24/01/1975,1975,1,24,10,,,,,False,0,0,0,0,,
hoy,25/01/1975,1975,1,25,13,SUP,,,,False,0,0,0,0,,
hoy,26/01/1975,1975,1,26,2,BAD,,,,False,0,0,0,0,,
extremadura,27/01/1975,1975,1,27,8,,,,,False,0,0,0,0,,
extremadura,29/01/1975,1975,1,29,3,,Sequía,,Extremadura,True,1,1,0,0,,
hoy,01/02/1975,1975,2,1,17,CAC,,,,False,0,0,0,0,,
hoy,05/02/1975,1975,2,5,12,BAD,Sequía,,Oliva de la Frontera (Badajoz),True,0,1,0,0,38.27669744408432,-6.917596372554035
hoy,06/02/1975,1975,2,6,15,CAC,Sequía,,La Morera (Badajoz),True,1,1,0,0,38.54643107080325,-6.653812568292555
extremadura,07/02/1975,1975,2,7,12,,Lluvia,,Comarca de Sierra de San Pedro,True,0,0,0,0,,
hoy,09/02/1975,1975,2,9,24,CAC,Sequía,,Extremadura,True,1,1,0,0,,
extremadura,11/02/1975,1975,2,11,5,,Lluvia,,Cáceres,True,0,0,0,0,39.47753910519658,-6.377428325189714
hoy,12/02/1975,1975,2,12,12,MER,,,,False,0,0,0,0,,
hoy,16/02/1975,1975,2,16,16,BAD,Sequía,,Cáceres,True,0,0,1,0,39.47753910519658,-6.377428325189714
extremadura,17/02/1975,1975,2,17,7,,,,,False,0,0,0,0,,
hoy,20/02/1975,1975,2,20,17,BAD,,,,False,0,0,0,0,,
hoy,21/02/1975,1975,2,21,23,BAD,,,,False,0,0,0,0,,
extremadura,24/02/1975,1975,2,24,4,,,,,False,0,0,0,0,,
extremadura,13/03/1975,1975,3,13,2,,,,,False,0,0,0,0,,
extremadura,13/03/1975,1975,3,14,16,,Lluvia,,Arroyo de la Luz,True,0,0,0,0,39.48424151476158,-6.583900547775354
hoy,21/03/1975,1975,3,21,10,CAC,Sequía,,Casar (Cáceres),True,0,0,1,0,40.292703591875565,-6.253524617864775
hoy,30/03/1975,1975,3,30,5,BAD,,,,False,0,0,0,0,,
extremadura,05/04/1975,1975,4,5,1,,,,,False,0,0,0,0,,
extremadura,26/04/1975,1975,4,26,4,,Lluvia,,Cáceres,True,0,0,0,0,39.47753910519658,-6.377428325189714
hoy,01/05/1975,1975,5,1,14,CAC,Sequía,,Serradilla (Cáceres),True,0,0,0,0,39.82891014852736,-6.139142666346821
hoy,02/05/1975,1975,5,2,17,CAC,,,,False,0,0,0,0,,
hoy,06/05/1975,1975,5,6,1,CAC,,,,False,0,0,0,0,,
hoy,10/05/1975,1975,5,10,12,BAD,Sequía,,Badajoz,True,1,0,0,0,38.871034753836994,-6.975421049278072
extremadura,16/05/1975,1975,5,16,11,,,,,False,0,0,0,0,,
extremadura,21/05/1975,1975,5,21,9,,Lluvia,,Ahigal,True,0,1,0,0,40.1890939939129,-6.187514761591455
extremadura,02/07/1975,1975,7,2,12,,Lluvia,,Comarca Sierra de San Pedro,True,0,0,1,0,,
extremadura,28/07/1975,1975,7,28,7,,,,,False,0,0,0,0,,
hoy,03/08/1975,1975,8,3,22,CAC,Sequía,,Zarza la Mayor (Cáceres),True,0,1,0,0,39.87691644793317,-6.861602854438933
hoy,07/08/1975,1975,8,7,16,MER,,,,False,0,0,0,0,,
extremadura,14/08/1975,1975,8,14,11,,Sequía,,Cuacos de Yuste,True,0,0,0,0,40.10488626028864,-5.724930542849765
hoy,16/08/1975,1975,8,16,24,BAD,,,,False,0,0,0,0,,
hoy,22/08/1975,1975,8,22,16,CAC,Sequía,,Aceituna (Cáceres),True,0,1,0,0,40.14912573989373,-6.331909317410821
hoy,27/08/1975,1975,8,27,15,CAC,Sequía,,Cáceres,True,0,0,1,0,39.47753910519658,-6.377428325189714
extremadura,28/08/1975,1975,8,28,13,,,,,False,0,0,0,0,,
hoy,29/08/1975,1975,8,29,15,CAC,,,,False,0,0,0,0,,
extremadura,03/09/1975,1975,9,3,11,,Lluvia,,Comarca de Sierra de San Pedro,True,0,0,0,0,,
extremadura,03/09/1975,1975,9,3,14,,,,,False,0,0,0,0,,
hoy,04/09/1975,1975,9,4,10,BAD,,,,False,0,0,0,0,,
extremadura,05/09/1975,1975,9,5,12,,Sequía,,Valle del Jerte,True,0,0,1,0,,
extremadura,08/09/1975,1975,9,8,5,,,,,False,0,0,0,0,,
extremadura,12/09/1975,1975,9,12,2,,,,,False,0,0,0,0,,
extremadura,12/09/1975,1975,9,12,11,,Lluvia,,Valle del Jerte,True,0,0,1,0,,
hoy,26/09/1975,1975,9,26,11,MER,Sequía,,Trasierra (Badajoz),True,1,1,0,0,38.18995335967929,-5.994825385084807
extremadura,27/09/1975,1975,9,27,5,,Sequía,,Cáceres,True,0,0,0,0,39.47753910519658,-6.377428325189714
extremadura,30/09/1975,1975,9,30,15,,,,,False,0,0,0,0,,
extremadura,03/10/1975,1975,10,3,8,,,,,False,0,0,0,0,,
extremadura,06/11/1975,1975,10,6,9,,Lluvia,,Zarza la Mayor,True,0,0,0,0,39.87691644793317,-6.861602854438933
extremadura,07/10/1975,1975,10,7,1,,,,,False,0,0,0,0,,
hoy,12/10/1975,1975,10,12,40,MER,,,,False,0,0,0,0,,
hoy,15/10/1975,1975,10,15,16,BAD,Sequía,,Badajoz,True,1,1,0,0,38.871034753836994,-6.975421049278072
hoy,16/10/1975,1975,10,16,16,CAC,Sequía,,Zarza la Mayor (Cáceres),True,0,1,0,0,39.87691644793317,-6.861602854438933
extremadura,17/11/1975,1975,10,17,7,,Lluvia,,Villasbuenas de Gata,True,0,0,1,0,40.178444499030775,-6.625942790470481
hoy,19/10/1975,1975,10,19,18,MER,,,,False,0,0,0,0,,
hoy,22/10/1975,1975,10,22,16,BAD,,,,False,0,0,0,0,,
hoy,24/10/1975,1975,10,24,17,BAD,Sequía,,Oliva de la Frontera (Badajoz),True,1,1,1,0,38.27669744408432,-6.917596372554035
hoy,28/10/1975,1975,10,28,24,BAD,,,,False,0,0,0,0,,
hoy,31/10/1975,1975,10,31,11,BAD,Sequía,,Badajoz,True,0,0,0,0,38.871034753836994,-6.975421049278072
extremadura,03/11/1975,1975,11,3,19,,,,,False,0,0,0,0,,
hoy,06/11/1975,1975,11,6,15,MER,,,,False,0,0,0,0,,
extremadura,08/11/1975,1975,11,8,1,,,,,False,0,0,0,0,,
hoy,09/11/1975,1975,11,9,28,MER,Sequia,,Región Extremeña,True,1,1,0,0,,
extremadura,11/11/1975,1975,11,11,11,,Sequía,,Zarza la Mayor,True,1,1,0,0,39.87691644793317,-6.861602854438933
extremadura,11/11/1975,1975,11,11,11,,Sequía,,Valle del Jerte,True,0,0,1,0,,
extremadura,12/11/1975,1975,11,12,4,,Sequía,,Coria,True,1,1,0,0,39.98807734718899,-6.536615926256122
extremadura,12/11/1975,1975,11,12,7,,,,,False,0,0,0,0,,
hoy,12/11/1975,1975,11,12,15,BAD,,,,False,0,0,0,0,,
hoy,13/11/1975,1975,11,13,10,MER,Sequia,,Fuente del Maestre (Badajoz),True,0,1,0,0,38.52549076226078,-6.447472383955171
hoy,16/11/1975,1975,11,16,1,BAD,,,,False,0,0,0,0,,
hoy,27/11/1975,1975,11,27,8,MER,Sequia,,Torremegia (Badajoz),True,1,0,1,0,38.871034753836994,-6.975421049278072
extremadura,04/12/1975,1975,12,4,16,,,,,False,0,0,0,0,,
hoy,06/12/1975,1975,12,6,18,BAD,,,,False,0,0,0,0,,
extremadura,09/12/1975,1975,12,9,12,,Frío,,Valencia de Alcántara,True,0,1,1,0,39.41026172958824,-7.244173555257091
hoy,09/12/1975,1975,12,9,22,CAC,Sequia,,Almoharín (Cáceres),True,1,1,1,0,39.17587117477212,-6.045433563363996
extremadura,10/12/1975,1975,12,10,7,,Sequía,,Cáceres,True,0,0,0,0,39.47753910519658,-6.377428325189714
extremadura,12/12/1975,1975,12,12,12,,Frío,,Almoharín,True,1,1,1,0,39.17587117477212,-6.045433563363996
extremadura,16/12/1975,1975,12,16,9,,,,,False,0,0,0,0,,
hoy,26/12/1975,1975,12,26,10,MER,Sequia,,Badajoz,True,1,0,0,0,38.871034753836994,-6.975421049278072
extremadura,27/12/1975,1975,12,27,1,,,,,False,0,0,0,0,,
hoy,28/12/1975,1975,12,28,13,CAC,,,,False,0,0,0,0,,
extremadura,02/01/1976,1976,1,2,12,,Sequía,,Oliva de Plasencia,True,0,0,0,0,40.11248527768235,-6.08605325169394
extremadura,09/01/1976,1976,1,9,12,,Lluvia,,Valle del Jerte,True,0,0,1,0,,
hoy,09/01/1976,1976,1,9,17,BAD,,,,False,0,0,0,0,,
hoy,10/01/1976,1976,1,10,24,MER,,,,False,0,0,0,0,,
hoy,11/01/1976,1976,1,11,9,BAD,sequía,,Badajoz,True,1,0,0,0,38.871034753836994,-6.975421049278072
hoy,16/01/1976,1976,1,16,5,BAD,,,,False,0,0,0,0,,
hoy,16/01/1976,1976,1,16,9,CAC,sequía,,Cáceres,True,0,0,0,0,39.47753910519658,-6.377428325189714
hoy,16/01/1976,1976,1,16,24,MER,,,,False,0,0,0,0,,
hoy,17/01/1976,1976,1,17,18,BAD,,,,False,0,0,0,0,,
hoy,18/01/1976,1976,1,18,18,CAC,sequía,,Cuacos de Yuste,True,0,0,1,0,40.10488626028864,-5.724930542849765
hoy,20/01/1976,1976,1,20,11,BAD,,,,False,0,0,0,0,,
extremadura,22/01/1976,1976,1,22,12,,Nieve,,Valle del Jerte,True,0,0,0,0,,
hoy,23/01/1976,1976,1,23,20,BAD,,,,False,0,0,0,0,,
extremadura,24/01/1976,1976,1,24,12,,,,,False,0,0,0,0,,
hoy,27/01/1976,1976,1,27,10,CAC,nieves,,Pasarón de la Vera,True,1,0,0,0,40.05142286565047,-5.820316765475152
hoy,27/01/1976,1976,1,27,14,MER,,,,False,0,0,0,0,,
hoy,27/01/1976,1976,1,27,22,MER,sequía,,Casas de Reina,True,1,0,0,0,38.20238842795281,-5.970547599713604
hoy,27/01/1976,1976,1,27,23,CAC,sequía,,Plasencia,True,0,1,1,0,40.03535535252543,-6.089134757182878
extremadura,30/01/1976,1976,1,30,2,,,,,False,0,0,0,0,,
hoy,31/01/1976,1976,1,31,12,BAD,sequía,,Badajoz,True,0,0,0,0,38.871034753836994,-6.975421049278072
extremadura,31/01/1976,1976,1,31,16,,,,,False,0,0,0,0,,
hoy,31/01/1976,1976,1,31,21,BAD,sequía,,Cáceres,True,0,0,0,0,39.47753910519658,-6.377428325189714
hoy,01/02/1976,1976,2,1,9,MER,,,,False,0,0,0,0,,
hoy,03/02/1976,1976,2,3,10,CAC,sequía,,Zarza la Mayor,True,0,1,0,0,39.87691644793317,-6.861602854438933
extremadura,04/02/1976,1976,2,4,8,,,,,False,0,0,0,0,,
extremadura,04/02/1976,1976,2,4,14,,,,,False,0,0,0,0,,
extremadura,05/02/1976,1976,2,5,12,,Lluvia,,Valencia de Alcántara,True,0,0,0,0,39.41026172958824,-7.244173555257091
extremadura,10/02/1976,1976,2,10,4,,Lluvia,,Tajo,True,0,0,1,0,,
extremadura,04/03/1976,1976,3,4,8,,Lluvia,,Valencia de Alcántara,True,0,0,0,0,39.41026172958824,-7.244173555257091
hoy,11/03/1976,1976,3,11,2,BAD,,,,False,0,0,0,0,,
hoy,11/03/1976,1976,3,11,16,CAC,sequía,,Galisteo,True,0,0,0,0,39.97575177299878,-6.267141193453358
hoy,14/03/1976,1976,3,14,13,CAC,,,,False,0,0,0,0,,
hoy,16/03/1976,1976,3,16,19,BAD,,,,False,0,0,0,0,,
extremadura,19/03/1976,1976,3,19,6,,,,,False,0,0,0,0,,
hoy,23/03/1976,1976,3,23,22,CAC,nieve,,Cabezuela del Valle,True,0,0,0,0,40.19423940726183,-5.805892700156768
hoy,25/03/1976,1976,3,25,11,CAC,sequía,,Plasencia,True,0,1,1,0,40.03535535252543,-6.089134757182878
extremadura,01/04/1976,1976,4,1,3,,,,,False,0,0,0,0,,
extremadura,01/04/1976,1976,4,1,7,,,,,False,0,0,0,0,,
extremadura,02/04/1976,1976,4,2,7,,Sequía,,Cáceres,True,1,1,0,0,39.47753910519658,-6.377428325189714
hoy,02/04/1976,1976,4,2,17,CAC,sequía,,Almoharín,True,1,1,0,0,39.17587117477212,-6.045433563363996
hoy,03/04/1976,1976,4,3,12,BAD,sequía,,Aldea de Guarda,True,1,1,1,0,,
extremadura,06/04/1976,1976,4,6,12,,Lluvia,,Valencia de Alcántara,True,0,0,0,0,39.41026172958824,-7.244173555257091
extremadura,06/04/1976,1976,4,6,13,,Lluvia,,Plasencia,True,0,0,0,0,40.03535535252543,-6.089134757182878
extremadura,08/04/1976,1976,4,8,11,,Lluvia,,Zarza la Mayor,True,0,0,0,0,39.87691644793317,-6.861602854438933
extremadura,09/04/1976,1976,4,9,1,,,,,False,0,0,0,0,,
extremadura,10/04/1976,1976,4,10,10,,,,,False,0,0,0,0,,
extremadura,19/04/1976,1976,4,19,6,,Lluvia,,Valencia de Alcántara,True,0,0,1,0,39.41026172958824,-7.244173555257091
hoy,22/04/1976,1976,4,22,15,MER,,,,False,0,0,0,0,,
extremadura,24/04/1976,1976,4,24,14,,,,,False,0,0,0,0,,
hoy,27/04/1976,1976,4,27,3,BAD,,,,False,0,0,0,0,,
hoy,01/05/1976,1976,5,1,8,MER,sequía,,Jerez de los Caballeros,True,0,0,1,0,38.32157904136018,-6.77125396533409
extremadura,03/05/1976,1976,5,3,10,,Sequía,,Valencia de Alcántara,True,0,0,0,0,39.41026172958824,-7.244173555257091
hoy,07/05/1976,1976,5,7,1,MER,,,,False,0,0,0,0,,
hoy,12/05/1976,1976,5,12,8,MER,,,,False,0,0,0,0,,
hoy,14/05/1976,1976,5,14,8,BAD,tormenta,,Almoharín,True,0,0,0,0,39.17587117477212,-6.045433563363996
hoy,18/05/1976,1976,5,18,1,CAC,,,,False,0,0,0,0,,
extremadura,19/05/1976,1976,5,19,9,,,,,False,0,0,0,0,,
hoy,22/05/1976,1976,5,22,29,CAC,sequía,,Alagón del Caudillo,True,0,0,1,0,,
extremadura,03/06/1976,1976,6,3,12,,Lluvia,,Valencia de Alcántara,True,0,0,0,0,39.41026172958824,-7.244173555257091
extremadura,09/06/1976,1976,6,9,1,,,,,False,0,0,0,0,,
extremadura,09/06/1976,1976,6,9,24,,,,,False,0,0,0,0,,
extremadura,10/06/1976,1976,6,10,12,,Sequía,,Cáceres,True,0,0,0,0,39.47753910519658,-6.377428325189714
hoy,11/06/1976,1976,6,11,6,CAC,sequía,,La Zarza,True,1,1,1,0,38.81787170807203,-6.2162198805710505
hoy,15/06/1976,1976,6,15,4,CAC,sequía,,Cáceres,True,0,0,1,0,39.47753910519658,-6.377428325189714
extremadura,15/06/1976,1976,6,15,14,,Calor,,Valdesalor,True,0,0,0,0,39.37760012946292,-6.348047165142578
hoy,16/06/1976,1976,6,16,3,BAD,,,,False,0,0,0,0,,
hoy,17/06/1976,1976,6,17,2,CAC,sequía,,Cáceres,True,1,1,1,0,39.47753910519658,-6.377428325189714
hoy,17/06/1976,1976,6,17,7,BAD,,,,False,0,0,0,0,,
hoy,17/06/1976,1976,6,17,29,BAD,,,,False,0,0,0,0,,
hoy,20/06/1976,1976,6,20,21,MER,sequía,,Plasencia,True,0,0,0,0,40.03535535252543,-6.089134757182878
hoy,22/06/1976,1976,6,22,29,CAC,sequía,,Villamiel,True,1,0,1,0,40.1868302937278,-6.783983075982345
hoy,22/06/1976,1976,6,22,29,CAC,sequía,,Arroyomolinos de Montánchez,True,0,0,1,0,42.40636832549133,0.2242622093900548
extremadura,24/06/1976,1976,6,24,7,,,,,False,0,0,0,0,,
hoy,24/06/1976,1976,6,24,28,CAC,tormenta,,Brozas,True,0,0,0,0,39.61234132301401,-6.778565289568476
hoy,25/06/1976,1976,6,25,12,BAD,,,,False,0,0,0,0,,
hoy,25/06/1976,1976,6,25,17,BAD,,,,False,0,0,0,0,,
hoy,25/06/1976,1976,6,25,19,BAD,,,,False,0,0,0,0,,
hoy,27/06/1976,1976,6,27,5,CAC,,,,False,0,0,0,0,,
hoy,29/06/1976,1976,6,29,11,CAC,sequía,,Zarza la Mayor,True,0,1,1,0,39.87691644793317,-6.861602854438933
hoy,29/06/1976,1976,6,29,45,CAC,,,,False,0,0,0,0,,
hoy,03/07/1976,1976,7,3,20,CAC,Sequía,,Almoharín,True,0,0,1,0,39.17587117477212,-6.045433563363996
hoy,08/07/1976,1976,7,8,3,BAD,sequía,,Cáceres,True,0,0,1,0,39.47753910519658,-6.377428325189714
extremadura,08/07/1976,1976,7,8,5,,,,,False,0,0,0,0,,
hoy,11/07/1976,1976,7,11,5,CAC,,,,False,0,0,0,0,,
hoy,21/07/1976,1976,7,21,4,CAC,sequía,,Borbollón,True,1,0,0,0,,
hoy,21/07/1976,1976,7,21,6,MER,,,,False,0,0,0,0,,
hoy,22/07/1976,1976,7,22,3,CAC,sequía,,Cáceres,True,0,0,0,0,39.47753910519658,-6.377428325189714
extremadura,22/07/1976,1976,7,22,9,,Lluvia,,Baños de Montemayor,True,0,0,0,0,40.31650707514345,-5.858075328553747
hoy,22/07/1976,1976,7,22,15,BAD,,,,False,0,0,0,0,,
hoy,24/07/1976,1976,7,24,3,CAC,sequía,,Valdesalor,True,1,0,1,0,39.37760012946292,-6.348047165142578
hoy,25/07/1976,1976,7,25,8,CAC,,,,False,0,0,0,0,,
hoy,31/07/1976,1976,7,31,24,BAD,,,,False,0,0,0,0,,
extremadura,05/08/1976,1976,8,5,12,,Lluvia,,Valencia de Alcántara,True,0,0,0,0,39.41026172958824,-7.244173555257091
extremadura,06/08/1976,1976,8,6,12,,,,,False,0,0,0,0,,
extremadura,07/08/1976,1976,8,7,12,,,,,False,0,0,0,0,,
hoy,07/08/1976,1976,8,7,18,BAD,sequía,,Santibáñez el Alto,True,0,0,1,0,40.18613811227976,-6.548201032339973
extremadura,10/08/1976,1976,8,10,15,,Calor,,Valdesalor,True,0,0,1,0,39.37760012946292,-6.348047165142578
extremadura,11/08/1976,1976,8,11,5,,Sequía,,Cáceres,True,0,0,0,0,39.47753910519658,-6.377428325189714
extremadura,17/08/1976,1976,8,17,1,,,,,False,0,0,0,0,,
hoy,19/08/1976,1976,8,19,5,BAD,,,,False,0,0,0,0,,
extremadura,19/08/1976,1976,8,19,12,,Sequía,,Valencia de Alcántara,True,0,0,0,0,39.41026172958824,-7.244173555257091
hoy,21/08/1976,1976,8,21,7,BAD,sequía,,Olivenza,True,0,0,1,0,38.68563980601908,-7.09913516161242
hoy,24/08/1976,1976,8,24,6,BAD,,,,False,0,0,0,0,,
extremadura,28/08/1976,1976,8,28,2,,,,,False,0,0,0,0,,
hoy,01/09/1976,1976,9,1,31,CAC,,,,False,0,0,0,0,,
extremadura,02/09/1976,1976,9,2,5,,,,,False,0,0,0,0,,
extremadura,04/09/1976,1976,9,4,5,,Sequía,,Cáceres,True,0,0,0,0,39.47753910519658,-6.377428325189714
extremadura,05/09/1976,1976,9,5,10,,Frío,,Valencia de Alcántara,True,0,0,1,0,39.41026172958824,-7.244173555257091
extremadura,05/09/1976,1976,9,5,11,,,,,False,0,0,0,0,,
hoy,07/09/1976,1976,9,7,1,CAC,,,,False,0,0,0,0,,
extremadura,09/09/1976,1976,9,9,5,,Sequía,,Cáceres,True,0,0,0,0,39.47753910519658,-6.377428325189714
extremadura,11/09/1976,1976,9,11,10,,,,,False,0,0,0,0,,
extremadura,11/09/1976,1976,9,11,12,,,,,False,0,0,0,0,,
extremadura,14/09/1976,1976,9,14,14,,"Lluvia, Sequía, Tormenta",,Valle del Jerte,True,0,0,1,0,,
extremadura,12/09/1976,1976,9,17,12,,"Lluvia, Sequía",,Zorita,True,0,1,0,0,39.28622947144959,-5.70079973521735
hoy,18/09/1976,1976,9,18,24,MER,,,,False,0,0,0,0,,
hoy,19/09/1976,1976,9,19,29,CAC,sequía,,Torreorgaz,True,0,0,1,0,39.381461168466046,-6.249646410877315
hoy,23/09/1976,1976,9,23,2,CAC,sequía,,Fresnedoso de Ibor,True,0,0,1,0,39.68419119509457,-5.509090159490762
extremadura,24/09/1976,1976,9,24,16,,,,,False,0,0,0,0,,
extremadura,12/09/1976,1976,9,25,11,,Sequía,,Valencia de Alcántara,True,0,0,0,0,39.41026172958824,-7.244173555257091
extremadura,26/09/1976,1976,9,26,6,,"Lluvia, Sequía, Tormenta",,Cáceres,True,0,0,0,0,39.47753910519658,-6.377428325189714
extremadura,26/09/1976,1976,9,26,14,,,,,False,0,0,0,0,,
hoy,28/09/1976,1976,9,28,7,CAC,sequía,,Cáceres,True,0,0,1,0,39.47753910519658,-6.377428325189714
extremadura,28/09/1976,1976,9,28,11,,"Lluvia, Sequía",,Valencia de Alcántara,True,0,0,0,0,39.41026172958824,-7.244173555257091
extremadura,28/09/1976,1976,9,28,15,,,,,False,0,0,0,0,,
extremadura,30/09/1976,1976,9,30,10,,,,,False,0,0,0,0,,
hoy,05/10/1976,1976,10,21,1,CAC,sequía,,Losar de la Vera,True,0,0,0,0,40.12088363636735,-5.6047449113092735
hoy,26/10/1976,1976,10,26,6,MER,nieve,,Hervás,True,0,0,0,0,40.2729367154098,-5.858512295669394
hoy,26/10/1976,1976,10,26,10,CAC,,,,False,0,0,0,0,,
hoy,27/10/1976,1976,10,27,19,BAD,,,,False,0,0,0,0,,
extremadura,07/10/1978,1978,10,7,13,,Sequía,,Plasencia,True,0,0,0,0,40.03535535252543,-6.089134757182878
hoy,12/10/1978,1978,10,12,10,CAC,Sequia,,Tejeda del Tietar,True,0,0,0,0,,
extremadura,19/10/1978,1978,10,19,6,,,,,False,0,0,0,0,,
hoy,26/10/1978,1978,10,26,10,CAC,,,,False,0,0,0,0,,
extremadura,13/11/1978,1978,11,13,12,,Sequía,,Hoyos,True,1,0,0,0,40.171594462665546,-6.720281317529753
extremadura,16/11/1978,1978,11,16,2,,,,,False,0,0,0,0,,
hoy,02/05/1979,1979,5,2,9,BAD,,,,False,0,0,0,0,,
hoy,08/05/1979,1979,5,8,15,CAC,sequía,,Guijo de Galisteo,True,0,0,0,0,40.09338956984464,-6.410767951752613
hoy,07/06/1979,1979,6,7,8,BAD,,,,False,0,0,0,0,,
hoy,01/07/1979,1979,6,16,18,CAC,tormentas,,Oliva de la Frontera,True,0,0,0,0,38.27669744408432,-6.917596372554035
hoy,16/08/1979,1979,8,16,16,CAC,sequía,,Cáceres,True,0,0,0,0,39.47753910519658,-6.377428325189714
hoy,28/08/1979,1979,8,28,16,MER,,,,False,0,0,0,0,,
hoy,01/09/1979,1979,9,1,11,CAC,tormenta,,Plasencia,True,0,0,1,0,40.03535535252543,-6.089134757182878
extremadura,11/09/1979,1979,9,11,13,,Calor,,Plasencia,True,0,0,0,0,40.03535535252543,-6.089134757182878
extremadura,12/09/1979,1979,9,12,12,,,,,False,0,0,0,0,,
extremadura,12/09/1979,1979,9,12,14,,Lluvia,,Valencia de Alcántara,True,0,0,0,0,39.41026172958824,-7.244173555257091
hoy,16/09/1979,1979,9,16,12,MER,,,,False,0,0,0,0,,
hoy,16/09/1979,1979,9,16,29,BAD,,,,False,0,0,0,0,,
extremadura,19/09/1979,1979,9,19,3,,,,,False,0,0,0,0,,
extremadura,21/09/1979,1979,9,21,4,,,,,False,0,0,0,0,,
hoy,25/09/1979,1979,9,25,15,CAC,tormenta,,Zarza la Mayor,True,0,0,0,0,39.87691644793317,-6.861602854438933
hoy,25/09/1979,1979,9,25,15,CAC,TORMENTAS,,Tejeda de Tiétar,True,0,0,0,0,40.01872010649644,-5.867830927788148
extremadura,26/09/1979,1979,9,26,14,,Sequía,,Jarandilla,True,0,0,0,0,40.13073101893005,-5.657896254753887
hoy,28/09/1979,1979,9,28,30,MER,,,,False,0,0,0,0,,
hoy,10/10/1979,1979,10,10,10,CAC,sequía,,Tejeda de Tiétar,True,0,0,0,0,40.01872010649644,-5.867830927788148
extremadura,13/10/1979,1979,10,13,9,,,,,False,0,0,0,0,,
extremadura,16/10/1979,1979,10,16,12,,Lluvia,,Valencia de Alcántara,True,0,0,0,0,39.41026172958824,-7.244173555257091
hoy,23/10/1979,1979,10,23,3,BAD,,,,False,0,0,0,0,,
extremadura,14/03/1980,1980,3,14,2,,,,,False,0,0,0,0,,
extremadura,20/03/1980,1980,3,20,13,,Lluvia,,Plasencia,True,0,0,0,0,40.03535535252543,-6.089134757182878
extremadura,15/05/1980,1980,5,15,13,,Inund,,Provincia de Cáceres,True,0,0,0,0,,
extremadura,20/05/1980,1980,5,20,15,,,,,False,0,0,0,0,,
extremadura,04/07/1980,1980,7,4,6,,,,,False,0,0,0,0,,
extremadura,04/07/1980,1980,7,4,12,,Lluvia,,Valencia de Alcántara,True,0,0,0,0,39.41026172958824,-7.244173555257091
hoy,24/07/1980,1980,7,24,40,MER,Sequia,,Castuera,True,0,0,1,0,38.72435378925819,-5.545060273541743
hoy,26/07/1980,1980,7,26,14,MER,,,,False,0,0,0,0,,
hoy,06/08/1980,1980,8,6,11,BAD,Sequia,,Alconera,True,0,0,1,0,38.39828054960424,-6.475030879998629
hoy,21/08/1980,1980,8,21,16,MER,Sequia,,Santa Marta,True,0,0,1,0,38.61413697887768,-6.628145382540433
hoy,29/08/1980,1980,8,29,24,BAD,,,,False,0,0,0,0,,
hoy,30/08/1980,1980,8,30,20,BAD,,,,False,0,0,0,0,,
extremadura,04/09/1980,1980,9,4,4,,,,,False,0,0,0,0,,
hoy,04/09/1980,1980,9,4,18,BAD,,,,False,0,0,0,0,,
hoy,04/09/1980,1980,9,4,24,MER,,,,False,0,0,0,0,,
hoy,10/09/1980,1980,9,10,9,BAD,,,,False,0,0,0,0,,
hoy,10/09/1980,1980,9,10,14,MER,Sequia,,Castuera,True,0,0,0,0,38.72435378925819,-5.545060273541743
hoy,14/09/1980,1980,9,14,10,CAC,Sequia,,Zarza la Mayor,True,0,1,0,0,39.87691644793317,-6.861602854438933
extremadura,15/09/1980,1980,9,15,15,,Calor,,Plasencia,True,0,1,1,0,40.03535535252543,-6.089134757182878
hoy,16/09/1980,1980,9,16,1,BAD,,,,False,0,0,0,0,,
hoy,17/09/1980,1980,9,17,10,CAC,Sequia,,Casar de Cáceres,True,0,0,0,0,39.56110840080112,-6.4173219572025655
extremadura,23/09/1980,1980,9,23,14,,,,,False,0,0,0,0,,
extremadura,25/09/1980,1980,9,25,13,,Calor,,Plasencia,True,0,1,1,0,40.03535535252543,-6.089134757182878
hoy,26/09/1980,1980,9,26,10,CAC,Sequía,,Zarza la Mayor,True,1,1,1,0,39.87691644793317,-6.861602854438933
hoy,26/09/1980,1980,9,26,10,CAC,Sequía,,Almendralejo,True,1,0,0,0,38.68340240841623,-6.407120160184139
hoy,27/09/1980,1980,9,27,17,CAC,,,,False,0,0,0,0,,
extremadura,01/10/1980,1980,10,1,15,,,,,False,0,0,0,0,,
hoy,03/10/1980,1980,10,3,3,BAD,,,,False,0,0,0,0,,
extremadura,04/10/1980,1980,10,4,5,,Sequía,,Extremadura,True,0,0,1,0,,
extremadura,06/10/1980,1980,10,6,15,,Calor,,Plasencia,True,0,1,1,0,40.03535535252543,-6.089134757182878
extremadura,06/10/1980,1980,10,6,15,,Sequía,,Plasencia,True,0,0,1,0,40.03535535252543,-6.089134757182878
hoy,07/10/1980,1980,10,7,1,MER,Sequía,,Badajoz,True,0,0,1,0,38.871034753836994,-6.975421049278072
hoy,12/10/1980,1980,10,7,1,MER,Sequía,,Zarza la Mayor,True,1,1,1,0,39.87691644793317,-6.861602854438933
extremadura,09/10/1980,1980,10,9,8,,,,,False,0,0,0,0,,
extremadura,09/10/1980,1980,10,9,13,,Calor,,Plasencia,True,0,0,0,0,40.03535535252543,-6.089134757182878
extremadura,10/10/1980,1980,10,10,1,,,,,False,0,0,0,0,,
extremadura,10/10/1980,1980,10,10,4,,,,,False,0,0,0,0,,
extremadura,10/10/1980,1980,10,10,9,,,,,False,0,0,0,0,,
extremadura,13/10/1980,1980,10,13,11,,Frío,,Plasencia,True,0,0,0,0,40.03535535252543,-6.089134757182878
extremadura,16/10/1980,1980,10,16,14,,Sequía,,Zarza la Mayor,True,1,0,0,0,39.87691644793317,-6.861602854438933
hoy,19/10/1980,1980,10,19,12,CAC,,,,False,0,0,0,0,,
extremadura,21/10/1980,1980,10,21,1,,,,,False,0,0,0,0,,
hoy,30/10/1980,1980,10,30,2,BAD,,,,False,0,0,0,0,,
hoy,30/10/1980,1980,10,30,11,MER,Sequía,,Mérida,True,0,0,1,0,38.91549201670453,-6.341926065709169
hoy,01/11/1980,1980,11,1,1,BAD,,,,False,0,0,0,0,,
extremadura,04/11/1980,1980,11,4,14,,Lluvia,,Valencia de Alcántara,True,0,0,0,0,39.41026172958824,-7.244173555257091
extremadura,20/11/1980,1980,11,20,10,,,,,False,0,0,0,0,,
hoy,27/11/1980,1980,11,27,22,CAC,Sequía,,Casar de Cáceres,True,0,1,0,0,39.56110840080112,-6.4173219572025655
hoy,06/12/1980,1980,12,6,15,MER,,,,False,0,0,0,0,,
hoy,07/12/1980,1980,12,7,23,BAD,Sequia,,Extremadura,True,0,0,1,0,,
hoy,11/12/1980,1980,12,11,10,CAC,Sequia,,Zarza la Mayor,True,0,1,1,0,39.87691644793317,-6.861602854438933
hoy,11/12/1980,1980,12,11,16,BAD,Sequía,,Badajoz,True,1,1,1,0,38.871034753836994,-6.975421049278072
hoy,12/12/1980,1980,12,12,10,CAC,Sequía,,Tejeda de Tiétar,True,0,1,0,0,40.01872010649644,-5.867830927788148
hoy,14/12/1980,1980,12,14,28,BAD,,,,False,0,0,0,0,,
hoy,17/12/1980,1980,12,17,3,SUP,,,,False,0,0,0,0,,
hoy,17/12/1980,1980,12,17,16,CAC,Sequía,,Cáceres,True,0,0,0,0,39.47753910519658,-6.377428325189714
extremadura,20/12/1980,1980,12,20,5,,Lluvia,,Cáceres,True,0,1,1,0,39.47753910519658,-6.377428325189714
hoy,20/12/1980,1980,12,20,19,CAC,Sequía,,Aldeanueva de la Vera,True,1,0,0,0,40.12982776803074,-5.698645993214258
extremadura,27/12/1980,1980,12,27,2,,,,,False,0,0,0,0,,
hoy,27/12/1980,1980,12,27,18,BAD,,,,False,0,0,0,0,,
hoy,30/12/1980,1980,12,30,12,CAC,,,,False,0,0,0,0,,
hoy,30/12/1980,1980,12,30,31,BAD,,,,False,0,0,0,0,,
hoy,02/01/1981,1981,1,2,14,MER,,,,False,0,0,0,0,,
hoy,07/01/1981,1981,1,7,13,CAC,,,,False,0,0,0,0,,
hoy,07/01/1981,1981,1,7,15,CAC,sequía,,Cáceres,True,0,1,0,0,39.47753910519658,-6.377428325189714
hoy,07/01/1981,1981,1,7,16,MER,,,,False,0,0,0,0,,
hoy,08/01/1981,1981,1,8,10,CAC,sequía,,Zarza de la Mayor,True,1,1,0,0,,
hoy,08/01/1981,1981,1,8,16,CAC,,,,False,0,0,0,0,,
extremadura,09/01/1981,1981,1,9,2,,,,,False,0,0,0,0,,
hoy,09/01/1981,1981,1,9,10,CAC,,,,False,0,0,0,0,,
hoy,09/01/1981,1981,1,9,13,MER,sequía,,Badajoz,True,1,0,0,0,38.871034753836994,-6.975421049278072
extremadura,10/01/1981,1981,1,10,3,,,,,False,0,0,0,0,,
extremadura,12/01/1981,1981,1,12,5,,Lluvia,,Provincia de Cáceres,True,0,0,0,0,,
extremadura,12/01/1981,1981,1,12,7,,,,,False,0,0,0,0,,
extremadura,13/01/1981,1981,1,13,8,,,,,False,0,0,0,0,,
hoy,13/01/1981,1981,1,13,18,BAD,,,,False,0,0,0,0,,
extremadura,14/01/1981,1981,1,14,6,,Sequía,,Cáceres,True,0,0,0,0,39.47753910519658,-6.377428325189714
hoy,14/01/1981,1981,1,14,10,CAC,nieve,,Navalmoral de la Mata,True,0,1,0,0,39.890258676725125,-5.537981032967856
hoy,14/01/1981,1981,1,14,14,CAC,nieve,,Cáceres,True,0,0,0,0,39.47753910519658,-6.377428325189714
extremadura,15/01/1981,1981,1,15,5,,Lluvia,,Provincia de Cáceres,True,1,1,1,0,,
extremadura,15/01/1981,1981,1,15,5,,Sequía,,Provincia de Cáceres,True,1,1,1,0,,
hoy,15/01/1981,1981,1,15,19,BAD,,,,False,0,0,0,0,,
hoy,16/01/1981,1981,1,16,10,CAC,nieve,,Zurbarán,True,0,0,0,0,39.06593109893432,-5.724014006515745
hoy,16/01/1981,1981,1,16,10,CAC,sequía,,Arroyo de la Luz,True,0,0,0,0,39.48424151476158,-6.583900547775354
extremadura,17/01/1981,1981,1,17,8,,,,,False,0,0,0,0,,
extremadura,17/01/1981,1981,1,17,14,,,,,False,0,0,0,0,,
hoy,18/01/1981,1981,1,18,2,BAD,,,,False,0,0,0,0,,
hoy,18/01/1981,1981,1,18,17,CAC,,,,False,0,0,0,0,,
extremadura,20/01/1981,1981,1,20,5,,Sequía,,Cáceres,True,0,1,0,0,39.47753910519658,-6.377428325189714
extremadura,20/01/1981,1981,1,20,8,,Sequía,,Cáceres,True,1,1,0,0,39.47753910519658,-6.377428325189714
extremadura,21/01/1981,1981,1,21,9,,Sequía,,Cáceres,True,0,1,0,0,39.47753910519658,-6.377428325189714
hoy,22/01/1981,1981,1,22,10,CAC,nieve,,Aldeanueva de la Vera,True,0,0,0,0,40.12982776803074,-5.698645993214258
hoy,24/01/1981,1981,1,24,10,CAC,,,,False,0,0,0,0,,
hoy,24/01/1981,1981,1,24,15,MER,,,,False,0,0,0,0,,
extremadura,27/01/1981,1981,1,27,14,,,,,False,0,0,0,0,,
extremadura,28/01/1981,1981,1,28,7,,,,,False,0,0,0,0,,
extremadura,28/01/1981,1981,1,28,12,,,,,False,0,0,0,0,,
extremadura,29/01/1981,1981,1,29,12,,Sequía,,La Moheda,True,1,1,1,0,38.3648010252961,-2.44446031475343
extremadura,29/01/1981,1981,1,29,12,,Sequía,,Malpartid de Cáceres,True,0,0,0,0,,
hoy,29/01/1981,1981,1,29,14,MER,,,,False,0,0,0,0,,
hoy,29/01/1981,1981,1,29,20,BAD,,,,False,0,0,0,0,,
hoy,30/01/1981,1981,1,30,16,BAD,sequía,,Badajoz,True,0,0,1,0,38.871034753836994,-6.975421049278072
hoy,30/01/1981,1981,1,30,16,CAC,sequía,,Trujillo,True,1,1,0,0,39.45888638575288,-5.876389783097755
hoy,30/01/1981,1981,1,30,40,BAD,sequía,,Villafranca de los Barros,True,0,0,1,0,38.55953602827336,-6.3328763558379855
hoy,30/01/1981,1981,1,30,40,BAD,Sequía,,Fregenal de la Sierra,True,1,1,0,0,38.1687749610116,-6.653923848007927
extremadura,31/01/1981,1981,1,31,6,,,,,False,0,0,0,0,,
extremadura,31/01/1981,1981,1,31,16,,Sequía,,Cáceres,True,1,1,0,0,39.47753910519658,-6.377428325189714
hoy,31/01/1981,1981,1,31,21,MER,Sequía,,Usagre,True,0,0,0,0,38.35570711729818,-6.167410772373192
extremadura,03/02/1981,1981,2,3,5,,,,,False,0,0,0,0,,
extremadura,03/02/1981,1981,2,3,6,,Lluvia,,Cáceres,True,0,0,1,0,39.47753910519658,-6.377428325189714
extremadura,03/02/1981,1981,2,3,7,,,,,False,0,0,0,0,,
extremadura,03/02/1981,1981,2,3,8,,Sequía,,Extremadura,True,1,1,0,0,,
hoy,03/02/1981,1981,2,3,10,CAC,sequía,,Moraleja,True,0,0,1,0,40.06612783062084,-6.658742890625814
extremadura,03/02/1981,1981,2,3,16,,,,,False,0,0,0,0,,
hoy,03/02/1981,1981,2,3,34,BAD,sequía,,Fuente de Cantos,True,0,0,1,0,38.2469353111271,-6.306434374005093
extremadura,04/02/1981,1981,2,4,11,,,,,False,0,0,0,0,,
extremadura,04/02/1981,1981,2,4,14,,Lluvia,,Valencia de Alcántara,True,0,0,0,0,39.41026172958824,-7.244173555257091
hoy,04/02/1981,1981,2,4,18,BAD,,,,False,0,0,0,0,,
extremadura,05/02/1981,1981,2,5,5,,Lluvia,,Cáceres,True,1,1,0,0,39.47753910519658,-6.377428325189714
hoy,05/02/1981,1981,2,5,10,MER,,,,False,0,0,0,0,,
extremadura,05/02/1981,1981,2,5,14,,Calor,,Valle del Jerte,True,0,0,0,0,,
extremadura,05/02/1981,1981,2,5,14,,Lluvia,,Serradilla,True,0,0,0,0,39.82891014852736,-6.139142666346821
extremadura,06/02/1981,1981,2,6,1,,,,,False,0,0,0,0,,
hoy,07/02/1981,1981,2,7,1,SUP,sequía,,Villar del Rey,True,1,0,1,0,39.13190573672749,-6.848718228190527
extremadura,07/02/1981,1981,2,7,6,,,,,False,0,0,0,0,,
extremadura,07/02/1981,1981,2,7,7,,Sequía,,Cáceres,True,0,0,0,0,39.47753910519658,-6.377428325189714
extremadura,09/02/1981,1981,2,9,7,,Sequía,,Badajoz,True,0,0,1,0,38.871034753836994,-6.975421049278072
extremadura,09/02/1981,1981,2,9,9,,Sequía,,Plasencia,True,0,0,0,0,40.03535535252543,-6.089134757182878
extremadura,10/02/1981,1981,2,10,9,,Sequía,,Extremadura,True,1,1,1,0,,
extremadura,10/02/1981,1981,2,10,12,,Sequía,,Valle del Jerte,True,0,0,0,0,,
extremadura,10/02/1981,1981,2,10,16,,Lluvia,,Provincia de Badajoz,True,0,0,1,0,,
hoy,11/02/1981,1981,2,11,11,CAC,sequía,,Cáceres,True,0,0,0,0,39.47753910519658,-6.377428325189714
hoy,14/02/1981,1981,2,14,1,SUP,sequía,,Badajoz,True,1,1,1,0,38.871034753836994,-6.975421049278072
extremadura,14/02/1981,1981,2,14,6,,,,,False,0,0,0,0,,
hoy,14/02/1981,1981,2,14,12,MER,,,,False,0,0,0,0,,
hoy,14/02/1981,1981,2,14,13,BAD,sequía,,Badajoz,True,0,0,1,0,38.871034753836994,-6.975421049278072
extremadura,16/02/1981,1981,2,16,1,,,,,False,0,0,0,0,,
hoy,17/02/1981,1981,2,17,16,BAD,,,,False,0,0,0,0,,
extremadura,19/02/1981,1981,2,19,10,,,,,False,0,0,0,0,,
extremadura,20/02/1981,1981,2,20,3,,,,,False,0,0,0,0,,
extremadura,21/02/1981,1981,2,21,5,,,,,False,0,0,0,0,,
extremadura,21/02/1981,1981,2,21,12,,Sequía,,Ahigal,True,0,0,0,0,40.1890939939129,-6.187514761591455
extremadura,21/02/1981,1981,2,21,13,,,,,False,0,0,0,0,,
extremadura,21/02/1981,1981,2,21,16,,,,,False,0,0,0,0,,
hoy,22/02/1981,1981,2,22,13,CAC,Sequía,,Cáceres,True,0,0,1,0,39.47753910519658,-6.377428325189714
hoy,25/02/1981,1981,2,25,6,BAD,,,,False,0,0,0,0,,
extremadura,26/02/1981,1981,2,26,5,,Lluvia,,Cáceres,True,1,1,0,0,39.47753910519658,-6.377428325189714
hoy,27/02/1981,1981,2,27,16,BAD,,,,False,0,0,0,0,,
extremadura,28/02/1981,1981,2,28,5,,,,,False,0,0,0,0,,
hoy,28/02/1981,1981,2,28,5,SUP,,,,False,0,0,0,0,,
hoy,01/03/1981,1981,3,1,18,CAC,sequía,,Trujillo,True,0,0,0,0,39.45888638575288,-5.876389783097755
extremadura,02/03/1981,1981,3,2,7,,,,,False,0,0,0,0,,
hoy,03/03/1981,1981,3,3,1,BAD,sequía,,Badajoz,True,0,0,1,0,38.871034753836994,-6.975421049278072
extremadura,03/03/1981,1981,3,3,8,,,,,False,0,0,0,0,,
extremadura,03/03/1981,1981,3,3,12,,Lluvia,,Valencia de Alcántara,True,0,0,0,0,39.41026172958824,-7.244173555257091
extremadura,03/03/1981,1981,3,3,12,,Sequía,,La Vera,True,1,1,1,0,28.39538652504952,-16.555140535456733
extremadura,04/03/1981,1981,3,4,14,,Lluvia,,Valencia de Alcántara,True,0,0,0,0,39.41026172958824,-7.244173555257091
extremadura,04/03/1981,1981,3,4,14,,Sequía,,Valle del Jerte,True,1,0,1,0,,
hoy,04/03/1981,1981,3,4,24,MER,,,,False,0,0,0,0,,
hoy,05/03/1981,1981,3,5,1,BAD,,,,False,0,0,0,0,,
hoy,06/03/1981,1981,3,6,9,CAC,,,,False,0,0,0,0,,
extremadura,09/03/1981,1981,3,9,13,,,,,False,0,0,0,0,,
extremadura,10/03/1981,1981,3,10,13,,,,,False,0,0,0,0,,
hoy,10/03/1981,1981,3,10,36,BAD,,,,False,0,0,0,0,,
extremadura,11/03/1981,1981,3,11,12,,,,,False,0,0,0,0,,
hoy,11/03/1981,1981,3,11,14,CAC,sequía,,Salvaleón,True,0,0,0,0,38.51078296140683,-6.787613905396846
extremadura,12/03/1981,1981,3,12,13,,Sequía,,Plasencia,True,0,0,0,0,40.03535535252543,-6.089134757182878
hoy,15/03/1981,1981,3,15,15,CAC,,,,False,0,0,0,0,,
extremadura,16/03/1981,1981,3,16,6,,Lluvia,,Cáceres,True,1,1,1,1,39.47753910519658,-6.377428325189714
extremadura,16/03/1981,1981,3,16,10,,Lluvia,,Plasencia,True,0,0,0,0,40.03535535252543,-6.089134757182878
extremadura,17/03/1981,1981,3,17,5,,Sequía,,Embalse del Salor,True,0,0,1,0,,
extremadura,17/03/1981,1981,3,17,6,,,,,False,0,0,0,0,,
hoy,17/03/1981,1981,3,17,26,BAD,,,,False,0,0,0,0,,
extremadura,18/03/1981,1981,3,18,15,,,,,False,0,0,0,0,,
extremadura,20/03/1981,1981,3,20,2,,Sequía,,Provincia de Badajoz,True,1,1,0,0,,
hoy,20/03/1981,1981,3,20,9,MER,sequía,,Badajoz,True,1,1,0,0,38.871034753836994,-6.975421049278072
hoy,20/03/1981,1981,3,20,14,CAC,sequía,,Higuera de Llerena,True,0,0,0,0,38.3757976917521,-5.999745330421273
hoy,20/03/1981,1981,3,20,15,BAD,sequía,,Alconchel,True,0,0,1,0,38.51718718067185,-7.071719477495805
extremadura,21/03/1981,1981,3,21,3,,,,,False,0,0,0,0,,
extremadura,21/03/1981,1981,3,21,5,,Lluvia,,Provincia de Cáceres,True,0,0,1,0,,
hoy,22/03/1981,1981,3,22,1,CAC,Sequía,,Extremadura,True,1,1,0,0,,
hoy,22/03/1981,1981,3,22,18,MER,,,,False,0,0,0,0,,
extremadura,25/03/1981,1981,3,25,11,,,,,False,0,0,0,0,,
extremadura,26/03/1981,1981,3,26,9,,,,,False,0,0,0,0,,
extremadura,26/03/1981,1981,3,26,11,,,,,False,0,0,0,0,,
extremadura,28/03/1981,1981,3,28,5,,Sequía,,Provincia de Cáceres,True,0,0,1,0,,
hoy,28/03/1981,1981,3,28,11,CAC,sequía,,Montehermoso,True,0,0,1,0,40.08838744903538,-6.349237831001362
hoy,28/03/1981,1981,3,28,16,MER,,,,False,0,0,0,0,,
extremadura,03/04/1981,1981,4,3,14,,Lluvia,,Valencia de Alcántara,True,0,0,1,0,39.41026172958824,-7.244173555257091
hoy,02/04/1981,1981,4,19,4,BAD,sequía,,Puebla del Maestre,True,0,0,0,0,38.08515605286468,-6.078494294072589
extremadura,20/04/1981,1981,4,20,5,,Lluvia,,Provincia de Cáceres,True,0,0,1,0,,
extremadura,21/04/1981,1981,4,21,5,,Lluvia,,Provincia de Cáceres,True,0,0,1,0,,
extremadura,24/04/1981,1981,4,24,4,,,,,False,0,0,0,0,,
hoy,25/04/1981,1981,4,25,14,BAD,,,,False,0,0,0,0,,
extremadura,27/04/1981,1981,4,27,6,,,,,False,0,0,0,0,,
extremadura,30/04/1981,1981,4,30,10,,,,,False,0,0,0,0,,
extremadura,06/05/1981,1981,5,6,12,,Lluvia,,Valencia de Alcántara,True,0,0,1,0,39.41026172958824,-7.244173555257091
extremadura,09/05/1981,1981,5,9,3,,,,,False,0,0,0,0,,
extremadura,09/05/1981,1981,5,9,14,,,,,False,0,0,0,0,,
extremadura,11/05/1981,1981,5,11,4,,Lluvia,,Provincia de Cáceres,True,0,0,1,0,,
hoy,17/05/1981,1981,5,17,22,CAC,sequía,,Torrejón el Rubio,True,0,0,1,0,39.770824622311125,-6.012335249034648
extremadura,18/05/1981,1981,5,18,5,,Sequía,,"Brozas, Villa del Rey",True,0,0,1,0,39.6355860296654,-6.8001327645429415
hoy,19/05/1981,1981,5,19,10,BAD,,,,False,0,0,0,0,,
extremadura,20/05/1981,1981,5,20,9,,,,,False,0,0,0,0,,
hoy,22/05/1981,1981,5,22,13,SUP,,,,False,0,0,0,0,,
hoy,26/05/1981,1981,5,26,10,CAC,Sequía,,Cáceres,True,0,0,0,0,39.47753910519658,-6.377428325189714
extremadura,02/06/1981,1981,6,2,1,,,,,False,0,0,0,0,,
hoy,02/06/1981,1981,6,2,1,BAD,sequía,,Villar del Pedroso,True,0,0,1,0,39.70633604506962,-5.195139172254057
extremadura,03/06/1981,1981,6,3,8,,,,,False,0,0,0,0,,
hoy,03/06/1981,1981,6,3,17,MER,,,,False,0,0,0,0,,
hoy,03/06/1981,1981,6,3,20,MER,,,,False,0,0,0,0,,
hoy,03/06/1981,1981,6,3,21,MER,,,,False,0,0,0,0,,
extremadura,05/06/1981,1981,6,5,14,,Sequía,,Valencia de Alcántara,True,0,0,1,0,39.41026172958824,-7.244173555257091
hoy,05/06/1981,1981,6,5,17,MER,,,,False,0,0,0,0,,
hoy,07/06/1981,1981,6,7,26,MER,sequía,,Fregenal de la Sierra,True,1,1,0,0,38.1687749610116,-6.653923848007927
hoy,07/06/1981,1981,6,7,31,BAD,sequía,,Azuaga,True,0,0,1,0,38.25927585060632,-5.676455607293899
hoy,09/06/1981,1981,6,9,21,CAC,sequía,,Montehermoso,True,0,0,1,0,40.08838744903538,-6.349237831001362
hoy,11/06/1981,1981,6,11,30,BAD,,,,False,0,0,0,0,,
hoy,12/06/1981,1981,6,12,12,CAC,,,,False,0,0,0,0,,
extremadura,16/06/1981,1981,6,16,14,,Lluvia,,Valle del Jerte,True,1,0,1,0,,
extremadura,17/06/1981,1981,6,17,11,,,,,False,0,0,0,0,,
hoy,17/06/1981,1981,6,17,18,MER,,,,False,0,0,0,0,,
hoy,18/06/1981,1981,6,18,14,CAC,sequía,,Mirabel,True,1,1,0,0,39.86393657330855,-6.2314707237772655
hoy,18/06/1981,1981,6,18,15,BAD,tormentoso,,Villanueva del Fresno,True,0,0,1,0,38.37492908303046,-7.167059124569499
hoy,19/06/1981,1981,6,19,24,BAD,,,,False,0,0,0,0,,
hoy,19/06/1981,1981,6,19,27,BAD,,,,False,0,0,0,0,,
extremadura,20/06/1981,1981,6,20,13,,Calor,,Plasencia,True,0,0,0,0,40.03535535252543,-6.089134757182878
extremadura,22/06/1981,1981,6,22,12,,Calor,,Valencia de Alcántara,True,0,0,0,0,39.41026172958824,-7.244173555257091
hoy,23/06/1981,1981,6,23,20,CAC,sequía,,Hoyos,True,0,0,0,0,40.171594462665546,-6.720281317529753
hoy,24/06/1981,1981,6,23,20,MER,sequía,,Esparragosa del Caudillo,True,0,0,1,0,,
hoy,24/06/1981,1981,6,24,21,CAC,,,,False,0,0,0,0,,
extremadura,25/06/1981,1981,6,25,4,,,,,False,0,0,0,0,,
hoy,26/06/1981,1981,6,26,10,SUP,,,,False,0,0,0,0,,
hoy,26/06/1981,1981,6,26,16,CAC,sequía,,Garciaz,True,0,0,0,0,39.41281517332435,-5.628272506215836
hoy,26/06/1981,1981,6,26,17,CAC,sequía,,Pasarón de la Vera,True,0,0,1,0,40.05142286565047,-5.820316765475152
hoy,30/06/1981,1981,6,30,21,BAD,sequía,,Villafranca de los Barros,True,0,0,1,0,38.55953602827336,-6.3328763558379855
extremadura,01/07/1981,1981,7,1,12,,,,,False,0,0,0,0,,
hoy,01/07/1981,1981,7,1,24,MER,,,,False,0,0,0,0,,
extremadura,03/07/1981,1981,7,3,1,,Sequía,,Borbollón y Valdesalor,True,1,1,1,0,39.37760012946292,-6.348047165142578
extremadura,03/07/1981,1981,7,3,7,,Sequía,,Borbollón y Valdesalor,True,1,1,1,0,39.37760012946292,-6.348047165142578
hoy,05/07/1981,1981,7,5,20,CAC,sequía,,Almoharín,True,1,0,0,0,39.17587117477212,-6.045433563363996
hoy,14/07/1981,1981,7,14,8,BAD,,,,False,0,0,0,0,,
hoy,14/07/1981,1981,7,14,9,CAC,sequía,,Ruanes,True,0,0,1,0,39.32809829875585,-6.0122532683894985
extremadura,15/07/1981,1981,7,15,4,,Sequía,,Provinciad de Cáceres,True,0,0,1,0,,
extremadura,15/07/1981,1981,7,15,14,,Lluvia,,Valencia de Alcántara,True,0,0,1,0,39.41026172958824,-7.244173555257091
extremadura,21/07/1981,1981,7,21,5,,,,,False,0,0,0,0,,
hoy,21/07/1981,1981,7,21,15,CAC,sequía,,Tejada de Tiétar,True,0,0,1,0,,
extremadura,23/07/1981,1981,7,23,5,,Sequía,,Provincia de Cáceres y Badajoz,True,0,0,1,0,38.871034753836994,-6.975421049278072
hoy,26/07/1981,1981,7,26,28,BAD,,,,False,0,0,0,0,,
extremadura,27/07/1981,1981,7,27,1,,,,,False,0,0,0,0,,
extremadura,28/07/1981,1981,7,28,3,,,,,False,0,0,0,0,,
extremadura,28/07/1981,1981,7,28,12,,,,,False,0,0,0,0,,
hoy,02/08/1981,1981,8,2,23,BAD,,,,False,0,0,0,0,,
hoy,05/08/1981,1981,8,4,1,MER,sequía,,Provincia de Badajoz,True,0,0,1,0,,
extremadura,04/08/1981,1981,8,4,2,,,,,False,0,0,0,0,,
hoy,04/08/1981,1981,8,4,14,BAD,,,,False,0,0,0,0,,
hoy,06/08/1981,1981,8,6,3,BAD,,,,False,0,0,0,0,,
extremadura,07/08/1981,1981,8,7,13,,,,,False,0,0,0,0,,
extremadura,07/08/1981,1981,8,7,14,,,,,False,0,0,0,0,,
hoy,11/08/1981,1981,8,11,9,BAD,sequía,,Provincia de Badajoz,True,0,1,1,0,,
extremadura,11/08/1981,1981,8,11,12,,Sequía,,Valencia de Alcántara,True,0,0,1,0,39.41026172958824,-7.244173555257091
hoy,12/08/1981,1981,8,12,32,CAC,sequía,,Plasencia,True,0,0,1,0,40.03535535252543,-6.089134757182878
hoy,13/08/1981,1981,8,13,15,CAC,,,,False,0,0,0,0,,
hoy,16/08/1981,1981,8,16,28,BAD,,,,False,0,0,0,0,,
extremadura,17/08/1981,1981,8,17,20,,,,,False,0,0,0,0,,
hoy,18/08/1981,1981,8,18,11,BAD,sequía,,Provincia de Badajoz,True,0,0,1,0,,
extremadura,19/08/1981,1981,8,19,12,,,,,False,0,0,0,0,,
extremadura,20/08/1981,1981,8,20,5,,Sequía,,Provincia de Cáceres,True,0,0,1,0,,
hoy,20/08/1981,1981,8,20,9,CAC,sequía,,Provincia de Badajoz,True,0,0,1,0,,
hoy,20/08/1981,1981,8,20,24,CAC,,,,False,0,0,0,0,,
hoy,23/08/1981,1981,8,23,11,CAC,sequía,,Monfragüe,True,0,0,0,0,,
extremadura,25/08/1981,1981,8,25,13,,,,,False,0,0,0,0,,
extremadura,26/08/1981,1981,8,26,13,,,,,False,0,0,0,0,,
hoy,26/08/1981,1981,8,26,13,MER,,,,False,0,0,0,0,,
extremadura,28/08/1981,1981,8,28,5,,Sequía,,Provincia de Badajoz,True,0,0,1,0,,
extremadura,28/08/1981,1981,8,28,5,,Sequía,,Localidades de la provincia de Cáceres,True,0,0,1,0,,
extremadura,28/08/1981,1981,8,28,12,,Calor,,Valle del Jerte,True,0,0,1,0,,
hoy,28/08/1981,1981,8,28,15,CAC,sequía,,Trujillo,True,0,0,1,0,39.45888638575288,-5.876389783097755
extremadura,31/08/1981,1981,8,31,7,,sequía,,Povincia de Cáceres,True,1,1,1,0,,
extremadura,31/08/1981,1981,8,31,7,,Sequía,,Provincia de Cáceres,True,1,1,1,0,,
hoy,01/09/1981,1981,9,1,11,CAC,sequía,,Cáceres,True,1,0,1,0,39.47753910519658,-6.377428325189714
hoy,01/09/1981,1981,9,1,26,SUP,,,,False,0,0,0,0,,
extremadura,03/09/1981,1981,9,3,2,,,,,False,0,0,0,0,,
extremadura,04/09/1981,1981,9,4,1,,Sequía,,Plasencia,True,0,0,1,0,40.03535535252543,-6.089134757182878
extremadura,04/09/1981,1981,9,4,10,,,,,False,0,0,0,0,,
extremadura,05/09/1981,1981,9,5,5,,Sequía,,Extremadura,True,1,1,1,0,,
hoy,08/09/1981,1981,9,8,6,BAD,,,,False,0,0,0,0,,
extremadura,08/09/1981,1981,9,8,12,,Lluvia,,Valencia de Alcántara,True,0,0,1,0,39.41026172958824,-7.244173555257091
extremadura,11/09/1981,1981,9,11,5,,,,,False,0,0,0,0,,
extremadura,11/09/1981,1981,9,11,12,,Sequía,,Valencia de Alcántara,True,0,0,1,0,39.41026172958824,-7.244173555257091
extremadura,11/09/1981,1981,9,11,14,,,,,False,0,0,0,0,,
extremadura,16/09/1981,1981,9,16,13,,Sequía,,Plasencia,True,1,1,1,0,40.03535535252543,-6.089134757182878
extremadura,19/09/1981,1981,9,19,12,,,,,False,0,0,0,0,,
extremadura,21/09/1981,1981,9,21,10,,Lluvia,,Plasencia,True,0,0,1,0,40.03535535252543,-6.089134757182878
hoy,23/09/1981,1981,9,22,16,BAD,sequía,,Jaraíz de la Vera,True,1,1,1,0,40.06145730872112,-5.752227484611712
extremadura,23/09/1981,1981,9,23,11,,,,,False,0,0,0,0,,
extremadura,25/09/1981,1981,9,25,3,,Sequía,,Cáceres,True,1,1,0,0,39.47753910519658,-6.377428325189714
extremadura,30/09/1981,1981,9,30,15,,,,,False,0,0,0,0,,
extremadura,01/10/1981,1981,10,1,12,,Lluvia,,Valle del Jerte,True,0,0,0,0,,
hoy,09/10/1981,1981,10,9,10,MER,,,,False,0,0,0,0,,
hoy,10/10/1981,1981,10,10,12,BAD,,,,False,0,0,0,0,,
hoy,10/10/1981,1981,10,10,15,BAD,,,,False,0,0,0,0,,
hoy,11/10/1981,1981,10,11,21,BAD,,,,False,0,0,0,0,,
hoy,21/10/1981,1981,10,21,15,CAC,sequía,,Zarza la Mayor,True,1,1,0,0,39.87691644793317,-6.861602854438933
hoy,21/10/1981,1981,10,21,17,BAD,,,,False,0,0,0,0,,
hoy,24/10/1981,1981,10,24,20,BAD,sequía,,Villafranca de los Barros,True,1,0,1,0,38.55953602827336,-6.3328763558379855
hoy,24/10/1981,1981,10,24,20,MER,sequía,,Usagre,True,0,0,1,0,38.35570711729818,-6.167410772373192
hoy,27/10/1981,1981,10,27,15,MER,sequía,,Fuente edl Maestre,True,0,0,1,0,,
hoy,30/10/1981,1981,10,30,1,BAD,sequía,,Provincia de Badajoz,True,0,1,1,0,,
extremadura,31/10/1981,1981,10,31,7,,,,,False,0,0,0,0,,
hoy,02/11/1981,1981,11,2,1,BAD,sequía,,Provincia de Cáceres,True,0,0,1,0,,
hoy,02/11/1981,1981,11,2,10,DEP,,,,False,0,0,0,0,,
extremadura,03/11/1981,1981,11,3,5,,,,,False,0,0,0,0,,
hoy,18/11/1981,1981,11,3,11,CAC,sequía,,Fuente del Maestre,True,0,0,1,0,38.52549076226078,-6.447472383955171
extremadura,05/11/1981,1981,11,5,5,,Sequía,,Cáceres,True,1,1,1,0,39.47753910519658,-6.377428325189714
extremadura,05/11/1981,1981,11,5,16,,,,,False,0,0,0,0,,
extremadura,06/11/1981,1981,11,6,8,,,,,False,0,0,0,0,,
hoy,06/11/1981,1981,11,6,10,BAD,,,,False,0,0,0,0,,
extremadura,07/11/1981,1981,11,7,12,,Lluvia,,Monroy,True,1,1,1,0,39.6370456021257,-6.2096451583339904
extremadura,09/11/1981,1981,11,9,10,,Sequía,,Extremadura,True,0,0,1,0,,
extremadura,12/11/1981,1981,11,12,5,,Lluvia,,Cáceres,True,0,0,0,0,39.47753910519658,-6.377428325189714
extremadura,13/11/1981,1981,11,13,13,,Lluvia,,Plasencia,True,1,1,1,0,40.03535535252543,-6.089134757182878
extremadura,13/11/1981,1981,11,13,15,,,,,False,0,0,0,0,,
hoy,18/11/1981,1981,11,18,17,BAD,,,,False,0,0,0,0,,
extremadura,19/11/1981,1981,11,19,4,,Lluvia,,Fuente Concejo,True,0,0,0,0,,
extremadura,19/11/1981,1981,11,19,9,,,,,False,0,0,0,0,,
extremadura,20/11/1981,1981,11,20,4,,Lluvia,,Fuente Concejo,True,0,0,0,0,,
extremadura,20/11/1981,1981,11,20,15,,,,,False,0,0,0,0,,
extremadura,21/11/1981,1981,11,21,14,,,,,False,0,0,0,0,,
hoy,22/11/1981,1981,11,22,23,CAC,,,,False,0,0,0,0,,
extremadura,23/11/1981,1981,11,23,18,,,,,False,0,0,0,0,,
extremadura,24/11/1981,1981,11,24,3,,,,,False,0,0,0,0,,
extremadura,24/11/1981,1981,11,24,13,,Sequía,,Extremadura,True,1,1,0,0,,
hoy,25/11/1981,1981,11,25,15,CAC,sequía,,Baños de Montemayor,True,1,0,0,0,40.31650707514345,-5.858075328553747
extremadura,26/11/1981,1981,11,26,1,,Sequía,,Aliseda,True,0,0,1,0,39.423077972418,-6.694034836374631
extremadura,26/11/1981,1981,11,26,7,,,,,False,0,0,0,0,,
hoy,27/11/1981,1981,11,27,1,BAD,sequía,,Provincia de Badajoz,True,0,0,1,0,,
extremadura,27/11/1981,1981,11,27,6,,Sequía,,Cáceres,True,0,0,0,0,39.47753910519658,-6.377428325189714
extremadura,28/11/1981,1981,11,28,14,,Calor,,Valle del Jerte,True,0,0,1,0,,
extremadura,30/11/1981,1981,11,30,10,,,,,False,0,0,0,0,,
extremadura,01/12/1981,1981,12,1,14,,,,,False,0,0,0,0,,
extremadura,02/12/1981,1981,12,2,3,,Sequía,,Cáceres,True,1,1,0,0,39.47753910519658,-6.377428325189714
extremadura,02/12/1981,1981,12,2,10,,,,,False,0,0,0,0,,
extremadura,03/12/1981,1981,12,3,7,,,,,False,0,0,0,0,,
extremadura,04/12/1981,1981,12,4,4,,Lluvia,,Cáceres,True,0,0,0,0,39.47753910519658,-6.377428325189714
extremadura,04/12/1981,1981,12,4,4,,Sequía,,Extremadura,True,0,0,0,0,,
extremadura,04/12/1981,1981,12,4,12,,Lluvia,,Valencia de Alcántara,True,0,0,0,0,39.41026172958824,-7.244173555257091
hoy,05/12/1981,1981,12,5,20,BAD,sequía,,Fuente del Maestre,True,1,0,0,0,38.52549076226078,-6.447472383955171
hoy,07/12/1981,1981,12,5,20,MER,sequía,,Badajoz,True,1,1,0,0,38.871034753836994,-6.975421049278072
extremadura,07/12/1981,1981,12,7,11,,Lluvia,,Badajoz,True,0,0,0,0,38.871034753836994,-6.975421049278072
extremadura,07/12/1981,1981,12,7,14,,Frío,,Valle del Jerte,True,0,0,0,0,,
extremadura,07/12/1981,1981,12,7,14,,Lluvia,,Monroy,True,1,1,0,0,39.6370456021257,-6.2096451583339904
extremadura,10/12/1981,1981,12,10,5,,,,,False,0,0,0,0,,
hoy,10/12/1981,1981,12,10,15,BAD,sequía,,Extremadura,True,0,0,1,0,,
extremadura,11/12/1981,1981,12,11,15,,,,,False,0,0,0,0,,
hoy,12/12/1981,1981,12,12,1,CAC,,,,False,0,0,0,0,,
extremadura,12/12/1981,1981,12,12,6,,,,,False,0,0,0,0,,
hoy,12/12/1981,1981,12,12,17,BAD,sequía,,Provincia de Badajoz,True,0,0,1,0,,
extremadura,15/12/1981,1981,12,15,9,,,,,False,0,0,0,0,,
extremadura,16/12/1981,1981,12,16,1,,,,,False,0,0,0,0,,
hoy,16/12/1981,1981,12,16,16,CAC,,,,False,0,0,0,0,,
extremadura,17/12/1981,1981,12,17,1,,Sequía,,Cáceres,True,0,0,0,0,39.47753910519658,-6.377428325189714
extremadura,17/12/1981,1981,12,17,8,,Lluvia,,Cáceres,True,0,0,0,0,39.47753910519658,-6.377428325189714
extremadura,18/12/1981,1981,12,18,11,,Lluvia,,Provincia de Badajoz,True,0,0,1,0,,
extremadura,23/12/1981,1981,12,23,11,,,,,False,0,0,0,0,,
extremadura,24/12/1981,1981,12,24,10,,,,,False,0,0,0,0,,
hoy,26/12/1981,1981,12,26,24,BAD,,,,False,0,0,0,0,,
hoy,28/12/1981,1981,12,28,16,DEP,,,,False,0,0,0,0,,
extremadura,29/12/1981,1981,12,29,7,,,,,False,0,0,0,0,,
extremadura,31/12/1981,1981,12,31,3,,Inund,,Cáceres,True,0,0,0,0,39.47753910519658,-6.377428325189714
extremadura,31/12/1981,1981,12,31,6,,Sequía,,Cáceres,True,0,0,0,0,39.47753910519658,-6.377428325189714
extremadura,31/12/1981,1981,12,31,13,,,,,False,0,0,0,0,,
extremadura,05/01/1982,1982,1,5,5,,Inund,,Cáceres,True,0,0,0,0,39.47753910519658,-6.377428325189714
extremadura,15/01/1982,1982,1,15,4,,,,,False,0,0,0,0,,
extremadura,05/02/1982,1982,2,5,12,,Lluvia,,Valencia de Alcántara,True,0,0,0,0,39.41026172958824,-7.244173555257091
extremadura,22/02/1982,1982,2,22,11,,,,,False,0,0,0,0,,
extremadura,02/03/1982,1982,3,2,8,,,,,False,0,0,0,0,,
extremadura,25/03/1982,1982,3,25,3,,Lluvia,,Cáceres,True,0,0,0,0,39.47753910519658,-6.377428325189714
extremadura,12/04/1982,1982,4,12,3,,,,,False,0,0,0,0,,
extremadura,28/04/1982,1982,4,28,13,,Lluvia,,Plasencia,True,0,0,0,0,40.03535535252543,-6.089134757182878
extremadura,15/05/1982,1982,5,15,5,,Lluvia,,Cáceres,True,1,1,1,0,39.47753910519658,-6.377428325189714
extremadura,21/05/1982,1982,5,21,6,,,,,False,0,0,0,0,,
extremadura,25/05/1982,1982,5,25,16,,Calor,,Provincia de Badajoz,True,0,0,1,0,,
extremadura,28/05/1982,1982,5,28,1,,,,,False,0,0,0,0,,
extremadura,01/06/1982,1982,6,1,10,,Lluvia,,Provincia de Badajoz,True,0,0,1,0,,
extremadura,01/06/1982,1982,6,1,12,,Sequía,,Monroy,True,1,1,0,0,39.6370456021257,-6.2096451583339904
extremadura,07/06/1982,1982,6,7,2,,,,,False,0,0,0,0,,
extremadura,08/06/1982,1982,6,8,6,,Tormenta,,Provincia de Cáceres,True,0,0,1,0,,
extremadura,08/06/1982,1982,6,8,7,,Sequía,,Provincia de Cáceres,True,0,0,0,0,,
extremadura,08/06/1982,1982,6,8,11,,Lluvia,,Provincia de Badajoz,True,0,0,1,0,,
extremadura,21/06/1982,1982,6,21,2,,,,,False,0,0,0,0,,
extremadura,24/06/1982,1982,6,24,3,,,,,False,0,0,0,0,,
extremadura,24/06/1982,1982,6,24,15,,,,,False,0,0,0,0,,
extremadura,28/06/1982,1982,6,28,14,,,,,False,0,0,0,0,,
hoy,01/07/1982,1982,7,1,13,MER,Sequia,,Badajoz,True,0,0,1,0,38.871034753836994,-6.975421049278072
hoy,07/07/1982,1982,7,7,14,BAD,Sequia,,Badajoz,True,0,0,1,0,38.871034753836994,-6.975421049278072
hoy,08/07/1982,1982,7,8,1,CAC,Sequia,,Extremadura,True,0,0,1,0,,
hoy,08/07/1982,1982,7,8,13,CAC,,,,False,0,0,0,0,,
hoy,10/07/1982,1982,7,10,1,BAD,Sequia,,badajoz,True,1,1,0,0,38.871034753836994,-6.975421049278072
hoy,11/07/1982,1982,7,11,18,BAD,Sequia,,badajoz,True,1,1,0,0,38.871034753836994,-6.975421049278072
hoy,12/07/1982,1982,7,12,7,BAD,,,,False,0,0,0,0,,
hoy,12/07/1982,1982,7,12,8,CAC,Sequia,,badajoz,True,1,1,1,0,38.871034753836994,-6.975421049278072
hoy,13/07/1982,1982,7,13,10,BAD,,,,False,0,0,0,0,,
hoy,14/07/1982,1982,7,14,9,BAD,,,,False,0,0,0,0,,
hoy,17/07/1982,1982,7,17,9,CAC,,,,False,0,0,0,0,,
hoy,17/07/1982,1982,7,17,13,BAD,,,,False,0,0,0,0,,
hoy,20/07/1982,1982,7,20,10,BAD,,,,False,0,0,0,0,,
hoy,23/07/1982,1982,7,23,14,CAC,Sequia,,Valdesalor,True,0,0,1,0,39.37760012946292,-6.348047165142578
hoy,24/07/1982,1982,7,24,14,CAC,,,,False,0,0,0,0,,
hoy,25/07/1982,1982,7,25,20,BAD,Sequia,,Medina de las Torres,True,0,0,1,0,38.342213879024754,-6.41295105224488
hoy,28/07/1982,1982,7,25,20,BAD,Sequia,,badajoz,True,0,0,1,0,38.871034753836994,-6.975421049278072
hoy,30/07/1982,1982,7,30,9,CAC,,,,False,0,0,0,0,,
hoy,05/08/1982,1982,8,1,12,CAC,Sequia,,Cíjara,True,0,0,1,0,,
extremadura,03/08/1982,1982,8,3,5,,Frío,,Cáceres,True,0,0,0,0,39.47753910519658,-6.377428325189714
hoy,04/08/1982,1982,8,4,9,CAC,Sequia,,Extremadura,True,0,0,1,0,,
hoy,05/08/1982,1982,8,5,1,BAD,Sequia,,Don Benito,True,0,0,0,0,38.95620783267387,-5.859801918815306
extremadura,06/08/1982,1982,8,6,11,,,,,False,0,0,0,0,,
extremadura,09/08/1982,1982,8,9,7,,,,,False,0,0,0,0,,
hoy,12/08/1982,1982,8,12,9,BAD,Sequia,,Fuente del Maestre,True,1,1,1,0,38.52549076226078,-6.447472383955171
extremadura,13/08/1982,1982,8,13,9,,Sequía,,Provincia de Badajoz,True,0,0,1,0,,
extremadura,14/08/1982,1982,8,14,3,,Calor,,Cáceres,True,0,0,0,0,39.47753910519658,-6.377428325189714
extremadura,14/08/1982,1982,8,14,12,,,,,False,0,0,0,0,,
hoy,14/08/1982,1982,8,14,17,BAD,,,,False,0,0,0,0,,
hoy,15/08/1982,1982,8,15,11,CAC,,,,False,0,0,0,0,,
extremadura,17/08/1982,1982,8,17,11,,,,,False,0,0,0,0,,
extremadura,17/08/1982,1982,8,17,12,,,,,False,0,0,0,0,,
hoy,18/08/1982,1982,8,18,15,BAD,,,,False,0,0,0,0,,
extremadura,18/08/1982,1982,8,18,21,,,,,False,0,0,0,0,,
extremadura,20/08/1982,1982,8,20,1,,,,,False,0,0,0,0,,
extremadura,20/08/1982,1982,8,20,11,,Lluvia,,Plasencia,True,0,0,1,0,40.03535535252543,-6.089134757182878
extremadura,20/08/1982,1982,8,20,11,,Sequía,,Plasencia,True,0,0,1,0,40.03535535252543,-6.089134757182878
extremadura,24/08/1982,1982,8,24,2,,Sequía,,El Junquillo (Cáceres),True,0,0,1,0,39.47753910519658,-6.377428325189714
extremadura,24/08/1982,1982,8,24,4,,,,,False,0,0,0,0,,
hoy,26/08/1982,1982,8,26,1,MER,Sequia,,Extremadura,True,0,0,0,0,,
extremadura,26/08/1982,1982,8,26,5,,Sequía,,Cáceres y España,True,1,1,0,0,39.47753910519658,-6.377428325189714
hoy,27/08/1982,1982,8,27,10,MER,,,,False,0,0,0,0,,
extremadura,27/08/1982,1982,8,27,12,,Graniz,,Valle del Jerte,True,0,0,1,0,,
extremadura,28/08/1982,1982,8,28,5,,Sequía,,Cáceres,True,1,0,1,0,39.47753910519658,-6.377428325189714
hoy,28/08/1982,1982,8,28,17,CAC,,,,False,0,0,0,0,,
extremadura,31/08/1982,1982,8,31,15,,,,,False,0,0,0,0,,
extremadura,03/09/1982,1982,9,3,9,,,,,False,0,0,0,0,,
extremadura,04/09/1982,1982,9,4,12,,Lluvia,,Valencia de Alcántara,True,0,0,1,0,39.41026172958824,-7.244173555257091
extremadura,10/09/1982,1982,9,10,9,,,,,False,0,0,0,0,,
extremadura,11/09/1982,1982,9,11,6,,,,,False,0,0,0,0,,
extremadura,11/09/1982,1982,9,11,13,,Graniz,,Plasencia,True,0,0,0,0,40.03535535252543,-6.089134757182878
extremadura,13/09/1982,1982,9,13,12,,,,,False,0,0,0,0,,
extremadura,16/09/1982,1982,9,16,13,,,,,False,0,0,0,0,,
extremadura,21/09/1982,1982,9,21,7,,Lluvia,,Provincia de Cáceres,True,0,0,1,0,,
extremadura,21/09/1982,1982,9,21,12,,Sequía,,Valle del Jerte,True,0,0,1,0,,
extremadura,21/09/1982,1982,9,21,13,,Sequía,,Plasencia,True,1,1,0,0,40.03535535252543,-6.089134757182878
extremadura,27/09/1982,1982,9,27,16,,,,,False,0,0,0,0,,
extremadura,28/09/1982,1982,9,28,4,,Sequía,,Cáceres,True,0,1,0,0,39.47753910519658,-6.377428325189714
extremadura,13/10/1982,1982,10,13,7,,Lluvia,,Provincia de Cáceres,True,0,0,1,0,,
extremadura,16/10/1982,1982,10,16,6,,,,,False,0,0,0,0,,
extremadura,02/11/1982,1982,11,2,15,,,,,False,0,0,0,0,,
extremadura,09/11/1982,1982,11,9,5,,Inund,,Cáceres,True,0,0,0,0,39.47753910519658,-6.377428325189714
extremadura,11/11/1982,1982,11,11,16,,Lluvia,,Provincia de Badajoz,True,0,0,1,0,,
extremadura,16/11/1982,1982,11,16,8,,Lluvia,,Provincia de Cáceres,True,0,0,1,0,,
extremadura,24/11/1982,1982,11,24,2,,Lluvia,,Provincia de Badajoz,True,0,0,1,0,,
extremadura,25/11/1982,1982,11,25,8,,,,,False,0,0,0,0,,
extremadura,26/11/1982,1982,11,26,8,,,,,False,0,0,0,0,,
extremadura,27/11/1982,1982,11,27,16,,,,,False,0,0,0,0,,
extremadura,04/12/1982,1982,12,4,12,,LLuvia,,Monroy,True,0,0,0,0,39.6370456021257,-6.2096451583339904
extremadura,29/12/1982,1982,12,29,10,,,,,False,0,0,0,0,,
extremadura,04/01/1983,1983,1,4,12,,Lluvia,,Valencia de Alcántara,True,0,0,0,0,39.41026172958824,-7.244173555257091
extremadura,08/01/1983,1983,1,8,6,,,,,False,0,0,0,0,,
hoy,10/01/1983,1983,1,10,16,BAD,,,,False,0,0,0,0,,
extremadura,13/01/1983,1983,1,13,5,,Sequía,,,True,0,0,1,0,,
extremadura,14/01/1983,1983,1,14,7,,,,,False,0,0,0,0,,
extremadura,17/01/1983,1983,1,17,1,,Sequía,,,True,0,0,1,0,,
hoy,17/01/1983,1983,1,17,1,BAD,Sequia,,Badajoz,True,0,0,1,0,38.871034753836994,-6.975421049278072
hoy,17/01/1983,1983,1,17,9,BAD,Sequia,,Badajoz,True,0,0,1,0,38.871034753836994,-6.975421049278072
hoy,18/01/1983,1983,1,18,8,BAD,,,,False,0,0,0,0,,
hoy,18/01/1983,1983,1,18,11,MER,,,,False,0,0,0,0,,
extremadura,18/01/1983,1983,1,18,13,,,,,False,0,0,0,0,,
extremadura,19/01/1983,1983,1,19,7,,,,,False,0,0,0,0,,
hoy,19/01/1983,1983,1,19,14,CAC,Sequia,,Cáceres,True,0,0,1,0,39.47753910519658,-6.377428325189714
hoy,20/01/1983,1983,1,20,17,BAD,,,,False,0,0,0,0,,
extremadura,21/01/1983,1983,1,21,9,,Sequía,,,True,0,0,1,0,,
hoy,26/01/1983,1983,1,26,9,CAC,Sequia,,Don Benito,True,0,0,0,0,38.95620783267387,-5.859801918815306
hoy,26/01/1983,1983,1,26,21,BAD,,,,False,0,0,0,0,,
hoy,31/01/1983,1983,1,31,9,BAD,Sequia,,Vegas Altas del Guadiana,True,0,0,0,0,,
hoy,02/02/1983,1983,2,2,13,BAD,Sequia,,Badajoz,True,0,0,1,0,38.871034753836994,-6.975421049278072
extremadura,03/02/1983,1983,2,3,16,,Sequía,,Badajoz,True,0,0,1,0,38.871034753836994,-6.975421049278072
hoy,04/02/1983,1983,2,4,15,MER,,,,False,0,0,0,0,,
extremadura,09/02/1983,1983,2,9,2,,Sequía,,,True,0,0,1,0,,
extremadura,10/02/1983,1983,2,10,7,,,,,False,0,0,0,0,,
hoy,10/02/1983,1983,2,10,16,BAD,Sequia,,San Vicente de Alcántara,True,1,1,1,0,39.360086703649024,-7.138468759460446
extremadura,16/02/1983,1983,2,16,2,,,,,False,0,0,0,0,,
hoy,18/02/1983,1983,2,18,23,SUB,,,,False,0,0,0,0,,
extremadura,21/02/1983,1983,2,21,16,,Sequía,,,True,0,0,1,0,,
extremadura,22/02/1983,1983,2,22,7,,Desprenderse,,Deleitosa,True,0,0,1,0,39.64347235897095,-5.6451191409172425
extremadura,23/02/1983,1983,2,23,13,,,,,False,0,0,0,0,,
hoy,24/02/1983,1983,2,24,1,BAD,Sequia,,Badajoz,True,0,0,1,0,38.871034753836994,-6.975421049278072
extremadura,26/02/1983,1983,2,26,7,,,,,False,0,0,0,0,,
hoy,26/02/1983,1983,2,26,15,MER,,,,False,0,0,0,0,,
hoy,07/03/1983,1983,3,7,12,BAD,Sequia,,Extremadura,True,1,0,0,0,,
extremadura,07/03/1983,1983,3,7,16,,,,,False,0,0,0,0,,
hoy,10/03/1983,1983,3,10,17,MER,,,,False,0,0,0,0,,
hoy,12/03/1983,1983,3,12,10,CAC,,,,False,0,0,0,0,,
extremadura,15/03/1983,1983,3,15,8,,Sequía,,,True,0,0,1,0,,
extremadura,16/03/1983,1983,3,16,6,,Sequía,,,True,0,0,1,0,,
extremadura,18/03/1983,1983,3,18,9,,Sequía,,,True,0,0,1,0,,
hoy,21/03/1983,1983,3,21,10,MER,sequia,,Extremadura,True,0,0,1,0,,
extremadura,22/03/1983,1983,3,22,9,,,,,False,0,0,0,0,,
extremadura,26/03/1983,1983,3,26,2,,,,,False,0,0,0,0,,
extremadura,26/03/1983,1983,3,26,6,,,,,False,0,0,0,0,,
extremadura,30/03/1983,1983,3,30,8,,Sequía,,,True,0,0,1,0,,
hoy,01/04/1983,1983,4,1,4,BAD,,,,False,0,0,0,0,,
hoy,01/04/1983,1983,4,1,10,BAD,Sequia,,Badajoz,True,1,0,1,0,38.871034753836994,-6.975421049278072
hoy,06/04/1983,1983,4,6,20,CAC,Sequia,,Villagonzalo,True,0,0,0,0,38.86256179452688,-6.196994841388894
hoy,07/04/1983,1983,4,7,12,MER,Sequia,,Badajoz,True,0,0,1,0,38.871034753836994,-6.975421049278072
hoy,08/04/1983,1983,4,8,12,CAC,,,,False,0,0,0,0,,
hoy,08/04/1983,1983,4,8,14,BAD,,,,False,0,0,0,0,,
extremadura,11/04/1983,1983,4,11,3,,Lluvia,,,True,0,0,1,0,,
hoy,13/04/1983,1983,4,13,12,CAC,,,,False,0,0,0,0,,
hoy,13/04/1983,1983,4,13,22,MER,,,,False,0,0,0,0,,
hoy,14/04/1983,1983,4,14,30,BAD,,,,False,0,0,0,0,,
hoy,17/04/1983,1983,4,17,19,MER,Sequia,,Don Benito,True,0,0,1,0,38.95620783267387,-5.859801918815306
extremadura,18/04/1983,1983,4,18,12,,Sequía,,Cáceres,True,0,0,0,0,39.47753910519658,-6.377428325189714
hoy,18/04/1983,1983,4,18,12,CAC,Sequia,,Extremadura,True,1,1,0,0,,
hoy,19/04/1983,1983,4,19,22,BAD,Sequia,,Plasencia,True,0,0,0,0,40.03535535252543,-6.089134757182878
hoy,23/04/1983,1983,4,23,14,CAC,Sequia & nieve,,Cáceres,True,0,0,0,0,39.47753910519658,-6.377428325189714
extremadura,26/04/1983,1983,4,26,5,,,,,False,0,0,0,0,,
extremadura,27/04/1983,1983,4,27,7,,Lluvia,,,True,0,0,1,0,,
extremadura,27/04/1983,1983,4,27,12,,,,,False,0,0,0,0,,
hoy,27/04/1983,1983,4,27,23,MER,,,,False,0,0,0,0,,
extremadura,28/04/1983,1983,4,28,10,,,,,False,0,0,0,0,,
extremadura,09/05/1983,1983,5,9,1,,,,,False,0,0,0,0,,
extremadura,17/05/1983,1983,5,17,7,,Lluvia,,Alcuéscar,True,0,0,1,0,39.18074207055743,-6.228793580699227
hoy,02/06/1983,1983,6,2,17,CAC,Sequia,,Cáceres,True,0,0,1,0,39.47753910519658,-6.377428325189714
hoy,02/06/1983,1983,6,2,18,CAC,,,,False,0,0,0,0,,
hoy,07/06/1983,1983,6,7,16,CAC,Sequía,,Cáceres,True,0,0,1,0,39.47753910519658,-6.377428325189714
hoy,15/06/1983,1983,6,15,32,CAC,,,,False,0,0,0,0,,
hoy,23/06/1983,1983,6,23,11,CAC,,,,False,0,0,0,0,,
hoy,24/06/1983,1983,6,24,11,CAC,Sequia,,Badajoz,True,1,1,0,0,38.871034753836994,-6.975421049278072
hoy,24/06/1983,1983,6,24,22,CAC,Sequia,,Don Benito/ Villanueva,True,0,0,0,0,43.11757177161007,-5.242416032360122
hoy,25/06/1983,1983,6,25,15,CAC,,,,False,0,0,0,0,,
extremadura,05/07/1983,1983,7,5,6,,Sequía,,Cáceres,True,0,0,1,0,39.47753910519658,-6.377428325189714
hoy,06/07/1983,1983,7,6,11,MER,Sequia,,Badajoz-Cáceres,True,0,0,1,0,,
extremadura,16/07/1983,1983,7,16,6,,,,,False,0,0,0,0,,
extremadura,20/07/1983,1983,7,20,2,,Sequía,,Badajoz,True,0,0,1,0,38.871034753836994,-6.975421049278072
hoy,24/07/1983,1983,7,24,8,BAD,,,,False,0,0,0,0,,
extremadura,27/07/1983,1983,7,27,6,,,,,False,0,0,0,0,,
hoy,03/08/1983,1983,8,3,11,BAD,Sequía,,Badajoz,True,0,0,1,0,38.871034753836994,-6.975421049278072
hoy,08/08/1983,1983,8,8,11,BAD,,,,False,0,0,0,0,,
extremadura,13/08/1983,1983,8,13,9,,,,,False,0,0,0,0,,
extremadura,17/08/1983,1983,8,17,7,,Lluvia,,Cáceres,True,0,0,1,0,39.47753910519658,-6.377428325189714
hoy,04/09/1983,1983,9,4,3,BAD,,,,False,0,0,0,0,,
hoy,07/09/1983,1983,9,7,1,BAD,Sequía,,Extremadura (badajoz y Cácceres),True,0,0,1,0,,
hoy,08/09/1983,1983,9,8,19,CAC,Sequía,,Valdesalor,True,0,0,1,0,39.37760012946292,-6.348047165142578
hoy,09/09/1983,1983,9,9,12,BAD,,,,False,0,0,0,0,,
hoy,12/09/1983,1983,9,12,20,CAC,,,,False,0,0,0,0,,
hoy,18/09/1983,1983,9,18,16,CAC,Sequia,,Cáceres,True,0,0,1,0,39.47753910519658,-6.377428325189714
extremadura,07/10/1983,1983,10,7,11,,,,,False,0,0,0,0,,
hoy,21/10/1983,1983,10,21,17,MER,Sequía,,Badajoz,True,1,1,0,0,38.871034753836994,-6.975421049278072
hoy,23/10/1983,1983,10,23,23,BAD,,,,False,0,0,0,0,,
extremadura,28/10/1983,1983,10,28,10,,Sequía,,,True,0,0,1,0,,
hoy,01/11/1983,1983,11,1,27,BAD,,,,False,0,0,0,0,,
hoy,02/11/1983,1983,11,2,21,MER,Sequía,,Aceuchal,True,1,0,0,0,38.64556520246269,-6.485694934204259
extremadura,03/11/1983,1983,11,3,8,,Lluvia,,Cáceres,True,0,0,1,0,39.47753910519658,-6.377428325189714
extremadura,04/11/1983,1983,11,4,11,,,,,False,0,0,0,0,,
hoy,04/11/1983,1983,11,4,30,BAD,,,,False,0,0,0,0,,
hoy,08/11/1983,1983,11,8,14,MER,Sequía,,Badajoz,True,0,0,1,0,38.871034753836994,-6.975421049278072
extremadura,17/11/1983,1983,11,17,3,,,,,False,0,0,0,0,,
extremadura,10/11/1983,1983,11,17,13,,Lluvia,,Cáceres,True,0,0,0,0,39.47753910519658,-6.377428325189714
extremadura,17/11/1983,1983,11,17,16,,,,,False,0,0,0,0,,
extremadura,18/11/1983,1983,11,18,16,,Lluvia,,,True,0,0,1,0,,
hoy,05/12/1983,1983,12,5,12,BAD,Sequía,,Extremadura,True,0,0,0,0,,
hoy,26/12/1983,1983,12,26,11,MER,,,,False,0,0,0,0,,
hoy,06/06/1984,1984,6,6,11,BAD,,,,False,0,0,0,0,,
hoy,20/06/1984,1984,6,20,23,BAD,,,"Cordovilla de Lácara, Fuentes ded León",True,0,0,1,0,,
extremadura,06/08/1985,1985,8,6,6,,,,,False,0,0,0,0,,
hoy,12/08/1985,1985,8,12,12,CAC,,,,False,0,0,0,0,,
extremadura,13/08/1985,1985,8,13,15,,Sequía,,Trevejo,True,0,0,1,0,40.17276233495067,-6.778748585792194
extremadura,18/08/1985,1985,8,18,17,,,,,False,0,0,0,0,,
extremadura,22/08/1985,1985,8,22,11,,Calor,,Cáceres,True,0,0,0,0,39.47753910519658,-6.377428325189714
hoy,29/08/1985,1985,8,29,11,BAD,Sequia,,Extremadura,True,0,0,1,0,,
extremadura,11/09/1985,1985,9,11,7,,,,,False,0,0,0,0,,
extremadura,22/09/1985,1985,9,22,10,,Sequía,,,True,0,0,1,0,,
extremadura,01/10/1985,1985,10,1,10,,,,,False,0,0,0,0,,
extremadura,04/10/1985,1985,10,4,2,,,,,False,0,0,0,0,,
extremadura,04/10/1985,1985,10,4,9,,Sequía,,Cáceres,True,0,0,1,0,39.47753910519658,-6.377428325189714
extremadura,05/10/1985,1985,10,5,24,,,,,False,0,0,0,0,,
extremadura,08/10/1985,1985,10,8,10,,,,,False,0,0,0,0,,
extremadura,14/10/1985,1985,10,14,17,,,,,False,0,0,0,0,,
extremadura,17/10/1985,1985,10,17,17,,,,,False,0,0,0,0,,
extremadura,19/10/1985,1985,10,19,1,,Lluvia,,Badajoz,True,0,0,1,0,38.871034753836994,-6.975421049278072
extremadura,21/10/1985,1985,10,21,1,,Lluvia,,Extremadura,True,0,0,0,0,,
extremadura,22/10/1985,1985,10,22,12,,Sequía,,Cáceres,True,0,0,1,0,39.47753910519658,-6.377428325189714
extremadura,24/10/1985,1985,10,24,21,,,,,False,0,0,0,0,,
extremadura,25/10/1985,1985,10,25,12,,Sequía,,Cáceres,True,0,0,1,0,39.47753910519658,-6.377428325189714
extremadura,27/10/1985,1985,10,27,1,,LLuvia,,Badajoz,True,0,0,1,0,38.871034753836994,-6.975421049278072
extremadura,28/10/1985,1985,10,28,5,,Sequía,,Extremadura,True,0,0,0,0,,
extremadura,29/10/1985,1985,10,29,6,,Sequía,,Extremadura,True,1,1,0,0,,
extremadura,31/10/1985,1985,10,31,14,,,,,False,0,0,0,0,,
hoy,10/01/1986,1986,1,10,14,BAD,,,,False,0,0,0,0,,
hoy,24/01/1986,1986,1,24,18,CAC,Sequia,,Aldeanueva de la Vera,True,1,0,0,0,40.12982776803074,-5.698645993214258
hoy,16/03/1986,1986,3,16,19,CAC,Sequia,,Plasencia,True,0,0,0,0,40.03535535252543,-6.089134757182878
hoy,19/03/1986,1986,3,19,4,BAD,,,,False,0,0,0,0,,
hoy,07/07/1986,1986,7,7,19,CAC,,,,False,0,0,0,0,,
hoy,08/07/1986,1986,7,8,31,BAD,,,,False,0,0,0,0,,
hoy,13/07/1986,1986,7,13,19,CAC,Sequia,,Plasencia,True,1,0,1,0,40.03535535252543,-6.089134757182878
hoy,16/07/1986,1986,7,16,15,BAD,Sequia,,Badajoz,True,0,0,0,0,38.871034753836994,-6.975421049278072
hoy,18/07/1986,1986,7,18,12,BAD,Sequia,,Badajoz,True,1,0,1,0,38.871034753836994,-6.975421049278072
hoy,23/07/1986,1986,7,23,25,BAD,,,,False,0,0,0,0,,
extremadura,28/07/1986,1986,7,28,21,,,,,False,0,0,0,0,,
extremadura,30/07/1986,1986,7,30,6,,sequía,,Extremadura,True,0,0,0,0,,
hoy,06/08/1986,1986,8,6,5,BAD,,,,False,0,0,0,0,,
hoy,07/08/1986,1986,8,7,20,BAD,Sequia,,Piornal,True,0,0,0,0,40.11687556618928,-5.847427344153543
extremadura,17/08/1986,1986,8,17,2,,,,,False,0,0,0,0,,
hoy,18/08/1986,1986,8,18,11,BAD,,,,False,0,0,0,0,,
extremadura,19/08/1986,1986,8,19,11,,sequía,,Valle del Jerte,True,0,0,0,0,,
extremadura,19/08/1986,1986,8,19,14,,sequía,,Valencia de Alcántara,True,0,0,1,0,39.41026172958824,-7.244173555257091
extremadura,25/08/1986,1986,8,25,6,,,,,False,0,0,0,0,,
extremadura,27/08/1986,1986,8,27,24,,,,,False,0,0,0,0,,
hoy,28/08/1986,1986,8,28,20,CAC,Sequia,,Ahigal,True,0,0,0,0,40.1890939939129,-6.187514761591455
extremadura,31/08/1986,1986,8,31,10,,sequía,,Extremadura,True,1,1,0,0,,
extremadura,12/09/1986,1986,9,12,12,,inundado,,Medellín,True,0,0,1,0,38.96336247193119,-5.9576862600742135
extremadura,18/09/1986,1986,9,18,7,,,,,False,0,0,0,0,,
extremadura,11/06/1987,1987,6,11,35,,,,,False,0,0,0,0,,
extremadura,04/06/1987,1987,6,25,28,,sequía,,Badajoz,True,0,0,0,0,38.871034753836994,-6.975421049278072
extremadura,05/08/1987,1987,8,5,10,,sequía,,Provincia de Badajoz,True,0,0,1,0,,
extremadura,07/08/1987,1987,8,7,22,,,,,False,0,0,0,0,,
extremadura,21/09/1987,1987,9,21,14,,,,,False,0,0,0,0,,
extremadura,26/09/1987,1987,9,26,1,,inundaciones,,Cáceres,True,0,0,0,0,39.47753910519658,-6.377428325189714
extremadura,01/11/1987,1987,11,1,32,,,,,False,0,0,0,0,,
extremadura,04/11/1987,1987,11,4,13,,sequía,,Provincia de Badajoz,True,0,0,1,0,,
extremadura,12/12/1987,1987,12,12,10,,,,,False,0,0,0,0,,
extremadura,23/12/1987,1987,12,23,15,,sequía,,Provincia de Badajoz,True,0,0,1,0,,
extremadura,21/03/1988,1988,3,21,6,,sequía,,Extremadura,True,0,0,0,0,,
hoy,21/03/1988,1988,3,21,11,CAC,Sequía,,Cáceres,True,0,0,0,0,39.47753910519658,-6.377428325189714
extremadura,22/03/1988,1988,3,22,1,,,,,False,0,0,0,0,,
hoy,31/03/1988,1988,3,31,4,BAD,,,,False,0,0,0,0,,
hoy,02/05/1988,1988,5,2,12,BAD,Sequía,,Extremadura,True,1,1,0,0,,
hoy,03/05/1988,1988,5,3,15,BAD,,,,False,0,0,0,0,,
extremadura,19/10/1988,1988,9,19,2,,sequía,,Extremadura,True,0,0,0,0,,
extremadura,30/09/1988,1988,9,30,7,,,,,False,0,0,0,0,,
hoy,13/10/1988,1988,10,13,5,BAD,,,,False,0,0,0,0,,
hoy,13/10/1988,1988,10,29,29,BAD,Sequía,,Plasencia,True,0,0,0,0,40.03535535252543,-6.089134757182878
hoy,05/01/1989,1989,1,5,21,CAC,,,,False,0,0,0,0,,
hoy,07/01/1989,1989,1,7,18,CAC,Sequía,,Jaraíz de la Vera,True,0,0,0,0,40.06145730872112,-5.752227484611712
hoy,21/01/1989,1989,1,21,15,CAC,,,,False,0,0,0,0,,
hoy,28/01/1989,1989,1,28,27,BAD,Sequía,,Mérida,True,0,0,1,0,38.91549201670453,-6.341926065709169
hoy,12/02/1989,1989,2,12,1,BAD,Sequía,,"Badajoz, Extremadura",True,0,0,1,0,38.871034753836994,-6.975421049278072
hoy,13/02/1989,1989,2,13,16,BAD,,,,False,0,0,0,0,,
hoy,14/02/1989,1989,2,14,14,BAD,Sequía,,"Badajoz, Extremadura",True,1,1,0,0,38.871034753836994,-6.975421049278072
hoy,15/02/1989,1989,2,15,18,BAD,Sequía,,Valencia de Mombuey,True,0,0,1,0,,
hoy,15/02/1989,1989,2,15,20,BAD,Sequía,,Castuera,True,0,1,0,0,38.72435378925819,-5.545060273541743
hoy,17/02/1989,1989,2,17,24,BAD,,,,False,0,0,0,0,,
hoy,19/02/1989,1989,2,19,21,BAD,,,,False,0,0,0,0,,
hoy,28/02/1989,1989,2,28,14,CAC,,,,False,0,0,0,0,,
extremadura,01/03/1989,1989,3,1,11,,Sequía,,Malpartida de Cáceres,True,0,0,1,0,39.44606886667186,-6.505515540984494
extremadura,08/03/1989,1989,3,8,29,,,,,False,0,0,0,0,,
extremadura,10/03/1989,1989,3,10,8,,Sequía,,Extremadura,True,0,0,0,0,,
hoy,13/03/1989,1989,3,13,1,BAD,Sequía,,Sancti-Spítitus,True,0,0,1,0,,
hoy,13/03/1989,1989,3,13,8,DEP,,,,False,0,0,0,0,,
extremadura,14/03/1989,1989,3,14,1,,Sequía,,Cáceres,True,1,1,0,0,39.47753910519658,-6.377428325189714
hoy,14/03/1989,1989,3,14,1,BAD,Sequía,,Cáceres,True,1,1,0,0,39.47753910519658,-6.377428325189714
extremadura,14/03/1989,1989,3,14,3,,Sequía,,Cáceres,True,1,1,0,0,39.47753910519658,-6.377428325189714
hoy,14/03/1989,1989,3,14,17,CAC,Sequía,,Cáceres,True,1,1,0,0,39.47753910519658,-6.377428325189714
hoy,16/03/1989,1989,3,16,28,BAD,Sequía,,Castuera,True,0,1,0,0,38.72435378925819,-5.545060273541743
hoy,17/03/1989,1989,3,17,20,CAC,,,,False,0,0,0,0,,
extremadura,18/03/1989,1989,3,18,1,,,,,False,0,0,0,0,,
hoy,18/03/1984,1989,3,18,6,BAD,nieve,,Pasarón de la Vera,True,0,0,0,0,40.05142286565047,-5.820316765475152
hoy,20/03/1984,1989,3,19,1,CAC,sequía,,Provincia de Badajoz,True,0,0,1,0,,
hoy,22/03/1989,1989,3,22,10,BAD,,,,False,0,0,0,0,,
extremadura,23/03/1989,1989,3,23,25,,,,,False,0,0,0,0,,
hoy,26/03/1989,1989,3,26,29,BAD,,,,False,0,0,0,0,,
hoy,28/03/1989,1989,3,28,3,BAD,,,,False,0,0,0,0,,
hoy,28/03/1989,1989,3,28,15,BAD,Sequía,,Badajoz,True,0,0,0,0,38.871034753836994,-6.975421049278072
hoy,28/03/1989,1989,3,28,27,BAD,,,,False,0,0,0,0,,
hoy,29/03/1989,1989,3,29,26,BAD,,,,False,0,0,0,0,,
extremadura,30/03/1989,1989,3,30,26,,,,,False,0,0,0,0,,
hoy,16/07/1989,1989,7,16,25,BAD,,,,False,0,0,0,0,,
extremadura,16/07/1989,1989,7,16,45,,,,,False,0,0,0,0,,
extremadura,19/07/1989,1989,7,19,3,,Sequía,,Cáceres,True,1,0,0,0,39.47753910519658,-6.377428325189714
extremadura,19/07/1989,1989,7,19,12,,Sequía,,Valencia de Alcántara,True,0,0,1,0,39.41026172958824,-7.244173555257091
extremadura,19/07/1989,1989,7,19,34,,,,,False,0,0,0,0,,
hoy,20/07/1989,1989,7,20,9,CAC,Sequía,,Cáceres,True,0,0,1,0,39.47753910519658,-6.377428325189714
extremadura,22/07/1989,1989,7,22,35,,,,,False,0,0,0,0,,
hoy,24/07/1989,1989,7,24,12,BAD,,,,False,0,0,0,0,,
hoy,26/07/1989,1989,7,26,4,CAC,Sequía,,Cáceres,True,1,1,1,0,39.47753910519658,-6.377428325189714
extremadura,30/07/1989,1989,7,30,14,,Sequía,,"Zarza la Mayor, Cáceres",True,0,0,1,0,39.67722777656488,-6.619515589814323
extremadura,01/08/1989,1989,8,1,34,,,,,False,0,0,0,0,,
hoy,02/08/1989,1989,8,2,5,CAC,,,,False,0,0,0,0,,
hoy,02/08/1989,1989,8,2,24,BAD,,,,False,0,0,0,0,,
hoy,02/08/1989,1989,8,2,31,BAD,,,,False,0,0,0,0,,
hoy,03/10/1989,1989,8,3,40,BAD,Sequía,,Berlanga,True,1,0,0,0,38.281624439067805,-5.83037338505984
extremadura,04/08/1989,1989,8,4,14,,Sequía,,Plasencia,True,1,0,0,0,40.03535535252543,-6.089134757182878
extremadura,04/08/1989,1989,8,4,34,,,,,False,0,0,0,0,,
hoy,06/08/1989,1989,8,6,1,BAD,Sequía & Tormenta,,"Badajoz, Extremadura",True,1,0,1,0,38.871034753836994,-6.975421049278072
hoy,06/08/1989,1989,8,6,6,BAD,Sequía & Tormenta,,"Badajoz, Extremadura",True,1,0,1,0,38.871034753836994,-6.975421049278072
hoy,05/10/1989,1989,8,6,24,BAD,Sequía,,Zafra,True,0,0,0,0,38.42187307146895,-6.416697978031944
extremadura,08/08/1989,1989,8,8,3,,Sequía,,Cáceres/Badajoz,True,0,0,1,0,39.17428692951678,-6.676424687233894
extremadura,08/08/1989,1989,8,8,11,,Sequía,,Monroy (Cáceres),True,0,0,0,0,39.6370456021257,-6.2096451583339904
hoy,08/08/1989,1989,8,8,16,BAD,,,,False,0,0,0,0,,
extremadura,09/08/1989,1989,8,9,3,,Sequía,,Navalmoral de la Mata,True,0,0,1,0,39.890258676725125,-5.537981032967856
hoy,08/10/1989,1989,8,10,16,CAC,Sequía,,Plasencia,True,1,0,0,0,40.03535535252543,-6.089134757182878
hoy,10/08/1989,1989,8,10,24,BAD,,,,False,0,0,0,0,,
extremadura,13/08/1989,1989,8,13,6,,,,,False,0,0,0,0,,
extremadura,13/08/1989,1989,8,13,20,,,,,False,0,0,0,0,,
hoy,13/08/1989,1989,8,13,20,BAD,,,,False,0,0,0,0,,
hoy,13/08/1989,1989,8,13,31,BAD,Sequía,,Extremadura,True,1,0,1,0,,
extremadura,14/08/1989,1989,8,14,12,,,,,False,0,0,0,0,,
hoy,16/08/1989,1989,8,16,9,BAD,,,,False,0,0,0,0,,
extremadura,16/08/1989,1989,8,16,14,,,,,False,0,0,0,0,,
extremadura,17/08/1989,1989,8,17,14,,Sequía,,Cáceres,True,1,0,0,0,39.47753910519658,-6.377428325189714
hoy,18/10/1989,1989,8,18,1,CAC,Sequía,,Badajoz,True,0,0,0,0,38.871034753836994,-6.975421049278072
hoy,18/08/1989,1989,8,18,3,BAD,Sequía,,Mérida,True,0,0,0,0,38.91549201670453,-6.341926065709169
hoy,18/08/1989,1989,8,18,8,BAD,,,,False,0,0,0,0,,
hoy,18/10/1989,1989,8,18,9,BAD,Desbord- & Inund-,,Badajoz,True,0,0,0,0,38.871034753836994,-6.975421049278072
hoy,18/10/1989,1989,8,18,12,BAD,Sequía,,Feria,True,0,0,0,0,38.51161313869938,-6.563395428437351
hoy,18/08/1989,1989,8,18,32,CAC,,,,False,0,0,0,0,,
hoy,19/08/1989,1989,8,19,6,BAD,Sequía,,Cáceres,True,0,0,0,0,39.47753910519658,-6.377428325189714
hoy,20/08/1989,1989,8,20,34,BAD,,,,False,0,0,0,0,,
hoy,23/08/1989,1989,8,23,8,CAC,Sequía,,Cáceres,True,0,0,1,0,39.47753910519658,-6.377428325189714
hoy,24/08/1989,1989,8,24,4,BAD,Sequía,,"Mérida, Extremadura",True,0,0,1,0,38.91549201670453,-6.341926065709169
hoy,24/08/1989,1989,8,24,14,CAC,Sequía,,Badajoz,True,1,0,0,0,38.871034753836994,-6.975421049278072
extremadura,24/08/1989,1989,8,24,15,,Sequía,,Navalmoral de la Mata,True,1,0,1,0,39.890258676725125,-5.537981032967856
hoy,24/08/1989,1989,8,24,23,BAD,,,,False,0,0,0,0,,
hoy,25/08/1989,1989,8,25,3,BAD,Sequía,,Badajoz,True,0,0,1,0,38.871034753836994,-6.975421049278072
hoy,26/08/1989,1989,8,26,23,BAD,,,,False,0,0,0,0,,
hoy,28/08/1989,1989,8,28,3,CAC,,,,False,0,0,0,0,,
hoy,28/08/1989,1989,8,28,24,BAD,,,,False,0,0,0,0,,
hoy,30/08/1989,1989,8,30,27,BAD,,,,False,0,0,0,0,,
hoy,01/09/1989,1989,9,1,13,BAD,,,,False,0,0,0,0,,
extremadura,01/09/1989,1989,9,1,16,,Sequía,,Talayuela,True,1,0,1,0,39.98684994553757,-5.608117188120495
hoy,04/09/1989,1989,9,4,23,BAD,,,,False,0,0,0,0,,
extremadura,05/09/1989,1989,9,5,1,,Sequía,,Badajoz,True,1,0,0,0,38.871034753836994,-6.975421049278072
hoy,05/09/1989,1989,9,5,6,BAD,Sequía,,Badajoz,True,1,0,0,0,38.871034753836994,-6.975421049278072
extremadura,05/09/1989,1989,9,5,40,,Sequía,,Villanueva de la Serena,True,0,0,1,0,38.97505965210177,-5.798683762870277
extremadura,06/09/1989,1989,9,6,7,,,,,False,0,0,0,0,,
extremadura,-,1989,9,6,48,,Sequía,,Cáceres,True,0,0,0,0,39.47753910519658,-6.377428325189714
hoy,07/09/1989,1989,9,7,13,BAD,Sequía & Tormenta,,Almendralejo,True,0,0,0,0,38.68340240841623,-6.407120160184139
hoy,10/09/1989,1989,9,10,42,BAD,,,,False,0,0,0,0,,
hoy,13/09/1989,1989,9,13,8,BAD,Sequía,,Cáceres,True,0,1,0,0,39.47753910519658,-6.377428325189714
hoy,14/09/1989,1989,9,14,8,CAC,,,,False,0,0,0,0,,
hoy,15/09/1989,1989,9,15,5,BAD,Sequía,,Badajoz,True,1,0,0,0,38.871034753836994,-6.975421049278072
extremadura,16/09/1989,1989,9,16,36,,,,,False,0,0,0,0,,
hoy,17/09/1989,1989,9,17,16,CAC,Sequía,,"Feria, Badajoz",True,0,0,1,0,38.69132394626818,-6.769408238857712
extremadura,19/09/1989,1989,9,19,32,,,,,False,0,0,0,0,,
extremadura,19/09/1989,1989,9,19,40,,,,,False,0,0,0,0,,
hoy,20/09/1989,1989,9,20,33,BAD,,,,False,0,0,0,0,,
extremadura,24/09/1989,1989,9,24,23,,Sequía,,Navalmoral de la Mata,True,1,0,0,0,39.890258676725125,-5.537981032967856
hoy,25/09/1989,1989,9,25,40,BAD,,,,False,0,0,0,0,,
extremadura,28/09/1989,1989,9,28,47,,,,,False,0,0,0,0,,
hoy,29/09/1989,1989,9,29,36,BAD,,,,False,0,0,0,0,,
hoy,30/09/1989,1989,9,30,7,BAD,Sequía,,Plasencia,True,1,0,0,0,40.03535535252543,-6.089134757182878
hoy,30/09/1989,1989,9,30,13,CAC,Sequía,,Cáceres,True,0,1,0,0,39.47753910519658,-6.377428325189714
extremadura,06/10/1989,1989,10,6,38,,Sequía,,Valencia de Alcántara,True,1,1,0,0,39.41026172958824,-7.244173555257091
extremadura,11/10/1989,1989,10,11,22,,,,,False,0,0,0,0,,
hoy,02/11/1989,1989,11,2,7,CAC,,,,False,0,0,0,0,,
hoy,03/11/1989,1989,11,3,15,CAC,Sequía,,Cáceres,True,0,0,0,0,39.47753910519658,-6.377428325189714
extremadura,03/11/1989,1989,11,3,39,,,,,False,0,0,0,0,,
extremadura,06/11/1989,1989,11,6,12,,Sequía,,Cáceres,True,0,1,1,0,39.47753910519658,-6.377428325189714
extremadura,17/11/1989,1989,11,17,11,,Sequía,,Cáceres,True,0,0,0,0,39.47753910519658,-6.377428325189714
extremadura,18/11/1989,1989,11,18,3,,,,,False,0,0,0,0,,
extremadura,24/11/1989,1989,11,24,33,,Sequía,,Cáceres,True,0,0,0,0,39.47753910519658,-6.377428325189714
extremadura,26/11/1989,1989,11,26,55,,,,,False,0,0,0,0,,
hoy,04/12/1989,1989,12,4,4,CAC,,,,False,0,0,0,0,,
hoy,09/12/1989,1989,12,9,12,CAC,Sequía,,Zarza la Mayor,True,0,0,1,0,39.87691644793317,-6.861602854438933
extremadura,14/12/1989,1989,12,14,15,,Inund- & Sequía,,Cáceres,True,0,0,0,0,39.47753910519658,-6.377428325189714
extremadura,27/12/1989,1989,12,27,16,,,,,False,0,0,0,0,,
extremadura,05/04/1990,1990,4,5,54,,sequía,,Extremadura,True,0,0,0,0,,
extremadura,25/04/1990,1990,4,25,1,,,,,False,0,0,0,0,,
hoy,16/08/1990,1990,8,16,13,CAC,Sequia,,Monroy,True,0,1,0,0,39.6370456021257,-6.2096451583339904
hoy,21/08/1990,1990,8,21,10,CAC,,,,False,0,0,0,0,,
hoy,23/08/1990,1990,8,23,12,CAC,Sequia,,Plasencia,True,0,0,0,0,40.03535535252543,-6.089134757182878
hoy,29/08/1990,1990,8,29,4,BAD,,,,False,0,0,0,0,,
hoy,01/09/1990,1990,9,1,9,BAD,,,,False,0,0,0,0,,
hoy,03/09/1990,1990,9,3,5,BAD,Sequia,,Navalmoral de la Mata,True,0,0,0,0,39.890258676725125,-5.537981032967856
hoy,11/09/1990,1990,9,10,15,BAD,Sequia,,jaraiz de la Vera,True,0,0,0,0,40.06145730872112,-5.752227484611712
extremadura,12/09/1990,1990,9,12,36,,sequía,,Valencia de Alcántara,True,0,0,0,0,39.41026172958824,-7.244173555257091
extremadura,23/09/1990,1990,9,23,22,,,,,False,0,0,0,0,,
hoy,25/09/1990,1990,9,25,43,BAD,,,,False,0,0,0,0,,
extremadura,07/09/1991,1991,9,7,33,,,,,False,0,0,0,0,,
extremadura,26/09/1991,1991,9,26,26,,inundaciones,,Plasencia,True,0,0,0,0,40.03535535252543,-6.089134757182878
hoy,12/05/1993,1993,5,12,19,CAC,Inund- & Graniz-,,Torrejoncillo,True,0,0,0,0,39.89735427146394,-6.467041427683078
hoy,26/05/1993,1993,5,26,52,BAD,,,,False,0,0,0,0,,
